rank,rating,date,user,headline,body,helpful_count,images
33,5,2025.02.24,김*미,기대이상입니다,"작년 이맘때부터 로청 사고 싶어 보고 있던 모델입니다. 고가의 더 좋은 제품도 있지만 전기제품 좋은거 사도 세월을 이길 수 없는 듯 해 적당한 가격선을 선호하는 편입니다.  바닥에 물건만 치워주면 알아서 청소하네요. 물걸레도 만족스럽습니다. 이틀에 1번씩 2번 청소했는데 한번은 일부로 외출시에 청소시키고 나갔습니다. 전기세 걱정이 좀 되긴 합니다만 현재는 그 걱정을 불식 시킬만큼 만족스럽습니다. 저가 모델이긴 하지만 저한텐 큰 돈이라 망설였는데  구매 잘한 듯 합니다. 오늘 물걸레 추가 구입했고,  청소 후 물걸레는 떼서 따로 세탁 후 말려줬습니다. 현재까지는 모든게 만족스럽네요. 고장없이 오래 사용했으면 합니다. 추천합니다.",24.0,
34,5,2025.04.29,이*식,좋아요,"물걸레자동청소기중 저렴한 편이라 큰 기대 하지 않았는데
제법 잘 닦아요.
앱으로조절하는 것도 편하구요.
as도 받을수 있다니 다행이긴 합니다
이정도 성능과기능이라면 추천가능 합니다.",28.0,"https://thumbnail7.coupangcdn.com/thumbnails/local/320/image2/PRODUCTREVIEW/202504/29/2376046777542522572/8256839a-905f-4749-a884-cec3303db38d.jpg,https://thumbnail9.coupangcdn.com/thumbnails/local/320/image2/PRODUCTREVIEW/202504/29/2376046777542522572/8f4a3d91-981c-451b-b579-7e7b6168ca9e.jpg"
35,5,2025.06.09,KIM ****,너무좋음,"100평되는 학원에서 씁니다, 일을 너무잘해서 청부 아주머님도 이제 일주일에 5일이 아니라, 3일만 나오십니다",68.0,
36,5,2025.03.30,김*식,내돈내산,"유튜브로 로봇청소기 비교 영상 찾아보던중 발견한  이제품
샤오미 x20+로 로봇청소기 입문 했어요
장애물도 잘 피해다니고 사이드 브러쉬로 구석 구석 꼼꼼하게!
소음도 크지않고 물걸레 물통도 4L로 넉넉합니다
4가지 맞춤 진공청소와 물걸레모드
10초 자동 먼지비움과 물걸레 자동건조와 세척까지 !
세척시에는 조금 시끄럽습니다..^^
배터리 부족시에는 다시 돌아가서 충전 후
마지막 청소구역부터 다시 청소를 시작해주어요
40만원대로 아주 대만족!!",36.0,
37,2,2025.01.20,박철우,"만족스러운 가성비 중국산, 아쉬운 품질 보증 중국산",극한의 틈새까지는 모르겠으나 넓은 범위를 커버해 주기 때문에 사사로운 곳들만 건드려도 된다는 점에서 충분히 만족합니다. 예약을 걸어두면 매일 자동으로 돌아가니까 어느 정도 집이 관리되어 있어서 좋아요. 청소기가 소음을 신경 써야 한다는 게 잘못된 것 같습니다. 문제는 동작시킨 지 2주도 되기 전에 오수 흡입관이 막힌 건지 센서의 문제인지 흡입이 안되네요. 물이 고여 사용할 수가 없습니다. 샤오미 서비스 센터에서는 첫 전화에 프로그램을 초기화시켜 보라고 하였고 똑같이 흡입이 되지 않아 걸었던 두 번째 전화에는 대기자가 많다고 전화 연결이 거절당해 쿠팡에서 교환 처리 하였습니다. 구매 1달이 1주 정도 남았는데 이번에 오는 제품도 문제가 있으면 어떻게 되는지 모르겠네요.,53.0,https://thumbnail6.coupangcdn.com/thumbnails/local/320/image2/PRODUCTREVIEW/202501/20/6501932438302340846/fedcc9f5-e751-4f88-b77e-a6bea09af931.jpeg
38,5,2024.07.28,박*나,굉장히 만족스럽습니다,"평소 리뷰를 남기지 않는데 워낙 만족스러워서 남겼습니다. 오래 전 산 100만원대 로봇청소기를 사용했었다가 처분하고 직접 청소를 하려니까 .... 로봇청소기가 절실해져 알아보던 중 중국이모님이라고 불리는 샤오미 청소기로봇을 구매하게 되었어요. 10과 20을 고민하다가 흡입력이 더 좋다는것을 보고 20을 구매/
바닥이 금새 먼지바닥이 되는데  늘 뽀득한 바닥으로 지내니 기분이 좋고 일도 열심히 꼼꼼히 잘하는 모습에 돈이 아깝지 않아요ㅜ
얼른 추가 물걸레를 구매했고 바닥 먼지 청소를 자주 하니 기존 가구 위 먼지도 줄어들었어요. 청소 모드가 다양하고 설정이 쉬워 어머니께도 하나 사드리려고 합니다.",38.0,https://thumbnail7.coupangcdn.com/thumbnails/local/320/image2/PRODUCTREVIEW/202407/28/135343554186074016/913d2793-db8b-46c6-9752-85bb0eec4b46.jpg
39,4,2024.09.29,김*화,진짜 좋은데 가격이 제일 좋은 상품,"가격 저렴하지만 기능이나 성능은 절대로 저렴하지 않은 샤오미로봇청소기 입니다
폰이랑 연동되서 청소했는지 안했는지 확인가능해서 좋아요
친정에 사 드렸는데 잘 사용하고 계세요
전원  눌러두면 방방 주방 거실까지 돌아다니며 청소하고요 높지않은 문턱은 잘 넘어다녀요
청소끝나면 먼지 흡입해서 주머니같은 먼지봉투에 잘 모아두니 요것만 나중에 처리하면되서 연세드신 친정어머니 사용하시기 정말 좋아요
물걸레기능도 있는데 폐수통 관리 안되면 걸레냄새 난다는 후기가 있어 물걸레는 사용안하고 있어요
이틀 청소알림 안뜨면 전화해 청소기 눌러달라하면 되고 집도 깨끗해지고 진짜 잘 산제품이다 싶어요",37.0,
40,5,2024.08.02,관주위보,가성비 훌륭하네요.,"현재 에코백스 T10 옴니를 아주 만족스럽게 사용중이며,  어머니댁에 동일한 제품을 하나 설치해 드리고 싶었으나
쿠팡에서 T10 구매가 불가능해 T20와 샤오미 해당 제품을 놓고 고민하던중 샤오미 로청의 가성비가 너무 훌륭해 최종 샤오미로 낙점.
사용후기
1. QR로 제품 등록하고 사용준비하는건 T10과 비슷
2. 청소 브러쉬가 T10은 양쪽인 반면 샤오미는 한쪽에만 있으나 별 차이 못 느끼겠음
3. 집안 곳곳 탐색후 완성돤 도면을보니 거의 완벽함
4. 에코백스는 살짝살짝 범핑후 경로 변경하는반면 이 모델은 충돌 직전 멈춤 또는 회피. 매우 뛰어남.
5. 전반적으로 에코백스 T10과 이 모델을 놓고 비교하면 가격차이 고려시 샤오미 승.",159.0,
41,5,2025.04.12,정*주,너무 만족합니다.,"정말 왜 이제야 구매했는지 .. 너무 좋아요.
반신반의했는데 가격대비 완전 만족합니다.
삶의 질을 높여 주는 인생템입니다.
처음에 맵핑 조금 버벅거렸지만 곧 해결하고 청소하는 거 보면 기특하기만 합니다.",4.0,https://thumbnail9.coupangcdn.com/thumbnails/local/320/image2/PRODUCTREVIEW/202504/12/8818018714244193991/e7f0ebc9-5c28-446c-ae0f-26b353d88d5b.jpg
42,4,2024.08.08,김*정,울집에도 이모님이^^나름의 방식으로 이곳저곳 돌아다니며 열안하고 계신 이모님ㅋ물통도 크고 오수통도 커서 좋네요첫날은 안그랬는데 두번째 청소때는 걸레에서 냄새가 나는거 같아 빼서 말려야겠더라구요여분의 걸레와 소모품을 미리 사놔야겠어요카페트에 물걸레질을 하기 하지만ㅋ 발수건을 흡입해 난리도 피우지만 화장실문을 안닫음 들어가고 난리지만ㅋ집이 깨끗해지니 참는걸루요한번 써보니 왜 다들 사라고 하는지 알겠더라구요~~이모님 최고예요,"울집에도 이모님이^^
나름의 방식으로 이곳저곳 돌아다니며 열안하고 계신 이모님ㅋ
물통도 크고 오수통도 커서 좋네요
첫날은 안그랬는데 두번째 청소때는 걸레에서 냄새가 나는거 같아 빼서 말려야겠더라구요
여분의 걸레와 소모품을 미리 사놔야겠어요
카페트에 물걸레질을 하기 하지만ㅋ 발수건을 흡입해 난리도 피우지만 화장실문을 안닫음 들어가고 난리지만ㅋ
집이 깨끗해지니 참는걸루요
한번 써보니 왜 다들 사라고 하는지 알겠더라구요~~
이모님 최고예요",28.0,"https://video.coupangcdn.com/cloud/PRODUCTREVIEW/202408/8/4883283148702784732/f8acd810-ed65-4a90-a252-3f00e9891c85/transcode/thumbnail-00001.png,https://thumbnail10.coupangcdn.com/thumbnails/local/320/image2/PRODUCTREVIEW/202408/8/4883283148702784732/081ecbfd-ad39-4bb9-827d-efa84baa00e5.jpg"
43,5,2025.03.28,김*주,삶의 질 향상!,"매번 청소기 돌리고 걸레질하고…
청소했는데 또 먼지 있고;;;;
그런데 이건 자동으로 다 쓸어주고 닦아주고~~
삶의 질이 좋아졌어요 ㅋ
너무 편해요~ 다만 설정하는데ㅜ어려움이 있었고…
같은 자리를 여러번 닦는건 아직도 잘 모르겠어요 ㅋㅋ
설정하는 방법을 더 공부해야겟어요.. ㅋ",24.0,https://thumbnail7.coupangcdn.com/thumbnails/local/320/image2/PRODUCTREVIEW/202503/28/6887489614120669514/952a1756-3174-4243-994a-d1b8e7866dd0.jpg
44,4,2024.09.03,김*균,"가격대비 성능이 우수합니다. 100만원 중반대의 국내 청소기를 써보진 않았지만 이 정도의 기능이면 더 이상 높은 가격의 청소기가 왜 필요한지 모르겠습니다. 삼성 엘지 가전 너무 비쌉니다.다만 앱에서 한국어를 설정했으나 계속 영어로 중얼거려서 게시판에 문의했더니 하루 기다려 받은 답변이 고객센터에 문의하라니 내가 왜 하루 동안 수없이 답변 확인하러 들어갔는지 자괴감이 듭니다.뭐라 중얼거리는지 듣지 않아도 청소는 알아서 하니까 그냥 써도 되지만, 우리 한국인은 영어쯤은 제2 모국어지요, 다들 굳모닝 정도는 알잖아요. 중국어 아니라 그나마 다행.","가격대비 성능이 우수합니다. 100만원 중반대의 국내 청소기를 써보진 않았지만 이 정도의 기능이면 더 이상 높은 가격의 청소기가 왜 필요한지 모르겠습니다. 삼성 엘지 가전 너무 비쌉니다.
다만 앱에서 한국어를 설정했으나 계속 영어로 중얼거려서 게시판에 문의했더니 하루 기다려 받은 답변이 고객센터에 문의하라니 내가 왜 하루 동안 수없이 답변 확인하러 들어갔는지 자괴감이 듭니다.
뭐라 중얼거리는지 듣지 않아도 청소는 알아서 하니까 그냥 써도 되지만, 우리 한국인은 영어쯤은 제2 모국어지요, 다들 굳모닝 정도는 알잖아요. 중국어 아니라 그나마 다행.",28.0,
45,5,2024.11.09,김*주,혼자서도 잘 노네요 ㅋㅋ,"항상 물걸레 청소가  힝들어 이번에 로봇  청소기 구매 하였는데 여기 저기 다 돌아 다니며 잘  청소 하네요.  한번 청소 하는데 시간이 좀 걸리기는 하지만 그만큼 꼼꼼하게 청소  하는  거 겠죠.
오래도록 잘 청소해 주었으면 좋겠어요",68.0,"https://thumbnail9.coupangcdn.com/thumbnails/local/320/image2/PRODUCTREVIEW/202411/9/6840169788561143131/5f1b0512-cf5c-4326-980b-224b373ed6f5.jpg,https://thumbnail10.coupangcdn.com/thumbnails/local/320/image2/PRODUCTREVIEW/202411/9/6840169788561143131/63041688-ce07-401f-9227-b447871f82de.jpg"
46,5,2025.04.04,김*근,필오할때 적당한 가격에 나와 구매했는데 생각보다 좋아요걸래질도 좋고 받아서 설치하고 2일 사용했는데 만족하고 있어요,"필오할때 적당한 가격에 나와 구매했는데 생각보다 좋아요
걸래질도 좋고 받아서 설치하고 2일 사용했는데 만족하고 있어요",36.0,
47,5,2025.03.09,곽*주,너무너무 좋은 상품,"이게 웬일입니까
너무 너무 기대 이상이고 퇴근하고 집에오면 우렁각시 왔다간 느낌입니다.
서로 미루던 청소기...이젠 해결입니다.
발바닥이 보송보송 굿입니다.
내생활이 좀더 편안해졌네요.^^",53.0,
48,5,2024.07.21,김*애,가성비 좋아요,"물걸레를 빨아주는게 좋고.대신 건조하는데 너무 오래걸려서  저는 어느정도 충전되면 걸레만 떼서 햇볕에 건조하고  스위치오프합니다.ㅎ 전기세 걱정되서 매번 사용할때만 켜는데 걸레하나 건조하자고 몇시간씩 켜는게 싫어서요.
소음도 적고 청소도 잘되고 맘에 듭니다",38.0,"https://thumbnail10.coupangcdn.com/thumbnails/local/320/image2/PRODUCTREVIEW/202407/21/4469381309358415578/391ef754-3318-4d12-8e91-09bc830f93e9.jpg,https://thumbnail8.coupangcdn.com/thumbnails/local/320/image2/PRODUCTREVIEW/202407/21/4469381309358415578/6e74ba1b-9301-4736-8fb4-a4f6b02ed0f4.jpg"
49,5,2024.09.03,성*영,"정말 소문대로 대단한 이모님이세요 !!소음은 기존의 무선청소기 정도같아요. 그리고 정말 깨끗하고 뽀송뽀송하게 청소 잘 하십니다. 제가 하는거보다 오히려 더 깔끔하신것 같네요. ㅎㅎ한밤에는 조심스럽고 낮에는 뭐 누가 청소기 돌리나 하는 정도의 소리입니다.그런데 이모님이 영어로만 말씀하시더라구요. 갑자기 영어 듣기 평가하는 기분입니다.핸드폰 앱은 한글로 되는데,, 왜 자꾸 영어로 말씀하시는지...바꾸는 법 아시는 분 있나요??","정말 소문대로 대단한 이모님이세요 !!
소음은 기존의 무선청소기 정도같아요. 그리고 정말 깨끗하고 뽀송뽀송하게 청소 잘 하십니다. 제가 하는거보다 오히려 더 깔끔하신것 같네요. ㅎㅎ
한밤에는 조심스럽고 낮에는 뭐 누가 청소기 돌리나 하는 정도의 소리입니다.
그런데 이모님이 영어로만 말씀하시더라구요. 갑자기 영어 듣기 평가하는 기분입니다.
핸드폰 앱은 한글로 되는데,, 왜 자꾸 영어로 말씀하시는지...
바꾸는 법 아시는 분 있나요??",37.0,
50,5,2024.07.11,이*현,샤오미는 중국산이잖아,"100만원짜리 필요가없음
아이둘  모두  바닥전체가  식탁인 녀석들
치와와  1 털 겁나빠져서   퇴근하면 미용실 저리가라
이놈  어제받고  두 싸이클 돈거 같음
새집이 되었다
우렁각시다
진심 대만족   진작살껄
정신과  몇백 들이고 우울증 치료같은거 받던데   청소기를 사세요
직접적인 효과를 보실수 있습니다
아무튼  대단히 만족함 ....
ㅇ ㅏ..... 역시 신문물은....
나는 고민이 걸레가 과연 이었는데
걱정은 개나줘.... 너므좋아....",159.0,
51,5,2024.08.17,윤*영,무조건좋아요,왜 이제야삿을가 생각되는제품이네요 .구석구석 쏘파밑은 청소 잘 못했는데 얘는 티비 다이밑.쏘파밑도 들어가서 뱅뱅돌면서 깨끗하게 청소하고 나와서 이뻐서 뽀뽀 해주기싶은 심정이얘요.물걸레 청소할때 청소한부분지나갈때는 물걸레를 살짝들고 지나가서 못한부분은 물걸레를 바닥에 탁 내려서 빙글빙글 돌리면서 닦아나가요.너무 똑똑해요. 청소힘드신분들 강력추천합니다.,4.0,
52,1,2024.08.07,장*교,구매 7일 후 고장 AS받으려면 역곡에 가야함,"1.설치후 7일만에 충전단자 도킹못하고 미끄러져서 내려옴
2.고객센터에 문의하니 재 연동해 본 후 안되면 소프트웨어의 문제니 택배로 보내거나 로봇청소기 들고 구로셴터에 와서 점검 받아야 한다고 함(AS기사도 없고 서울에 AS센터는 구로뿐!!)
3.AS가 걱정되기도 했지만 가성비 생각하고 중국제품 구매했는데..
비용이 더 들더라도국산제품을 구매했어야  했음",28.0,https://thumbnail8.coupangcdn.com/thumbnails/local/320/image2/PRODUCTREVIEW/202408/7/3262283073377319981/07f841a5-1cf9-4b46-9e78-dc2f34fd1a8d.jpg
53,5,2024.11.24,오*현,구석구석은 안되나 좋은 이모님.ㅎㅎ,"벽에 가까이까지는 청소가 안되나 그외에는 촘촘하게 청소해요. 물걸레는 사람이 하는것처럼 안되지만 일반 먼지 정도는 충분해요.
개들을 많이 키워서 개털이 날려서 샀는데 개들도 반응없이 잘 받아들여줘서 만족합니다. 그만큼 소음이 없어서 그런거 같아요.",24.0,
54,5,2024.12.03,유*수,물걸레청소할때 물통 용량이 적당해요중간중간에 걸레를 빨아주니 더 깨끗해요하고나서도 걸래가 깨끗해요 ㅎ매일 청소기 돌리는데 먼지통 안비워도 되니 너무 편해요기능은 비슷하겠지만 샤오미가 가격도 좋고 스펙도 좋아요강추합니다!!!,"물걸레청소할때 물통 용량이 적당해요
중간중간에 걸레를 빨아주니 더 깨끗해요
하고나서도 걸래가 깨끗해요 ㅎ
매일 청소기 돌리는데 먼지통 안비워도 되니 너무 편해요
기능은 비슷하겠지만 샤오미가 가격도 좋고 스펙도 좋아요
강추합니다!!!",28.0,
55,5,2024.12.15,남부자,뛰어난 센서와 레이저를 사용하면 모든 것을 볼 수 있으며 Mi Home 앱에서 소음 수준을 조정할 수 있습니다.   성능도 좋고 기능도 좋고 가격도 적당해서 만족스럽습니다.,뛰어난 센서와 레이저를 사용하면 모든 것을 볼 수 있으며 Mi Home 앱에서 소음 수준을 조정할 수 있습니다.   성능도 좋고 기능도 좋고 가격도 적당해서 만족스럽습니다.,68.0,https://thumbnail6.coupangcdn.com/thumbnails/local/320/image2/PRODUCTREVIEW/202412/15/3298867337306676819/c42a119a-9b79-4c92-ba56-a0b9324f34ee.jpg
56,5,2024.07.09,안*규,가성비가 훌륭한 상품입니다.,물걸래도 잘 빨고 잘 딱고 왜 진작 사지 않았나 생각했습니다. 제마음은 그냥 좋습니다.,36.0,"https://thumbnail9.coupangcdn.com/thumbnails/local/320/image2/PRODUCTREVIEW/202407/9/1383963099570308979/805c5679-ef64-423f-9d45-95705b6eec84.jpg,https://thumbnail8.coupangcdn.com/thumbnails/local/320/image2/PRODUCTREVIEW/202407/9/1383963099570308979/816f099a-c3e1-4342-b918-f5b56eec70e3.jpg"
57,5,2024.12.21,도*영,가격대비 가성비 굿,"메이저 제품만큼 기대하면 안되지만
가격대비 만족
미홈 어플이 한글화 어색한부분 제외하고
기본기능만 쓴다면 만사 ok",53.0,https://thumbnail7.coupangcdn.com/thumbnails/local/320/image2/PRODUCTREVIEW/202412/21/1388120202766777126/fd36dd3c-cda3-4d16-919d-9f61893fcad7.jpg
58,5,2024.11.24,김*영,"솔직히 크게 기대 안하고 반신반의 하면서 샀습니다. 근데 너무 청소력이 뛰어나서, 이제는 이것만 씁니다. 집에 다이슨 무선청소기가 있는데, 그건 이제 세워두고 샤오미 로봇청소기만 잘 사용하고 있습니다. 만족합니다.","솔직히 크게 기대 안하고 반신반의 하면서 샀습니다. 근데 너무 청소력이 뛰어나서, 이제는 이것만 씁니다. 집에 다이슨 무선청소기가 있는데, 그건 이제 세워두고 샤오미 로봇청소기만 잘 사용하고 있습니다. 만족합니다.",38.0,
59,3,2025.03.08,박*아,가격이 가격대라 그런가 약간 멍청미가 돋보이는 청소기 같습니다.방문턱이 있는데 잘 못 넘어요. 집에 방이 3개가 있는데 희한하게 잘 가는 방이 있고 잘 안 가는 방이 있더라구요.지가 가고싶은데만 가는건지..ㅎㅎ첨엔 신기하고 재밌었는데 유용한가? 생각하면 그건 또 잘 모르겠네요.,"가격이 가격대라 그런가 약간 멍청미가 돋보이는 청소기 같습니다.
방문턱이 있는데 잘 못 넘어요. 집에 방이 3개가 있는데 희한하게 잘 가는 방이 있고 잘 안 가는 방이 있더라구요.
지가 가고싶은데만 가는건지..ㅎㅎ
첨엔 신기하고 재밌었는데 유용한가? 생각하면 그건 또 잘 모르겠네요.",37.0,
60,5,2024.07.21,백*화,와우,"샤오미 예전 로봇청소기 넘 오래되서 이번에 요거 들였는데 완전 신세계네요. 조용하고 청소도 잘하고 이뻐 죽겠어요!! 쿠팡에서 사니 배송도 빠르도 받자마자 돌려보니
넘 좋아요!! 아주 이뻐 죽겠음",159.0,https://thumbnail9.coupangcdn.com/thumbnails/local/320/image2/PRODUCTREVIEW/202407/21/4082851806169737235/62ea6509-1580-4099-8f09-297c6b0eea8e.jpg
61,4,2024.11.07,이*훈,가격대비 괜찮은것 같아요.,2주째 쓰고 있는데 대부분 만족합니다. 근데 청소를 했는데도 발에 뭔가 계속 묻어나오는 느낌이 있어요. 흡입력이 좀 부족해서 완전 제거가 되지 않아서 일까요?,4.0,
62,5,2025.01.15,김*희,생각했던거보다 잘 되고가격대비 가성비도 짱인듯요주위에 추천중이에요~,"생각했던거보다 잘 되고
가격대비 가성비도 짱인듯요
주위에 추천중이에요~",28.0,
63,5,2024.10.02,정*식,편해요,"사용법이 간단하고 편해요.
청소나 물걸레 기능도 우수하고..
단지 물을 좀 흘리지만거슬릴 정도는 아닙니다.
내구성만 만족할 수 있다면 최고의 가성비 제품입니다
적극 추천합니다",24.0,
64,5,2024.08.04,조*서,너무 좋아요,어제 받고 어플받아서 청소 했는데 내가 한거보다 성능이 더 좋아요. 정말 깨끗이  청소되여 아쉬운점은 아주 사각 구석은 청소가 안되는거 같아요.그건제가 물티슈로 청소하면 되니신경 안씁니다.,28.0,
65,5,2024.11.21,이*련,편리함,두번 사용했는데 신기하네요^^예약청소 설정하고 나왔는데 깨끗한 집을 만나겠죠~ 가성비 좋은거 같아요.,68.0,
66,5,2024.09.03,송*택,적극 추천합니다.,"가격대비 성능이 너무 만족스럽습니다.
롯데손해보험에 5년 AS 신청 했는데, 시어리얼 번호를 입력하라는데...
어디 있는지 못찾겠어요.
알려 주세요~~~~",36.0,
67,4,2024.09.07,김*필,앱설치 및 관리에 대한 어려움이 있어요~~,"오프라인상 제품설치등에 대한 실연을 접할 수 없다보니 어려움
유투버로 앱설치 및 기본운영.편집을 제작 배포하면 좋겠음",53.0,
68,5,2024.08.19,이*숙,정말 좋아요,"진작 살걸 후회했어요.
청소도 잘되고 아주 만족합니다.^^
단 걸레는 마르는데 시간 오래걸려서 그냥 빨아서 말려요
걸레가 작아서 이정도는 양호합니다~",38.0,
69,5,2024.08.30,박*윤,가격대비 실용적인 제품 입니다,진작에 구입해서 사용해볼걸 ^^설명이 필요없어요 질러~~~~,37.0,https://thumbnail8.coupangcdn.com/thumbnails/local/320/image2/PRODUCTREVIEW/202408/30/7952900858576993198/1d1b3715-7a05-4460-9a30-20bc48294979.jpg
70,5,2024.08.18,정*진,흡입력도 뛰어나고 물걸레기능도좋고 쓰레기비움과 걸레자동세척도 너무좋네요,흡입력도 뛰어나고 물걸레기능도좋고 쓰레기비움과 걸레자동세척도 너무좋네요,159.0,https://thumbnail9.coupangcdn.com/thumbnails/local/320/image2/PRODUCTREVIEW/202408/18/3109246640916074465/6b1b0769-3cef-4742-af3b-f69cc0ed8a90.jpg
71,5,2024.07.05,최*호,조작진짜쉽고 폰으로 연동 다됨 ㅎ,"앱으로 조작가능 못하는게 없네요
샤오미는 진짜 대박임",4.0,https://thumbnail9.coupangcdn.com/thumbnails/local/320/image2/PRODUCTREVIEW/202407/5/6226055834268770341/406589b4-989d-4852-abe5-d77df250f002.jpg
72,5,2024.07.20,천*화,가격대비 성능이 매우 훌륭합니다.,"가격대비 너무 좋은 제품을 산것 같습니다.
앞으로도 자주 이용하게 될 것 같네요",28.0,
73,2,2025.02.08,김*영,걸레 냄새,걸레질후 스스로 중간에 본체로 돌아가서 걸레를 세척하고 하느라 청소시간이 매우 김. 진공 청소도 말끔하지 않음.  그래서 진공청소 따로하고 걸레질하면 더욱 시간이 오래 걸림. 걸레질 한번하고 두번째 부터는 냄새가 남.,24.0,
74,5,2024.08.07,이*양,가격을 생각하면 매우 좋습니다. 가성비 좋은 상품이고 청소에서 해방되어 매우 좋아요,가격을 생각하면 매우 좋습니다. 가성비 좋은 상품이고 청소에서 해방되어 매우 좋아요,28.0,
75,5,2024.07.10,정*형,진짜 가성비 최고입니다.흡입력이 강력한데도 조용합니다.물걸레도 잘되고요최고네요,"진짜 가성비 최고입니다.
흡입력이 강력한데도 조용합니다.
물걸레도 잘되고요
최고네요",68.0,
76,5,2024.08.12,두*일,가성비 최고 별점 100개,너무 훌륭해요ᆢ이런 성능 이런 가격 훌륭합니다 ^^♡,36.0,
77,5,2024.12.18,강*진,가격대비 아주좋은재품입니다 아주똑똑한 물건인데요,,,
78,5,2024.08.17,LI ******,한글로 말하면 좋겠지만 나름 만족하고 쓰고 있습니다,,,https://thumbnail10.coupangcdn.com/thumbnails/local/320/image2/PRODUCTREVIEW/202408/17/5131617764512454250/7992481d-89a4-4a50-a982-b234280a0b36.jpg
79,5,2024.07.20,안*진,부모님이 아주 좋아하세요. 효도하세요,,,
80,5,2024.07.10,박*운,턱을 넘어가면 못 넘어와요,,,
81,5,2025.01.07,이*은,먼지 비울때 소리 엄청 커요.,,,
82,5,2024.10.07,배*경,로봇청소기 처음 사용중인데 완전 편리하네요,,,
83,5,2024.07.29,신*희,좋습니다.,굿굿굿,24.0,https://thumbnail9.coupangcdn.com/thumbnails/local/320/image2/PRODUCTREVIEW/202407/29/5582514150383455446/ce0cd42f-ccd4-4257-8fed-7a4a269bcb05.jpg
84,5,2024.09.24,고*완,배송 빠르고 좋아요,,,https://thumbnail8.coupangcdn.com/thumbnails/local/320/image2/PRODUCTREVIEW/202409/24/576477366119789246/0c9634b2-a439-4125-a2e5-07db32af6888.jpg
85,1,2024.09.20,이*예,오수통흡입력 불릉으로작동 안됨,교환를 해 주세요,68.0,
86,5,2025.04.27,손*철,좋아요,가격 착하고 사용중 고장만 없기를 바래요,36.0,https://thumbnail9.coupangcdn.com/thumbnails/local/320/image2/PRODUCTREVIEW/202504/27/1547723296921132432/a876d7bc-eda0-43c0-b98e-da151bf40bb2.jpg
87,5,2025.04.17,HON* *****,매우만족합니다,매우만족합니다,53.0,
