rank,rating,date,user,headline,body,helpful_count,images
84,5,2025.04.20,포원패밀리,"✨ 편리함과 효율성을 더하다! 샤오미 무선 충전기 사용 후기 ✨선으로부터의 자유: 편리한 충전 경험샤오미 무선 충전기를 사용하면서 가장 크게 느낀 장점은 단연 편리함입니다. 더 이상 충전 케이블을 찾아 헤매거나, 꽂았다 뺐다 하는 번거로움 없이 스마트폰을 충전 패드 위에 올려놓기만 하면 충전이 시작되니 정말 간편하더라고요. 특히 여러 대의 스마트 기기를 사용하는 저에게는 책상 위가 깔끔해지는 효과까지 있어 더욱 만족스러웠습니다. 자기 전에 침대 옆에 두고, 아침에 일어나 바로 사용할 수 있다는 점도 무척 편리했습니다.빠른 충전 속도: 답답함 없이 빠르게무선 충전은 느리다는 편견이 있었는데, 샤오미 무선 충전기는 빠른 충전 속도를 자랑합니다. 물론 유선 충전만큼 빠르지는 않지만, 일상생활에서 충분히 만족스러운 속도를 제공해 줍니다. 바쁜 아침 시간이나 잠깐의 휴식 시간에도 빠르게 배터리를 충전할 수 있어서 배터리 부족에 대한 불안감을 덜 수 있었습니다. 특히 고속 무선 충전을 지원하는 모델을 사용하니 더욱 빠른 충전 속도를 체감할 수 있었습니다.️ 스마트한 안전 기능: 안심하고 사용하세요 ️샤오미 무선 충전기는 단순히 편리하기만 한 것이 아니라 안전 기능까지 꼼꼼하게 갖추고 있습니다. 과전압 보호, 과전류 보호, 과열 보호 등 다양한 안전 기능을 통해 충전 중 발생할 수 있는 문제를 미연에 방지해 줍니다. 덕분에 안심하고 스마트폰을 충전할 수 있었고, 특히 밤새 충전해야 하는 경우에도 걱정 없이 사용할 수 있었습니다.세련된 디자인: 인테리어 효과까지 덤으로샤오미 무선 충전기는 성능뿐만 아니라 세련된 디자인 또한 매력적입니다. 깔끔하고 미니멀한 디자인은 어떤 인테리어에도 잘 어울리며, 책상 위나 침실 협탁 어디에 두어도 고급스러운 느낌을 더해줍니다. 슬림하고 컴팩트한 사이즈로 공간을 많이 차지하지 않는다는 점도 장점입니다. 다양한 디자인과 색상으로 출시되어 사용자의 취향에 맞게 선택할 수 있다는 점도 좋았습니다.합리적인 가격: 뛰어난 가성비마지막으로 샤오미 무선 충전기의 가장 큰 장점 중 하나는 합리적인 가격입니다. 뛰어난 성능과 편리한 기능, 세련된 디자인까지 갖추었음에도 불구하고 부담 없는 가격대로 구매할 수 있다는 점이 큰 매력입니다. 무선 충전을 처음 사용하는 사용자나, 여러 개의 무선 충전기가 필요한 사용자 모두에게 좋은 선택지가 될 수 있다고 생각합니다. 가성비를 중시하는 소비자에게 샤오미 무선 충전기는 최고의 선택이 될 것입니다.샤오미 무선 충전기를 사용하면서 삶의 질이 한층 높아진 것을 느꼈습니다. 편리함, 빠른 속도, 안전성, 디자인, 그리고 합리적인 가격까지 모든 면에서 만족스러운 제품이라고 감히 말씀드릴 수 있습니다. 무선 충전 경험을 고려하고 있다면 샤오미 무선 충전기를 강력하게 추천합니다!","✨ 편리함과 효율성을 더하다! 샤오미 무선 충전기 사용 후기 ✨
선으로부터의 자유: 편리한 충전 경험
샤오미 무선 충전기를 사용하면서 가장 크게 느낀 장점은 단연 편리함입니다. 더 이상 충전 케이블을 찾아 헤매거나, 꽂았다 뺐다 하는 번거로움 없이 스마트폰을 충전 패드 위에 올려놓기만 하면 충전이 시작되니 정말 간편하더라고요. 특히 여러 대의 스마트 기기를 사용하는 저에게는 책상 위가 깔끔해지는 효과까지 있어 더욱 만족스러웠습니다. 자기 전에 침대 옆에 두고, 아침에 일어나 바로 사용할 수 있다는 점도 무척 편리했습니다.
빠른 충전 속도: 답답함 없이 빠르게
무선 충전은 느리다는 편견이 있었는데, 샤오미 무선 충전기는 빠른 충전 속도를 자랑합니다. 물론 유선 충전만큼 빠르지는 않지만, 일상생활에서 충분히 만족스러운 속도를 제공해 줍니다. 바쁜 아침 시간이나 잠깐의 휴식 시간에도 빠르게 배터리를 충전할 수 있어서 배터리 부족에 대한 불안감을 덜 수 있었습니다. 특히 고속 무선 충전을 지원하는 모델을 사용하니 더욱 빠른 충전 속도를 체감할 수 있었습니다.
️ 스마트한 안전 기능: 안심하고 사용하세요 ️
샤오미 무선 충전기는 단순히 편리하기만 한 것이 아니라 안전 기능까지 꼼꼼하게 갖추고 있습니다. 과전압 보호, 과전류 보호, 과열 보호 등 다양한 안전 기능을 통해 충전 중 발생할 수 있는 문제를 미연에 방지해 줍니다. 덕분에 안심하고 스마트폰을 충전할 수 있었고, 특히 밤새 충전해야 하는 경우에도 걱정 없이 사용할 수 있었습니다.
세련된 디자인: 인테리어 효과까지 덤으로
샤오미 무선 충전기는 성능뿐만 아니라 세련된 디자인 또한 매력적입니다. 깔끔하고 미니멀한 디자인은 어떤 인테리어에도 잘 어울리며, 책상 위나 침실 협탁 어디에 두어도 고급스러운 느낌을 더해줍니다. 슬림하고 컴팩트한 사이즈로 공간을 많이 차지하지 않는다는 점도 장점입니다. 다양한 디자인과 색상으로 출시되어 사용자의 취향에 맞게 선택할 수 있다는 점도 좋았습니다.
합리적인 가격: 뛰어난 가성비
마지막으로 샤오미 무선 충전기의 가장 큰 장점 중 하나는 합리적인 가격입니다. 뛰어난 성능과 편리한 기능, 세련된 디자인까지 갖추었음에도 불구하고 부담 없는 가격대로 구매할 수 있다는 점이 큰 매력입니다. 무선 충전을 처음 사용하는 사용자나, 여러 개의 무선 충전기가 필요한 사용자 모두에게 좋은 선택지가 될 수 있다고 생각합니다. 가성비를 중시하는 소비자에게 샤오미 무선 충전기는 최고의 선택이 될 것입니다.
샤오미 무선 충전기를 사용하면서 삶의 질이 한층 높아진 것을 느꼈습니다. 편리함, 빠른 속도, 안전성, 디자인, 그리고 합리적인 가격까지 모든 면에서 만족스러운 제품이라고 감히 말씀드릴 수 있습니다. 무선 충전 경험을 고려하고 있다면 샤오미 무선 충전기를 강력하게 추천합니다!",16.0,
85,5,2024.10.09,깡총토끼,무선선풍기 너무좋네요,"무선이라 이리저리 갖고다니면서 틀어놓기 좋네요
충전기도 선풍기 바닥에 착 붙어서 편리합니당
그리고 날개가 이중 방식으로 되어있어서 바람이 더 센것같아요
무엇보다 소음이 없어서 좋고
각도 변경할때 부드럽게 움직여요~ 다른선풍기들은 탁탁 소리나면서 정해진 각도가 있는데, 이 제품은 자유자재로 조정가능하답니다
단점은 들고 옮길때 손잡이가 없어요ㅠ",15.0,"https://thumbnail9.coupangcdn.com/thumbnails/local/320/image2/PRODUCTREVIEW/202410/9/3193200413670108716/15599df2-2d4a-43bd-b231-03a77d6b84ea.jpg,https://thumbnail10.coupangcdn.com/thumbnails/local/320/image2/PRODUCTREVIEW/202410/9/3193200413670108716/599d72ef-ae95-4638-93d5-47237b49c89e.jpg,https://thumbnail6.coupangcdn.com/thumbnails/local/320/image2/PRODUCTREVIEW/202410/9/3193200413670108716/e7c95bd8-175a-43f7-835a-ca4700e6979d.jpg,https://thumbnail8.coupangcdn.com/thumbnails/local/320/image2/PRODUCTREVIEW/202410/9/3193200413670108716/8886c60e-a836-4106-ae21-4747e10e3274.jpg,https://thumbnail10.coupangcdn.com/thumbnails/local/320/image2/PRODUCTREVIEW/202410/9/3193200413670108716/94586f69-174f-427f-992a-aed8f486f11d.jpg"
86,5,2024.07.17,채*식,배송은 뭐 말해 뭐해요~~  쿠팡배송여자 혼자서도 조립 가능!!!!화이트 무광이 너무나도 고급스러워요~리모컨 없이 핸드폰 어플로 작동해서 불편하다 하시는 분들이 있는데..전혀요~ 전혀 불편하지 않고 리모컨 찾으러 가는 것 보다는 핸폰으로 조작하는게 더 편리하네요^^요즘같이 더운날 잘때 선풍기 켜놓으면 1단은 너무 쎈데자연풍으로 1 해놓으면 산들바람 느낌~~~~강추 또 강추 합니다!!!도움 눌러주세요^^모두 행복한 하루 되세요^^,"배송은 뭐 말해 뭐해요~~  쿠팡배송
여자 혼자서도 조립 가능!!!!
화이트 무광이 너무나도 고급스러워요~
리모컨 없이 핸드폰 어플로 작동해서 불편하다 하시는 분들이 있는데..
전혀요~ 전혀 불편하지 않고 리모컨 찾으러 가는 것 보다는 핸폰으로 조작하는게 더 편리하네요^^
요즘같이 더운날 잘때 선풍기 켜놓으면 1단은 너무 쎈데
자연풍으로 1 해놓으면 산들바람 느낌~~~~
강추 또 강추 합니다!!!
도움 눌러주세요^^
모두 행복한 하루 되세요^^",17.0,"https://thumbnail6.coupangcdn.com/thumbnails/local/320/image2/PRODUCTREVIEW/202407/17/3204542527364232523/cc669f70-be6e-424e-ada6-ac5d959da5ab.jpg,https://thumbnail8.coupangcdn.com/thumbnails/local/320/image2/PRODUCTREVIEW/202407/17/3204542527364232523/85e8636e-ab31-46f6-b960-52448b4027ce.jpg,https://thumbnail8.coupangcdn.com/thumbnails/local/320/image2/PRODUCTREVIEW/202407/17/3204542527364232523/d6c43a37-b7cf-43b1-a498-91fefaf35605.jpg,https://thumbnail7.coupangcdn.com/thumbnails/local/320/image2/PRODUCTREVIEW/202407/17/3204542527364232523/d8d292f7-5152-49d4-8779-7f1974b51ed3.jpg,https://thumbnail6.coupangcdn.com/thumbnails/local/320/image2/PRODUCTREVIEW/202407/17/3204542527364232523/29947ba1-224a-4574-b1a0-1df801c378f0.jpg"
87,5,2025.06.19,얌진진,진짜 성공한 소비,"자취 시작하며 여러 선풍기 구매해서 다 써봤는데요
이친구 진짜 요물입니다..
무선이 이렇게 편한거인줄 몰랐어요..
무선으로 사용하는것중에 젤 편하고 좋은것같습니다
풀충전하면 20시간 사용가능하다고 나와있는데
그건 아마 바람세기 1로 했을때 얘기일것같구요
바람 최대로 하면 그만큼 전력소모는 빨리되기때문에
사용가능한 시간은 많이 줄어들거예요!
전 거실에서는 충전기꼽은채로 사용하구 컴퓨터방이나 안방에서 사용할땐
약한바람으로 오래 사용할수있도록 합니다
어플통해서 조종도 가능한 제품이라 더 편하구요!
왜 샤오미 샤오미 하는줄 잘 몰랐는데
이친구 덕분에 알게되었어요..
진짜 가성비 갑갑입니다
남편이 하나 더 사서 컴퓨터실 전용으로 쓰고싶다네요 ㅋㅋㅋㅋㅋ
진짜 여름나기 걱정되시는분들 이 제품 한범 사용해보시길 추천드려요!!",7.0,https://thumbnail6.coupangcdn.com/thumbnails/local/320/image2/PRODUCTREVIEW/202506/19/1463516144491739007/eceb5fa3-5c05-4361-9d5b-23fcf52e6c47.jpg
88,5,2024.08.29,jh마미,무선 선풍기의 신세계를 경험,"장점
1. 무선이다
2. 버튼이 직관적이다
3. 디자인 깔끔
4. 충전하면서도 사용하기 편리
5. 바람 세기 4단계 매우 시원
6. 1-2 단계는 취침 시에 틀기 좋을 만큼 조용하고 부드러움
무선 선풍기 처음 써봤는데
집에 다이슨 선풍기 있는데 계속 무선만 손이 간다.
아이들 놀 때 그냥 옆에 가져다주면 되고
바람 세기도 적당해서 더울 때, 잘 때 모두 잘 활용 가능하다.",4.0,"https://thumbnail6.coupangcdn.com/thumbnails/local/320/image2/PRODUCTREVIEW/202408/29/7764047275045846597/886ea9f0-24af-401a-aa43-fd6d54d8e8fe.jpg,https://thumbnail10.coupangcdn.com/thumbnails/local/320/image2/PRODUCTREVIEW/202408/29/7764047275045846597/c6007857-44cf-40c5-ad78-1e92bf0360e9.jpg,https://thumbnail10.coupangcdn.com/thumbnails/local/320/image2/PRODUCTREVIEW/202408/29/7764047275045846597/66791ac4-36c8-428a-bbcb-3796941b465e.jpg,https://thumbnail6.coupangcdn.com/thumbnails/local/320/image2/PRODUCTREVIEW/202408/29/7764047275045846597/c3e59102-69af-48ed-8052-5649ce9dd6cd.jpg,https://thumbnail9.coupangcdn.com/thumbnails/local/320/image2/PRODUCTREVIEW/202408/29/7764047275045846597/83d316c9-2efc-4efd-9191-b95a4827cc76.jpg"
89,5,2023.06.05,김*현,BLDC 모터란?,"전동기는 전기적 입력을 받아 기계적 출력으로 전환시키는 기기입니다.
자계 속 전류가 흐르는 도선이 있다면 플레밍의 왼손법칙에 의해 힘을 받게되고 축이 고정되어있기 때문에 도체는 회전운동을 하게 됩니다.
BLDC 모터는 Brush Less Direct Current Motor 입니다.
콘센트의 교류입력을 컨버터를 통해 직류로 바꾼 후, 인버터에서 6개의 스위칭 소자를 통해 3상 교류전압으로 변환 후 3상 교류를 계자에 인가하여 회전자계를 만들게 되는데
이 때 회전자계는 120f /p (f= 주파수, p=극수) 의 속도와, 한 상의 최대 자계의 1.5배 크기로 회전하게 됩니다.
유도전돈기는 회전하는 자계(3상교류로 인한 가상의 회전자계)에 회전자가 그 속도의 1-s (s= 슬립)의 속도로 따라 회전하게 되는데,
이 회전계자형은 기계적으로 튼튼하고 회전부를 밀폐할 수 있어 많은분들이 좋아하시는 소음방지에 큰 도움이 됩니다.
어플리케이션에서 1~100단계 바람과 선풍기 머가리 회전각을 조정할 수 있고 집 밖에서도 핸드폰을 통해 제어할 수 있어 좋습니다.
여름철 샤워하고 화장실에 틀어놓으면 꿉꿉한 화장실도 안녕
잘 때 소리에 민감해서 맨날 거슬리는 소리속에서 자던 나도 안녕
쭝궈산은 안믿지만 샤오미 하나만큼은 믿을 수 있는 BLDC 모타 썬풍기
추천드립니다.",15.0,"https://thumbnail6.coupangcdn.com/thumbnails/local/320/image2/PRODUCTREVIEW/202306/5/3082333835794760007/ad52d092-580b-4be1-b1ea-aef7974793b0.jpg,https://thumbnail10.coupangcdn.com/thumbnails/local/320/image2/PRODUCTREVIEW/202306/5/3082333835794760007/b63d3772-398d-4e75-839a-e803951f0251.jpg,https://thumbnail10.coupangcdn.com/thumbnails/local/320/image2/PRODUCTREVIEW/202306/5/3082333835794760007/b327e26f-777f-477c-9527-c4fe18ce148f.jpg"
90,1,2023.06.14,오*균,"처음 받은 제품은 중간연결대가 결속이 안되서 그냥 빠지는 불량을 받아서, 바로 교환을 받았습니다. 그런데 2번째 받은 제품도 중간 연결대가 약간 문제가 있었지만, 첫번째 제품처럼 중간 연결대가 결속이 완전히 안되는건 아니고 약간 불안하지만 사용할만해서 그냥 교환안하고 사용하기로 했습니다. 나머지는 만족입니다. 뽑기만 잘 하신다면 좋을거 같습니다. 뽑기 화이팅","처음 받은 제품은 중간연결대가 결속이 안되서 그냥 빠지는 불량을 받아서, 바로 교환을 받았습니다. 그런데 2번째 받은 제품도 중간 연결대가 약간 문제가 있었지만, 첫번째 제품처럼 중간 연결대가 결속이 완전히 안되는건 아니고 약간 불안하지만 사용할만해서 그냥 교환안하고 사용하기로 했습니다. 나머지는 만족입니다. 뽑기만 잘 하신다면 좋을거 같습니다. 뽑기 화이팅",13.0,"https://thumbnail7.coupangcdn.com/thumbnails/local/320/image2/PRODUCTREVIEW/202306/14/923883997566058425/f2a5ef0d-f469-457e-8893-b453f4b80ad5.JPEG,https://thumbnail8.coupangcdn.com/thumbnails/local/320/image2/PRODUCTREVIEW/202306/14/923883997566058425/88e28da0-a11f-47e7-86cf-dd9c1bd68e24.JPEG,https://thumbnail8.coupangcdn.com/thumbnails/local/320/image2/PRODUCTREVIEW/202306/14/923883997566058425/8ce2c348-3814-4365-9c9c-1da1fec68868.JPEG,https://thumbnail9.coupangcdn.com/thumbnails/local/320/image2/PRODUCTREVIEW/202306/14/923883997566058425/6cf302cd-fe34-4a74-8a96-e1ecaa58fbab.JPEG,https://thumbnail7.coupangcdn.com/thumbnails/local/320/image2/PRODUCTREVIEW/202306/14/923883997566058425/0d3eb62c-b471-4d2c-836c-f90a2ccb9d0c.JPEG"
91,1,2023.07.03,dkssud1111,한달 반 사용 후기,"사용하던 선풍기가 고장나서 새로 구입하기 위해 알아보던 중, 본격적으로 더위가 시작된다는 뉴스를 보고 급하게 주문했습니다.
1. 무선선풍기
2. 소음
3. 디자인
순으로 적당한 선풍기를 찾고 있었는데 샤오미 선풍기 추천이 많아 구입하게 되었어요.
일단 전 하루종일 집에 머무르는 사람으로, 잠자는 시간이나 씻는 시간, 에어컨 트는 1-2시간 정도 외에는 늘 선풍기를 틀어놓고 생활하는데 충전은 하루에서 이틀에 한번 정도 하고 있어요. 충전기도 자력이 강해서 연결해놀은 충전기가 빠지는 불편함 같은게 전혀 없답니다.
선풍기나 에어컨 바람을 좋아하지 않아서 주로 자연풍 1-2단계로 설정해놓고 사용하는데 실제 밖에서 바람 부는 정도의 소리로 전혀 신경쓰이지 않습니다. 개인적으로 일반풍보다는 자연풍이 더 시원하고 소리도 작다고 느껴집니다. 두 가지 버전 다 3-4단계로 세기를 높였을 때는 어느정도 소음이 발생하긴 합니다.
디자인은 말할 것두 없이 완벽하게 예쁘지만 선풍기 밑판 재질이 먼지가 잘 쌓이는 듯 합니다.
한달반 정도 사용했는데 조립도 쉽고 아주 만족스럽게 사용하고 있습니다. (계속 사용하다조니 점점 배터리 지속시간이 짧아지는 것 같긴한데 조금 더 사용해봐야 정확히 알 수 있을 것 같아요)",1.0,"https://thumbnail10.coupangcdn.com/thumbnails/local/320/image2/PRODUCTREVIEW/202307/3/2046589590631304056/8792a653-7e4f-413d-b0c3-289458d364f5.jpg,https://thumbnail7.coupangcdn.com/thumbnails/local/320/image2/PRODUCTREVIEW/202307/3/2046589590631304056/a88490d6-40ab-4b3d-9d8b-af8ea847b7a7.jpg,https://thumbnail6.coupangcdn.com/thumbnails/local/320/image2/PRODUCTREVIEW/202307/3/2046589590631304056/2226f8e4-ce38-4eeb-9ebf-5c20523a5cdb.jpg"
92,5,2025.05.27,안*원,무선선풍기 하나쯤은 있어야~,"무선선풍기가 없어 어디껄 사나 고민하다가
또다시 샤오미로 선택.
사실 그 전에도 샤오미 무선 하나 샀었는데 배터리불량문제로 회수조치하여 다시 새로 구입하게 되었음.
그 전 것보다 좋아진 점은 끌 때 전원버튼이 한번에 눌린다는 것과 날개가 늘어났단 것이다.
그 전 꺼는 끌때 전원버튼을 아주 길게 누르고 있어야 꺼지는 불편함이 있었는데 시정됨.
디자인은 역시나 깔끔하고 예쁨.
왼쪽이 샤오미고 오른쪽은 가성비 유선 선풍기.
무선의 장점은 역시나 장소이동시 편리하단점.
늘 충전을 틈틈히 해둬야 좋음.
올 여름 잘 부탁해♡
-------------------------
사용하며 느낀 추가 후기 !
사실 구입 당시에는 싼거 두세개 사고 무선 사지말까 고민했었지만 실제 사용해보니 후회없이 잘 사용 중.
일단 풍속 1,2단이 무소음이라 밤에 틀고 자도 고요하니 좋음.
가장 큰 장점은 뭐니뭐니 해도 역시 무선이란 점.
역시 무선 선풍기 하나쯤은 있어야 맞다!",16.0,https://thumbnail7.coupangcdn.com/thumbnails/local/320/image2/PRODUCTREVIEW/202505/27/6257154539655949502/ca499881-bfae-412b-902a-b9a42e5e9252.jpg
93,5,2022.08.09,윤*미,샤오미 무선선풍기 2pro를 구매해야하는 3가지이유,"무선선풍기 구매를 결심하고 오랫동안 서칭하면서 샤오미2pro로 결정한 이유 (샤오미 시리즈가 워낙헷갈리게 나와있고 무적권 숫자높은것 구매를 방지하고자 하는목적)
1. 마그네틱 충전방식! 평범하지 않은날씨에 앉아서 머리를 바닥에 숙일생각만해도 짜증이 날것 같았고 이것에 대한 칭찬들이 너무많았기 때문에 이왕돈들여서 무선선풍기를 사는거 이정도 임팩트는 있어야할거같아서
BUT 선이 짧지는 않으나 매우길지는 않음
2. 상하조절(수동) 가능하고 1단 2단 봉 분리가 가능해 탁상용으로 사용가능
BUT 봉 분리가 가능해서 그런지 봉이 만질때 흔들림
상하조절 각도 크지않음
3. 어떻게 보면 가장중요한 한국정발 제품이라는점 !
1년동안 무상으로 AS가능하다는것+_+ 어플연결도 쉽고 (다른나라로 설정할필요X) AND 한국식220V인점 (유럽식220v는 조금 헐렁이는거 참고)
●● 공통된 장점으론 ○○
소음에대한 리뷰가 제각각이었는데 보통 3단으로 할때 평범한 가정용선풍기 1단수준
☆☆ 움직임 반경에따라 각도 조절이 가능하다는것(ex.주방)
야외에서도 애완동물님께 미세한 바람조절 가능하다는것",16.0,"https://thumbnail6.coupangcdn.com/thumbnails/local/320/image2/PRODUCTREVIEW/202208/9/8433490639728582736/c9f41a99-1df7-4ad6-86f6-cd0392e1d127.jpg,https://thumbnail10.coupangcdn.com/thumbnails/local/320/image2/PRODUCTREVIEW/202208/9/8433490639728582736/dd04adeb-3090-4ced-ae01-12523d874859.jpg,https://thumbnail8.coupangcdn.com/thumbnails/local/320/image2/PRODUCTREVIEW/202208/9/8433490639728582736/0043f4c5-61f0-4987-85c9-d5d9c370bb59.jpg"
94,5,2024.06.11,초코쿠키9,선풍기 하나로 행복...ㅋㅋㅋㅋㅋ,"소리 거의 없고 무선인게 이렇게 편하다니...ㅋㅋㅋ
너무너무너무 좋아여
특히 7개월 아기방에 주로 쓰고 있는데 간접풍 있어서 아가가 땀이 많이 나는데 계속 틀고 생활하기도 좋고ㅎㅎㅎ
추천해요 가격은 좀 있지만
어플로 제어도 가능하고
안살 이유 없는 샤오미 선풍기ㅎㅎ!!!",16.0,"https://thumbnail6.coupangcdn.com/thumbnails/local/320/image2/PRODUCTREVIEW/202406/16/6599907856661447466/738978f7-f1a6-41a2-a20f-4fc56a857b5b.jpg,https://thumbnail10.coupangcdn.com/thumbnails/local/320/image2/PRODUCTREVIEW/202406/16/6599907856661447466/cff24458-4969-4b0b-8b32-38c8766db532.jpg,https://thumbnail9.coupangcdn.com/thumbnails/local/320/image2/PRODUCTREVIEW/202406/16/6599907856661447466/7fe75253-d375-4692-9c5f-041a8c9449d5.jpg,https://thumbnail9.coupangcdn.com/thumbnails/local/320/image2/PRODUCTREVIEW/202406/16/6599907856661447466/fb17c12c-bf95-4e52-ad78-41e833705ff0.jpg,https://thumbnail8.coupangcdn.com/thumbnails/local/320/image2/PRODUCTREVIEW/202406/16/6599907856661447466/ec38922d-640d-478d-82d7-6db976c29ad0.jpg,https://thumbnail7.coupangcdn.com/thumbnails/local/320/image2/PRODUCTREVIEW/202406/16/6599907856661447466/abaaf250-954e-48ff-8f65-8ca2c3cec641.jpg"
95,1,2022.07.29,박*식,조립은 쉬움.장점 없음ㅡㅡ,"상품은 이미 누군가 뜯었던? 처음 받고 이미 실망한 상태..
이사로 바쁘고 정신 없어서 그냥 썼는데
진짜 내가 이걸 왜 샀지?
가격도 너무 어이가 없음 내가 샀을때 12만 5천백원 지금 가격보니 10만 9천원 장난?ㅋㅋㅋㅋ 너무 어이없어서 웃음만 나옴
고민하다가 가격 오르길래 더 오르기전에 그냥 사야겠다 했는데 너무 화가나서 정말..
시간도 너무 짧음.
충전 하면서 쓰면 상관없지만.. 무선의 장점은 '선이 없다' 라는건데 얼마 못감 진짜 뻥이아니고 시간 겁나 짧음ㅡㅡ 체감 시간 1시간. 정확한 시간은 안재봐서 모르지만 3시간이 겨우
그리고 먼지 타지말라고 선풍기 망 씌웠더니 정말 하나도 안 시원함 ㅡㅡ 아니 정말 너무 열받음 그리고 높낮이 조절도 안되고 그렇다고 리모컨이 있는것도 아니고 이사로 바빠서 제대로 확인 안한 내잘못도 있지만 박스 받았을때부터 맘에 안들었던거라 하..
그냥 보기에만 이쁨 말 그대로 이쁜 쓰레기.
무선의 장점도 못따라가고 충전하면서 써야 계속 쓰지 선풍기 먼지 타지 말라고 씌워논 망도 빼야하고 충전 한 채로 써야하는 아..이건 상품평 쓰면서도 화나네...
아 그리고 손잡이도 없어서 들고 옮기기도 불편함 ㅋㅋ아 이건 뭐 장점이 없네 ㅡㅡ",15.0,"https://thumbnail7.coupangcdn.com/thumbnails/local/320/image2/PRODUCTREVIEW/202207/29/6323720092557089398/70365c4b-b252-4ced-8b1a-01573b44b42a.jpg,https://thumbnail6.coupangcdn.com/thumbnails/local/320/image2/PRODUCTREVIEW/202207/29/6323720092557089398/8d12d6a9-4eae-440a-8db8-4878f72294de.jpg,https://thumbnail10.coupangcdn.com/thumbnails/local/320/image2/PRODUCTREVIEW/202207/29/6323720092557089398/3bd7fdc2-d393-4f11-8584-eb4aa179d02c.jpg"
