rank,rating,date,user,headline,body,helpful_count,images
34,5,2024.04.21,이*우,제품명 : 샤오미 스마트 BLDC 스탠딩 무선선풍기2 Pro PLDS03DM장점 :  무선선풍기여서 원하는 곳으로 이동이 편하고 충전할때 거치대에 얹으면 되서 플러그를 꽂았다 뺐다 안해서 좋아요~~이전 샤오미들도 충전다되면 선을 빼서 쓸수있지만  플러그선을 선풍기모터부분에 걸춰둬서 이쁘지 않았는데  이 제품은 사용할때 선이 안보여서 깔끔해서 좋아요^^구입이유 : 집에 샤오미선풍기가 세대별로 3대있어요~~마지막으로 구입한 샤오미선풍기가 이제품인데 만족하고 잘쓰고 있습니다.시댁에 오래된 선풍기 바꿔드리려고 장바구니에 넣고 있다가 가격좋아져서 얼른 구입했어요^^ 어머님도 주방에 들고가서 쓰실수 있다는 생각에 좋아하시네요ㅎㅎ가격이 들쑥날쑥하니 장바구니에 넣어두고 체크하시다가 사시길 추천드립니다~~~사진:  시댁으로 보낸거라 제품사진이 없어서 집에서 쓰고있는 같은 제품 사진과 동영상 남깁니다~ 쓰던제품이라 날개에 먼지가 많이 있네요;;엘지제습기랑 크기비교겸 같이 찍어봤어요~ 저는 집에 건조기자리가 없어서 빨래말릴때 제습기랑 선풍기를 같이 쓰다보니 항상 세트처럼 같은 공간에 있네요^^;버튼을 보시면 아래부터 전원 바람세기 회전 타이머 입니다~ 직관적으로 보이고 사용가능해서 편리해요~선풍기 바닥사진~ 콘센트선이 없어서 느므 깔끔♡ 이쁩니다~~충전하는 모습을 동영상으로 찍어보았어요~~~ 충전해야되면 빨강불이 들어와요~ 영상에서는 충전이 거의 된상태라 하얀불이 들어옵니다~곧 시댁에 가서 조립도 해드리고 사진도 찍어서 후기 추가할게요~~그리고 좀전에 남동생 입주선물로도 또 구입해서 보냈어요ㅎㅎ 제가 쓰는 건 예전에 다른 쇼핑몰에서 구입했지만 그만큼 저는 만족하는 제품입니다^^도움이 되는 리뷰가 되었으면 좋겠습니다 ♡24/5/5 후기추가: 시댁에 가서 조립해드리고 찍은 사진  첨부했어요~ 마지막 두장입니다~ 아버님은 기존 선풍기보다 날개가 왜이리 작은지 궁금해하시고 어머님은 좋아하시네요ㅎㅎ 좀더 지나서 어르신들 쓰시기에 어떤신지 후기 추가해보겠습니다~~,"제품명 : 샤오미 스마트 BLDC 스탠딩 무선선풍기2 Pro PLDS03DM
장점 :  무선선풍기여서 원하는 곳으로 이동이 편하고 충전할때 거치대에 얹으면 되서 플러그를 꽂았다 뺐다 안해서 좋아요~~
이전 샤오미들도 충전다되면 선을 빼서 쓸수있지만  플러그선을 선풍기모터부분에 걸춰둬서 이쁘지 않았는데  이 제품은 사용할때 선이 안보여서 깔끔해서 좋아요^^
구입이유 : 집에 샤오미선풍기가 세대별로 3대있어요~~
마지막으로 구입한 샤오미선풍기가 이제품인데 만족하고 잘쓰고 있습니다.
시댁에 오래된 선풍기 바꿔드리려고 장바구니에 넣고 있다가 가격좋아져서 얼른 구입했어요^^ 어머님도 주방에 들고가서 쓰실수 있다는 생각에 좋아하시네요ㅎㅎ
가격이 들쑥날쑥하니 장바구니에 넣어두고 체크하시다가 사시길 추천드립니다~~~
사진:  시댁으로 보낸거라 제품사진이 없어서 집에서 쓰고있는 같은 제품 사진과 동영상 남깁니다~ 쓰던제품이라 날개에 먼지가 많이 있네요;;
엘지제습기랑 크기비교겸 같이 찍어봤어요~ 저는 집에 건조기자리가 없어서 빨래말릴때 제습기랑 선풍기를 같이 쓰다보니 항상 세트처럼 같은 공간에 있네요^^;
버튼을 보시면 아래부터 전원 바람세기 회전 타이머 입니다~ 직관적으로 보이고 사용가능해서 편리해요~
선풍기 바닥사진~ 콘센트선이 없어서 느므 깔끔♡ 이쁩니다~~
충전하는 모습을 동영상으로 찍어보았어요~~~ 충전해야되면 빨강불이 들어와요~ 영상에서는 충전이 거의 된상태라 하얀불이 들어옵니다~
곧 시댁에 가서 조립도 해드리고 사진도 찍어서 후기 추가할게요~~
그리고 좀전에 남동생 입주선물로도 또 구입해서 보냈어요ㅎㅎ 제가 쓰는 건 예전에 다른 쇼핑몰에서 구입했지만 그만큼 저는 만족하는 제품입니다^^
도움이 되는 리뷰가 되었으면 좋겠습니다 ♡
24/5/5 후기추가: 시댁에 가서 조립해드리고 찍은 사진  첨부했어요~ 마지막 두장입니다~ 아버님은 기존 선풍기보다 날개가 왜이리 작은지 궁금해하시고 어머님은 좋아하시네요ㅎㅎ 좀더 지나서 어르신들 쓰시기에 어떤신지 후기 추가해보겠습니다~~",16.0,"https://video.coupangcdn.com/cloud/PRODUCTREVIEW/202404/24/5504009911559109716/5cb55349-1b20-4a2a-baf2-f317c1a8fd71/transcode/thumbnail-00001.png,https://thumbnail8.coupangcdn.com/thumbnails/local/320/image2/PRODUCTREVIEW/202404/24/5504009911559109716/09246487-e90b-4e70-bdc1-8af3d612dd2f.jpg,https://thumbnail10.coupangcdn.com/thumbnails/local/320/image2/PRODUCTREVIEW/202404/24/5504009911559109716/5312b346-ac34-4032-b61c-c44d853ffdda.jpg,https://thumbnail8.coupangcdn.com/thumbnails/local/320/image2/PRODUCTREVIEW/202404/24/5504009911559109716/9d74cc7d-c4de-4264-97d1-58ce6d8ffc0e.jpg,https://thumbnail6.coupangcdn.com/thumbnails/local/320/image2/PRODUCTREVIEW/202405/5/5504009911559109716/57ad048d-1c90-4d37-b63a-e66436260826.jpg,https://thumbnail7.coupangcdn.com/thumbnails/local/320/image2/PRODUCTREVIEW/202405/5/5504009911559109716/8e898156-4b5f-4d77-8da5-528e6c91ba3d.jpg"
35,5,2023.09.17,리뷰찬,"<짜나><선택 이유>집에 선풍기가 없어서 선풍기를 하나 구매해야 하는데,아파트에 살기 때문에 선풍기를 이곳저곳 옮겨 다니며 사용하는 경우가 많았습니다.이때마다 전선을 새로 꼽고 빼고 여간 번거로운 게 아닌데,무선으로 선풍기를 들고 다니며 사용할 수 있다고 하여지인의 추천으로 샤오미 스마트 BLDC 스탠딩 무선 선풍기 2 Pro를 구매하게 되었습니다.무선 선풍기를 사용하면 삶의 질이 달라진다고 하더라고요.막상 샤오미 스마트 BLDC 스탠딩 무선 선풍기 2 Pro를 사용해 보니 정말 삶의 질이 확 달라졌습니다.<구매 정보>저는 쿠팡에서 구매했으며익일 바로 배송되었습니다.박스 포장으로 배송되며, 파손된 부분 없이 안전하게 배송되었습니다.샤오미 스마트 BLDC 스탠딩 무선 선풍기 2 Pro 구성은 위와 같이 선풍기 본품 및 설명서입니다.<제품 특징>샤오미 스마트 BLDC 스탠딩 무선 선풍기 2 Pro의 특징을 간단하게 살펴보도록 하겠습니다.1. 무선사용 & 간편한 휴대성(선 없이 완전하게 무선으로 사용할 수 있기 때문에 필요한 곳 어디에서든 편하게 사용할 수 있습니다.)2. 더블 레이어 선풍기 날개를 통한 자연풍(7+5 더블 레이어 선풍기 날개로 부드럽고 가벼운 공기를 느낄 수 있습니다.)3. BLDC 모터(BLDC 모터를 통해 에너지를 절약할 수 있다고 합니다.)4. 긴 배터리 수명(최대 18시간까지 사용 가능한 괴물 같은 배터리 수명을 가지고 있습니다. 단, 표준모드로 1단계 속도로 사용할 경우이며, 4단계 속도로 사용한다면 최대 2.7시간까지 사용이 가능하다고 합니다.)5. 쉽게 조절 가능한 선풍기(회전 140도, 상하 39도 조절이 가능합니다.)6. Mi Home 앱을 사용하여 원거리 조작 가능(집에 들어가기 전 미리 선풍기를 켜 둘 수도 있고, 침대에 누워 선풍기를 편하게 조작할 수 있습니다.)<총평>샤오미 스마트 BLDC 스탠딩 무선 선풍기 2 Pro는충전만 한다면 무선으로 어디서든 편하게 사용할 수 있기 때문에캠핑을 즐겨 다니시는 분들에게 완전 너무나 적합한 선풍기라고 생각합니다.조립도 정말 간편하기 때문에 남녀노소 누구나 쉽게 조립할 수 있습니다.충전도 정말 빨리 되고, 완충 시 사용할 수 있는 시간도 굉장히 길기 때문에 너무 만족하며 사용하고 있습니다.무엇보다도 무선으로 어디든 들고 이동하며 사용할 수 있기 때문에샤오미 스마트 BLDC 스탠딩 무선 선풍기 2 Pro를 사용하면 삶의 질이 굉장히 달라집니다.샤워할 때 화장실 문 앞에 틀어놓으면 진짜 천국입니다.자기 전에 앱으로 예약 모드 설정해서 잘 수도 있고, 직접 일어나서 선풍기를 조작할 필요도 없기 때문에진짜 저는 샤오미 스마트 BLDC 스탠딩 무선 선풍기 2 Pro 너무너무 강추 드립니다.이번 여름 무선 선풍기를 구매하기 위해 고민 중이시라면샤오미 스마트 BLDC 스탠딩 무선 선풍기 2 Pro 진심으로 추천드리겠습니다.","<짜나>
<선택 이유>
집에 선풍기가 없어서 선풍기를 하나 구매해야 하는데,
아파트에 살기 때문에 선풍기를 이곳저곳 옮겨 다니며 사용하는 경우가 많았습니다.
이때마다 전선을 새로 꼽고 빼고 여간 번거로운 게 아닌데,
무선으로 선풍기를 들고 다니며 사용할 수 있다고 하여
지인의 추천으로 샤오미 스마트 BLDC 스탠딩 무선 선풍기 2 Pro를 구매하게 되었습니다.
무선 선풍기를 사용하면 삶의 질이 달라진다고 하더라고요.
막상 샤오미 스마트 BLDC 스탠딩 무선 선풍기 2 Pro를 사용해 보니 정말 삶의 질이 확 달라졌습니다.
<구매 정보>
저는 쿠팡에서 구매했으며
익일 바로 배송되었습니다.
박스 포장으로 배송되며, 파손된 부분 없이 안전하게 배송되었습니다.
샤오미 스마트 BLDC 스탠딩 무선 선풍기 2 Pro 구성은 위와 같이 선풍기 본품 및 설명서입니다.
<제품 특징>
샤오미 스마트 BLDC 스탠딩 무선 선풍기 2 Pro의 특징을 간단하게 살펴보도록 하겠습니다.
1. 무선사용 & 간편한 휴대성
(선 없이 완전하게 무선으로 사용할 수 있기 때문에 필요한 곳 어디에서든 편하게 사용할 수 있습니다.)
2. 더블 레이어 선풍기 날개를 통한 자연풍
(7+5 더블 레이어 선풍기 날개로 부드럽고 가벼운 공기를 느낄 수 있습니다.)
3. BLDC 모터
(BLDC 모터를 통해 에너지를 절약할 수 있다고 합니다.)
4. 긴 배터리 수명
(최대 18시간까지 사용 가능한 괴물 같은 배터리 수명을 가지고 있습니다. 단, 표준모드로 1단계 속도로 사용할 경우이며, 4단계 속도로 사용한다면 최대 2.7시간까지 사용이 가능하다고 합니다.)
5. 쉽게 조절 가능한 선풍기
(회전 140도, 상하 39도 조절이 가능합니다.)
6. Mi Home 앱을 사용하여 원거리 조작 가능
(집에 들어가기 전 미리 선풍기를 켜 둘 수도 있고, 침대에 누워 선풍기를 편하게 조작할 수 있습니다.)
<총평>
샤오미 스마트 BLDC 스탠딩 무선 선풍기 2 Pro는
충전만 한다면 무선으로 어디서든 편하게 사용할 수 있기 때문에
캠핑을 즐겨 다니시는 분들에게 완전 너무나 적합한 선풍기라고 생각합니다.
조립도 정말 간편하기 때문에 남녀노소 누구나 쉽게 조립할 수 있습니다.
충전도 정말 빨리 되고, 완충 시 사용할 수 있는 시간도 굉장히 길기 때문에 너무 만족하며 사용하고 있습니다.
무엇보다도 무선으로 어디든 들고 이동하며 사용할 수 있기 때문에
샤오미 스마트 BLDC 스탠딩 무선 선풍기 2 Pro를 사용하면 삶의 질이 굉장히 달라집니다.
샤워할 때 화장실 문 앞에 틀어놓으면 진짜 천국입니다.
자기 전에 앱으로 예약 모드 설정해서 잘 수도 있고, 직접 일어나서 선풍기를 조작할 필요도 없기 때문에
진짜 저는 샤오미 스마트 BLDC 스탠딩 무선 선풍기 2 Pro 너무너무 강추 드립니다.
이번 여름 무선 선풍기를 구매하기 위해 고민 중이시라면
샤오미 스마트 BLDC 스탠딩 무선 선풍기 2 Pro 진심으로 추천드리겠습니다.",15.0,"https://thumbnail6.coupangcdn.com/thumbnails/local/320/image2/PRODUCTREVIEW/202406/4/4619413578513847948/0adfa997-f544-4098-acb7-315d08ceb099.jpeg,https://thumbnail10.coupangcdn.com/thumbnails/local/320/image2/PRODUCTREVIEW/202406/4/4619413578513847948/d60dd385-a60f-484e-aaad-cfc2ebbde775.jpeg,https://thumbnail10.coupangcdn.com/thumbnails/local/320/image2/PRODUCTREVIEW/202406/4/4619413578513847948/9e4bc23b-7900-4eac-b527-402f063af3fb.jpeg,https://thumbnail8.coupangcdn.com/thumbnails/local/320/image2/PRODUCTREVIEW/202406/4/4619413578513847948/88d1e51c-3462-4587-af45-204521935c0c.jpeg,https://thumbnail10.coupangcdn.com/thumbnails/local/320/image2/PRODUCTREVIEW/202406/4/4619413578513847948/ec4e72aa-816d-4e18-8ffe-88e0c2fe0d6f.png,https://thumbnail9.coupangcdn.com/thumbnails/local/320/image2/PRODUCTREVIEW/202406/4/4619413578513847948/344ae063-ec65-4282-a7f4-4d7c32837020.jpeg,https://thumbnail8.coupangcdn.com/thumbnails/local/320/image2/PRODUCTREVIEW/202406/4/4619413578513847948/773a058d-7f41-43d3-a95f-5e18e6f194fc.jpeg,https://thumbnail8.coupangcdn.com/thumbnails/local/320/image2/PRODUCTREVIEW/202406/4/4619413578513847948/e35bd2b4-1c00-4aab-b775-ebbbcb4c2685.jpeg,https://thumbnail9.coupangcdn.com/thumbnails/local/320/image2/PRODUCTREVIEW/202406/4/4619413578513847948/58fde1df-cedc-4c1c-87ed-eab8e02b099d.jpeg,https://thumbnail8.coupangcdn.com/thumbnails/local/320/image2/PRODUCTREVIEW/202406/4/4619413578513847948/39779cd2-fee7-4048-b746-4735a3fa8661.jpeg"
36,5,2023.08.11,이*은,미로와 샤오미의 비교,"[상품명] 샤오미 스마트 BLDC 스탠딩 무선선풍기2 Pro
[상품특징]
테이블모드, 스탠드모드 (두가지 높이 조절 가능)
무선 사용으로 이동 편리(최대 18시간)
가볍고 부드러운 공기의 흐름(7+5 더블레이어 선풍기 날개)
140도 초 광각 회전 각도, 39도 상하조절
BLDC 모터
100 단계 속도 조절
충전 표시(베터리 잔량 표시 기능)
[상품후기]
집에 미로 무선 선풍기가 있어요.(MF03A)
무척 만족하며 사용하고 있었는데
선풍기 하나로는 더운 여름을 보내기가 힘들어서
아이 방에도 무선으로 하나 넣어 줄까싶어
여러 선풍기 중에 고민하고 또 고민해서 골랐습니다.
똑같은 걸 사기 보다 다른 종류의 비슷한 스펙을 가진 선풍기를 사고 싶더라고요.
그래서 후기 좋은 샤오미 무선 선풍기로 선택했습니다.
미로 선풍기 구매할 때도 샤오미 선풍기를 고민했었기도 하고요.
저같은 분들이 분명 있을 것 같아서 두가지 선풍기 비교 분석 해 봤어요.
사용해보니 두가지 선풍기가 각각의 장단점이 있었어요.
마지막에 선호하는 선풍기를 말씀 드릴게요!
상품의 특징들은 상품 설명에 상세히 나와있으니 참고하시고
두 선풍기를 사용해 본 차이점을 알려드릴게요!
1. 충전타입
미로 - C 타입을 꽂아서 충전
샤오미 - 충전하기 쉬운 마그네틱 충전(좌석처럼 붙이는 느낌)
-> 무선선풍기다보니 은근히 충전하는 방식에 따라 편리함이 많이 좌우돼요.
저는 꽂는 것 보다 마그네틱으로 붙는 충전 방식이 편리했어요.
2. 선풍기 날개
미로 - 7엽 날개
샤오미 - 7+5 더블 레이어 날개
-> 바람을 가장 낮춘 수면풍, 자연풍에 있을 때는 크게 차이가 없지만
가장 세기를 강하게 했을 때 확실히 샤오미 더블 날개가 시원함이 좋았습니다.
3. 리모컨 유무
미로 - 리모컨 있음
샤오미- 리모컨 없음
-> 샤오미는 리모컨 없이 핸드폰 앱으로 조정을 할 수 있어요.
미로 역시 앱으로 조정가능하지만 미로T를 별도로 구매해서 연동시켜야해요.
리모컨 유무 여부는 사용하는 사람에 따라 편리함이 다를 것 같아요.
4. 회전 각도
미로 - 회전 각도 4가지 맞춤 설정 기능(30,60,90,120) - 선풍기 자체에 버튼 & 리모컨사용
샤오미 - 회전 각도 5가지 맞춤 설정 기능(30,60,90,120,140) - 앱으로만 조정가능
-> 회전 각도가 밤에 잘 때 맞춤 설정이 필요한데 미로가 설정하기 더 편리했어요.
소음은 거의 비슷하게 조용했고
소음부분 때문에 이제 저렴한 선풍기를 사용 못하겠어요.
샤오미는 높낮이를 테이블용, 스탠드용 두가지로 조절할 수 있는데
스탠드용으로 사용하다보니 딱히 테이블용으로는 사용 안하게 되더라고요.
그래도 기능이 있으니 용도에 맞게 사용 가능하다는 장점이 있습니다.
결론적으로
거의 비슷한 가격에 구매했던 두 선풍기로 비교했을 때
저는 샤오미 무선 선풍기에 한표를 행사하겠습니다.
(지금은 미로 선풍기 가격이 많이 떨어졌지만, 제가 살 때는 샤오미와 가격이 비슷했음.)
결정적인 가장 큰 이유는
이중 날개 덕분인지 바람이 더 시원하고
배터리 수명이 더 오래가는 느낌이에요.
밤에 두 선풍기를 틀어 놓고
아침에 봤을 때 샤오미 선풍기가 끝까지 살아있는 경우가 많았거든요.ㅎㅎ
아무튼 누가 상주는 것도 아닌데
다른 분들 상품 구입하시는데 도움되시라고
리뷰에 열정을 쏟아 적어봤습니다.
도움이 돼요 눌러주시면
솔직한 리뷰 작성에 큰 힘이 됩니다.
후회 없는 소비 하시길 바랍니다.",17.0,"https://thumbnail10.coupangcdn.com/thumbnails/local/320/image2/PRODUCTREVIEW/202308/11/5660948794161762951/1f82f552-fff3-44bd-aba4-74af600b7064.JPEG,https://thumbnail7.coupangcdn.com/thumbnails/local/320/image2/PRODUCTREVIEW/202308/11/5660948794161762951/e97339c8-d3b2-42d1-82d8-1a7981eb0eaf.JPEG,https://thumbnail8.coupangcdn.com/thumbnails/local/320/image2/PRODUCTREVIEW/202308/11/5660948794161762951/5e012e0c-6de3-4834-a2a8-a59be31a6a48.JPEG,https://thumbnail9.coupangcdn.com/thumbnails/local/320/image2/PRODUCTREVIEW/202308/11/5660948794161762951/942f5c17-d72a-4dbd-b486-9421d7b61d62.JPEG,https://thumbnail7.coupangcdn.com/thumbnails/local/320/image2/PRODUCTREVIEW/202308/11/5660948794161762951/04bc4b13-89b0-4e31-84e5-cef97c43d0d6.JPEG,https://thumbnail7.coupangcdn.com/thumbnails/local/320/image2/PRODUCTREVIEW/202308/11/5660948794161762951/ff23828e-1a0e-446b-9cda-4a2e27e46d9a.JPEG,https://thumbnail8.coupangcdn.com/thumbnails/local/320/image2/PRODUCTREVIEW/202308/11/5660948794161762951/3addd691-25c3-47dd-beea-51bfc16462c1.JPEG,https://thumbnail6.coupangcdn.com/thumbnails/local/320/image2/PRODUCTREVIEW/202308/11/5660948794161762951/2341db82-a391-42bb-917a-0763eb2dbeef.JPEG,https://thumbnail7.coupangcdn.com/thumbnails/local/320/image2/PRODUCTREVIEW/202308/11/5660948794161762951/62aacef8-c981-4295-90c7-ffd5b8219dac.JPEG,https://thumbnail7.coupangcdn.com/thumbnails/local/320/image2/PRODUCTREVIEW/202308/11/5660948794161762951/2cea8388-106a-4dec-9d22-b4870514b740.JPEG"
37,5,2023.08.10,로켓크로스,조용한 선풍기! 품질보장!  두개나 샀어요!,"안녕하세요.
솔직한 리뷰만을 적기위해 노력하는 쿠팡 리뷰어입니다~^^
오늘도 솔직하고 담백한 리뷰를 남겨보도록 하겠습니다.
오늘 제가 리뷰할 제품은 샤오미 무선 선풍기'입니다!!!!!
처음에는 얼마나 좋겠어 라는 의문을 갖고
구매했지만, 너무 만족스럽습니다!!
장점을 나열해볼게요!!!
1.첫 번째 장점
빠른 배송!!!!!
정말 무지하게 빠른 배송 입니다!!!!
배송이 정~~~~말 빠릅니다.
전날 주문했는데 바로 다음 날 오더라구요.
쿠팡 로켓배송 사용할때마다 느끼지만
배송이 정말빠릅니다.
배송이 빨리 오면 기분이 좋더라구요!!!
아침에 일어나서 문을 열면 배송이 완료되어 있는 기분이란
다들 겪어 보셨으면 알듯 합니다.
급하게 사용할때 빠른 배송만큼 좋은게 없잖아요?
그래서 저는 꼭 리뷰를 볼때 배송이 빠른지를 확인합니다~!
제가 이번에 받은 상품은 배송이
정말 초 초 초고속으로 빨라서 마음에
쏙~~~들었습니다!!!!
2.두 번째 장점!!!
포장이 정말 깔끔하다!!!
요즘 배송을 시키면 포장이 엉망으로 오는 곳들이 많더라구요.
근데 여기는 포장이 항상 깔끔하게 옵니다.
포장이 너무 깔끔하게 잘 되어서 옵니다.
부피가 커서 어떻게 오려나 했는데
기스안나게 꼼꼼하게 포장이 되지만
쓰레기를 최소화 한것같아서 더 기분이 좋더라구요!!
3.세 번째 장점!!!!
무선 선풍기라는점!!
여름이 되면 선풍기 줄에 매번 걸리는 바람에
선풍기도 쓰러지고 저도 쓰러지는 일이 많았어요ㅠㅠ
그래서 선풍기도 깨져서 버리게 되고ㅠㅠ
그래서 결국 무선 선풍기를 구매해봤는데
진짜 후회없습니다.
줄이 없어 걸리지않으니 활동범위가 정말 넓어졌고,
넘어질 일 도 없습니다!!
4.네 번째 장점!!!
풍량조절!!
풍량조절이 진짜 섬세하게됩니다.
자연바람 형식으로도되고
세기도 섬세하게 컨트롤되서
너무 너무 좋았어요.
일반 선풍기는 약중강 밖에 없는데
이 선풍기는 섬세한 컨트롤이 가능하다보니
특히 아이들이 있는집이 좋습니다.
너무 춥거나 하지않고
조절이 가능하니 감기걸리지 않게
요긴하게 쓸것같네요!
5. 다 섯번째 장점!!!
가성비!!!
가성비가 정말 좋습니다.
요즘 이 퀄리티에 이 가격에 사기 너무 힘든거 아시자나요~?
퀄리티도 좋은데 이 가격이면 제 기준에는 가성비 잡은것 같습니다!!!!
풍량조절에 무선에 이 가격이면 충분히
구매 가치가 있어보이네요!
♡마지막 재구매의사♡
정말 정말 맘에 드는 제품입니다.
사무실에 하나 더 사서 올리는 제품입니다.
사무실에 놓으니 선이 없어 걸리지도 않고
이동도 편해서 너무너무 좋더라구요.
선 없는 선풍기 대박 입니다!!
제 리뷰가 마음에 드셨다면 좋아요 한번 눌러주시길 바랍니다~~~
감사합니다^^",7.0,"https://thumbnail8.coupangcdn.com/thumbnails/local/320/image2/PRODUCTREVIEW/202308/10/7163209824363176216/a3f3a914-7dd0-4e2f-a690-73fa5cdd4e28.jpg,https://thumbnail9.coupangcdn.com/thumbnails/local/320/image2/PRODUCTREVIEW/202308/10/7163209824363176216/6e3f6c05-b17e-4cae-a8a3-3ebe6818f0ce.jpg,https://thumbnail7.coupangcdn.com/thumbnails/local/320/image2/PRODUCTREVIEW/202308/10/7163209824363176216/37cdaf69-34c3-479a-a517-8ebccb330de5.jpg,https://thumbnail6.coupangcdn.com/thumbnails/local/320/image2/PRODUCTREVIEW/202308/10/7163209824363176216/b676872a-4d7b-40c7-8851-067962be333e.jpg,https://thumbnail7.coupangcdn.com/thumbnails/local/320/image2/PRODUCTREVIEW/202308/10/7163209824363176216/1ae92959-3006-491d-9415-f22c86fd8a6d.jpg,https://thumbnail8.coupangcdn.com/thumbnails/local/320/image2/PRODUCTREVIEW/202308/10/7163209824363176216/6a63661c-74fa-48f9-b622-edebaaa3b2da.jpg,https://thumbnail7.coupangcdn.com/thumbnails/local/320/image2/PRODUCTREVIEW/202308/10/7163209824363176216/05124de6-4194-43d7-a61d-2124a79d66d6.jpg,https://thumbnail6.coupangcdn.com/thumbnails/local/320/image2/PRODUCTREVIEW/202308/10/7163209824363176216/8bf21c52-8415-4a8f-9ee0-3708009740a7.jpg,https://thumbnail10.coupangcdn.com/thumbnails/local/320/image2/PRODUCTREVIEW/202308/10/7163209824363176216/c6664603-ede1-444a-9f28-7b4a65914b2d.jpg,https://thumbnail7.coupangcdn.com/thumbnails/local/320/image2/PRODUCTREVIEW/202308/10/7163209824363176216/125461a5-3bc7-4472-a793-08152e0ab36d.jpg"
