rank,rating,date,user,headline,body,helpful_count,images
1,5,2025.06.16,쇼핑왕루이,반려동물을 위한 스마트 선풍기,"조립이 정말 간단해서 박스 열고 설명서 한 번 훑어본 뒤, 10분도 안 돼서 완성했어요.
별다른 도구 없이도 쉽게 조립할 수 있어서 기계에 익숙하지 않은 분들도 어렵지 않게 설치할 수 있을 것 같아요.
높이 조절이 가능해서 사용 환경에 맞게 바람 방향을 조절할 수 있다는 점이 아주 마음에 들어요.
바닥에 낮게 두고 쓸 수도 있고, 조금 높여서 공기 순환용으로도 활용할 수 있어 실용적입니다.
가장 큰 장점은 무선이라는 점이에요. 충전해두면 거실, 방, 주방 등 원하는 곳으로 옮겨가며 사용할 수 있어서 너무 편리하더라고요.
무게도 부담스럽지 않아서 이동이 자유롭습니다.
소음도 거의 없어요.
자는 동안 틀어놔도 귀에 거슬리지 않을 정도로 조용하고, 바람도 부드러우면서도 충분히 시원해요.
선풍기 시끄러운건 정말 시끄럽잖아요
숙면하기에도 정말 좋아요.
풍량도 단계별로 다양하게 조절 가능하고, 회전 각도나 바람 방향도 샤오미 홈 앱을 통해 정밀하게 설정할 수 있어서 정말 편리합니다.
스마트폰으로 컨트롤이 가능하다는 점도 아주 유용해요.
사실 이 제품은 저희 집 반려 도마뱀을 위해 구입한 건데요,
혼자 집에 있는 시간이 많아서 공기 순환도 되고 적당히 시원한 환경을 만들어주기 위해 고민 끝에 선택했어요.
샤오미 스마트 캠과 함께 연동해서, 외출 중에도 앱으로 도마뱀의 상태와 실내 공기 흐름을 체크하고 조절할 수 있어 안심이 됩니다.
디자인도 샤오미답게 군더더기 없이 깔끔하고 모던해서 어느 공간에 놔도 잘 어울려요.
실용성과 디자인, 스마트한 기능까지 모두 만족스러운 제품이에요.
반려동물 있는 집이나 조용하고 깔끔한 선풍기를 찾으시는 분들께 강력 추천합니다!",1.0,"https://thumbnail6.coupangcdn.com/thumbnails/local/320/image2/PRODUCTREVIEW/202506/16/1098936075019791697/89c6d4a6-8aa0-47cf-891a-2e12e0fc5ddb.jpg,https://thumbnail6.coupangcdn.com/thumbnails/local/320/image2/PRODUCTREVIEW/202506/16/1098936075019791697/20eb3307-8611-485a-9825-590f19bfd1e0.jpg,https://thumbnail8.coupangcdn.com/thumbnails/local/320/image2/PRODUCTREVIEW/202506/16/1098936075019791697/74a6b9ab-9a69-4eeb-90fa-721cf3013b20.jpg,https://thumbnail7.coupangcdn.com/thumbnails/local/320/image2/PRODUCTREVIEW/202506/16/1098936075019791697/0393319a-f04c-48b8-8a4e-5208bd6f4a07.jpg,https://thumbnail6.coupangcdn.com/thumbnails/local/320/image2/PRODUCTREVIEW/202506/16/1098936075019791697/78905fb0-c68c-4cb1-b2a0-1d3ddf94018f.jpg,https://thumbnail9.coupangcdn.com/thumbnails/local/320/image2/PRODUCTREVIEW/202506/16/1098936075019791697/adee4f11-1208-4eed-95bd-b25e20140cf8.jpg"
2,5,2025.06.16,임*환,무선 선풍기는 꼭 장만하세요.,"@@ 하단 사용 후기 있습니다.
결혼 전 어려서 부터 부모님과 살 때
선풍기를 항상 꺼내두고 살았습니다.
땀이 많기도 하고
잘때 덥기도 하고
씻구나서 말기기 편하고
그런데 유선이니 불편해도
선풍기는 다 그렇지라며 유선으로 사용하고 있었습니다.
하지만 결혼 후 문득 어느날부터
아 .. 불편하다 싶었습니다.
그래서 이것저것 알아보고
가성비 좋기로 유명한 샤오미 무선선풍기로 구매했습니다.
이 상품 리뷰는 @@ 두번째 구매 리뷰 입니다.
첫번째 구매는 리뷰를 작성하지 않았는데
막상 사용하니 너무 편리해서 공유차 작성해둡니다.
부모님도 보시고 하나 사달라고 하셔서
구매 후 사용하고 계신데
이곳저곳 들고다니기 너무 편리하다며 좋아하십니다.
@@ 여기서부터 사용 후기
1. 흰색 인테리어와 어울리는 디자인
2. 생각보다 소음이 적음
3. 하지만 바람은 쌤
4. 회전시 드르륵 턱턱 걸리는 소리 없이 부드러움
5. 어플사용시 회전각도 조절가능 !!
6. @@ 무선으로 인한 자유도 !!
7. 하지만 아쉬운건 헤드 분리시 작은 나사분리의 귀찮음
8. 선풍기 대공이 너무 나약함, 너무 흔들거림
9. 처음 사용시 바닥면 미끄럼방지부분 기름이 뭍어남
10. 자석식 충전 탈착은 좋으나 보이질 않음
11. 그래서 @@ 저는 매직으로 색칠해서 위치 표시해둠
(부모님댁 선풍기는 안칠해둠)
없는 것 보다 있는게 더 편리한 제품입니다.
선풍기를 구매하신다면
유선으로 저렴하게 구매하는 것도 좋겠지만
이곳저곳 가지고 다니면서
유용하게 쓸 수 있는 무선 선풍기를 추천합니다.",16.0,"https://thumbnail7.coupangcdn.com/thumbnails/local/320/image2/PRODUCTREVIEW/202506/16/4318368531042829959/1e0fd542-26a6-49bd-a6fe-d1a40acc3b5e.jpg,https://thumbnail10.coupangcdn.com/thumbnails/local/320/image2/PRODUCTREVIEW/202506/16/4318368531042829959/314b503a-e1a0-470e-ac06-725bed86ec6a.jpg,https://thumbnail10.coupangcdn.com/thumbnails/local/320/image2/PRODUCTREVIEW/202506/16/4318368531042829959/02bab07d-bb2c-43eb-9dcb-f50bb4954b31.jpg,https://thumbnail8.coupangcdn.com/thumbnails/local/320/image2/PRODUCTREVIEW/202506/16/4318368531042829959/fb954bbf-9f8a-4bef-b707-6e190824a80c.jpg,https://thumbnail8.coupangcdn.com/thumbnails/local/320/image2/PRODUCTREVIEW/202506/16/4318368531042829959/68a4ade2-5987-4d28-b357-754b6b78c7d8.jpg,https://thumbnail8.coupangcdn.com/thumbnails/local/320/image2/PRODUCTREVIEW/202506/16/4318368531042829959/35b99ebe-aa24-4229-a493-df7b7c303b08.jpg"
3,5,2025.06.09,윤*진,너무 만족해서 4개째 구입중!,"⭐️4개째 내돈내산한 리뷰⭐️
첫구매는 2년전쯤 신혼집에서 구매 했었는데요
그때 엄청 더워서 집온도가 30도 넘고 했는데, 낮에 집에서 혼자 있는데 뭔가 에어컨 틀기는 아깝고 ㅋㅋㅋ
선풍기 매번 들고다니기도 쉽지 않고해서 남편이 샤오미에서 무선선풍기가 나왔다 해서 구매 했었습니다
처음엔 선풍기가 왜 이리 비싸!!했는데 완전 만족해서 잘 쓰다가
둘다 더위를 워낙 많이 타서 한개 더 구입 했습니다
특히 여름에 부엌에서 요리하면 너무 더웠는데 요 선풍기만 쓱 들고 가면 되니까 너무 좋더라구요 ㅋㅋㅋ
그때는 전세라 방에 다 에어컨이 있던게 아니라
집들이나 부모님 오셔서 주무시거나 할때 불편 했었는데,
이 선풍기때문에 잘 지냈습니다
✔️ 강아지한테도 찰떡 ㅋㅋㅋ
이젠 손님도 잘 안오고 해서 더위 장난아니게 많이 타는 우리집상전
포메아기한테 한개는 양보해서 쓰고 있습니다 ㅋㅋ
높이조절이 다양하진 않지만, 봉 하나 빼서 하우스 앞에 해주면 아이스패드 위에서 꿀잠 잡니다 ㅋㅋㅋ
✔️ 소음?
원래 서큘레이터를 썼어서 그런지 소음 진짜 없고 좋아요
2단까지는 진짜 킨 줄 모를정도, 3.4단은 바람세기가 있기때문에 소리가 있긴한데 와 소음진짜 이 정도 아닙니다 ㅋㅋㅋ
✔️ 어플이용가능
샤오미홈이라는 어플 깔아서 연동하면
회전각도도 더 디테일하게 조절 가능하고, 예약모드
특히 자다가 새벽에 갑자기 춥거나하면 끄러 일어나기 너무 귀찮은데,
어플로 온오프 가능 하니까 진짜 좋아요 ㅋㅋㅋ
최근에 친정부모님도 소음때문에 선풍기는 안킨다 하셨다가,
진짜 좋다고 말씀드려서 구매했구,
어쩌다보나 4개째 구매 해서 홍보중이네요 ㅋㅋㅋ
샤오미는 어쨌는 국내브랜드가 아니라 꺼려졌었는데
3년째 아무이상 없이 너무 편하게 잘 이용중이네요",16.0,"https://thumbnail10.coupangcdn.com/thumbnails/local/320/image2/PRODUCTREVIEW/202506/9/4354143626416892338/1ae44ecf-fe67-403d-8319-615a421f192e.jpg,https://thumbnail9.coupangcdn.com/thumbnails/local/320/image2/PRODUCTREVIEW/202506/9/4354143626416892338/91f61403-a03f-4e5f-8bf7-8b8bf0b19b84.jpg,https://thumbnail7.coupangcdn.com/thumbnails/local/320/image2/PRODUCTREVIEW/202506/9/4354143626416892338/1b1ab8f3-c13f-4b8b-a5bb-a15e1bf65faf.jpg,https://thumbnail6.coupangcdn.com/thumbnails/local/320/image2/PRODUCTREVIEW/202506/9/4354143626416892338/3ce0806b-037a-4913-a450-0d7f4c81aa3f.jpg,https://thumbnail9.coupangcdn.com/thumbnails/local/320/image2/PRODUCTREVIEW/202506/9/4354143626416892338/0fd1f43a-4acd-45b1-b58f-0ab510296e34.jpg"
4,5,2025.06.06,엄*호,좋아요,"샤오미 무선 스탠드 선풍기 2 Pro(BPLDS03DM)는 ‘무선’의 자유로움이 단연 최고 장점이었습니다. 무선이라 방, 거실, 화장실, 캠핑장 어디든 자유롭게 옮겨가며 사용 가능해, 콘센트 위치에 얽매이지 않아 매우 편리했어요 .
스마트폰 앱(Mi Home)과 연동돼 풍속, 풍향, 타이머, 키즈락, 자연풍 모드까지 원격으로 섬세하게 조절할 수 있다는 점도 만족스러웠습니다. 특히 100단계 미세 풍량 조절과 원격 꺼짐 기능은 밤에 깔끔하게 설정 후 껐는지 신경쓰지 않아도 되어 편리했어요 .
날개가 7겹·5겹으로 구성된 이중 구조 덕분에 바람이 부드럽고 자연스럽다는 것도 인상적입니다. 잔잔한 바람이라 아이가 잠들 때 틀어주기도 좋았고, 조용한 BLDC 모터가 소음 걱정 없이 사용하게 해줬습니다 .
충전 방식도 맥세이프 스타일의 자석 방식으로 손쉽게 결착되고 분리되어 편했고, 한 번 충전 시 약 4~5시간(약한 풍속 기준) 사용 가능해 실제 실내에서 쾌적한 바람을 오래 즐길 수 있었습니다 .
다만 높이 조절은 스탠드 두 가지 단계만 가능하고, 헤드 상하 조절이 수동이라는 점, 배터리 잔량이 불빛으로만 확인된다는 점은 약간 아쉬웠습니다 .
하지만 스마트 기능, 무선 편의성, 조용한 바람, 깔끔한 디자인을 모두 고려하면 꽤 훌륭한 선택이었습니다. 여름 동안 방 안팎에서 편하게 쓸 수 있는 스마트 무선 선풍기를 고민 중이라면 추천할 만한 제품입니다.",16.0,"https://thumbnail6.coupangcdn.com/thumbnails/local/320/image2/PRODUCTREVIEW/202506/6/1996082161328063636/812c47ff-8e04-493b-bbd9-3aa17336e85c.jpg,https://thumbnail8.coupangcdn.com/thumbnails/local/320/image2/PRODUCTREVIEW/202506/6/1996082161328063636/df831617-c78b-44c1-9da7-5ff7a2902a96.jpg,https://thumbnail6.coupangcdn.com/thumbnails/local/320/image2/PRODUCTREVIEW/202506/6/1996082161328063636/cb51a13d-d03d-4fba-9353-cc0e72565235.jpg,https://thumbnail6.coupangcdn.com/thumbnails/local/320/image2/PRODUCTREVIEW/202506/6/1996082161328063636/3f9b80ad-4ab0-4707-b3dc-08d66b19a79c.jpg,https://thumbnail8.coupangcdn.com/thumbnails/local/320/image2/PRODUCTREVIEW/202506/6/1996082161328063636/df19578d-2582-47a6-aee6-7ba09107d1d3.jpg,https://thumbnail10.coupangcdn.com/thumbnails/local/320/image2/PRODUCTREVIEW/202506/6/1996082161328063636/91b468b8-949c-41d3-8219-b930fcb5f44e.jpg"
5,5,2025.06.01,천만리뷰,"**요약: 무선, 초저소음, 스마트 제어까지! 여름 필수템 선풍기**---❄️ **바람보다 조용한 존재감, 샤오미 선풍기2 Pro**""켜놓고도 꺼진 줄 알았어요""이 말이 가장 많이 들리는 샤오미 무선 스탠드 선풍기2 Pro! ✅ 초저소음 BLDC 모터 덕분에 자다가 깰 일 ❌ 없고, 더위에 민감한 남편도, 잠귀 밝은 나도 동시에 만족하는 꿀잠 선풍기예요. 아이 키우는 집, 숙면이 중요한 분들에겐 진심 추천템이에요!❄️ **미니멀 끝판왕 디자인에 공간 활용까지!**화이트 톤 + 심플한 바디라인 = 어느 공간이든 무드업✨스탠드 기둥이 분리돼서 거실, 침실, 아이 방까지 장소 맞춤 세팅 가능!높낮이 조절도 편하고, 분리보관이 가능해 계절 지난 뒤에도 깔끔하게 정리돼요.❄️ **무선이 이렇게 편할 일?**전선 없이 여기저기 쓱쓱 이동 가능!캠핑, 베란다, 방방곡곡 이동하며 쓰기 딱이에요.게다가 자연풍 기준 최대 24시간 사용 가능이라 충전 걱정은 No\~마그네틱 충전 독으로 탁- 붙이면 충전도 간편하니까 더할 나위 없어요❤️❄️ **100단계 풍속 조절 + 앱 & 음성 제어까지**풍속이 100단계라니, 진짜 세밀하게 조절 가능해서 너무 좋아요.Mi Home 앱으로 원격 조정 가능하고, 구글홈 연동 시 음성 명령도 가능해요✨""선풍기야\~ 돌아!"" 하면 진짜 돕니다 ㅋㅋ게다가 키즈락 기능도 있어서 아이 있는 집엔 안성맞춤. 버튼 눌러도 무반응이라 안전함까지 챙김⚠️❄️ **아쉬운 점도 쪼\~끔은 있음*** 배터리 잔량은 LED 색상으로만 확인 가능 (퍼센트로 보고 싶다면 살짝 아쉬움)* 높이 조절은 두 가지 고정 포지션만 가능 (세밀한 높이 조절은 안됨)❄️ **총평: 감성 + 기능 + 조용함 다 잡은 여름템**요즘같이 더운 날씨엔, 켜놓고 있는지도 모를 만큼 조용한 샤오미 선풍기2 Pro 하나면 여름 준비 끝이에요! 무선이냐 유선이냐 고민 중이라면... 무선 무조건 추천입니다!---구매에 도움이 되었다면 아래  \[도움이 돼요] 버튼 꾹! 눌러주세요","**요약: 무선, 초저소음, 스마트 제어까지! 여름 필수템 선풍기**
---
❄️ **바람보다 조용한 존재감, 샤오미 선풍기2 Pro**
""켜놓고도 꺼진 줄 알았어요""
이 말이 가장 많이 들리는 샤오미 무선 스탠드 선풍기2 Pro! ✅ 초저소음 BLDC 모터 덕분에 자다가 깰 일 ❌ 없고, 더위에 민감한 남편도, 잠귀 밝은 나도 동시에 만족하는 꿀잠 선풍기예요. 아이 키우는 집, 숙면이 중요한 분들에겐 진심 추천템이에요!
❄️ **미니멀 끝판왕 디자인에 공간 활용까지!**
화이트 톤 + 심플한 바디라인 = 어느 공간이든 무드업✨
스탠드 기둥이 분리돼서 거실, 침실, 아이 방까지 장소 맞춤 세팅 가능!
높낮이 조절도 편하고, 분리보관이 가능해 계절 지난 뒤에도 깔끔하게 정리돼요.
❄️ **무선이 이렇게 편할 일?**
전선 없이 여기저기 쓱쓱 이동 가능!
캠핑, 베란다, 방방곡곡 이동하며 쓰기 딱이에요.
게다가 자연풍 기준 최대 24시간 사용 가능이라 충전 걱정은 No\~
마그네틱 충전 독으로 탁- 붙이면 충전도 간편하니까 더할 나위 없어요❤️
❄️ **100단계 풍속 조절 + 앱 & 음성 제어까지**
풍속이 100단계라니, 진짜 세밀하게 조절 가능해서 너무 좋아요.
Mi Home 앱으로 원격 조정 가능하고, 구글홈 연동 시 음성 명령도 가능해요✨
""선풍기야\~ 돌아!"" 하면 진짜 돕니다 ㅋㅋ
게다가 키즈락 기능도 있어서 아이 있는 집엔 안성맞춤. 버튼 눌러도 무반응이라 안전함까지 챙김⚠️
❄️ **아쉬운 점도 쪼\~끔은 있음**
* 배터리 잔량은 LED 색상으로만 확인 가능 (퍼센트로 보고 싶다면 살짝 아쉬움)
* 높이 조절은 두 가지 고정 포지션만 가능 (세밀한 높이 조절은 안됨)
❄️ **총평: 감성 + 기능 + 조용함 다 잡은 여름템**
요즘같이 더운 날씨엔, 켜놓고 있는지도 모를 만큼 조용한 샤오미 선풍기2 Pro 하나면 여름 준비 끝이에요! 무선이냐 유선이냐 고민 중이라면... 무선 무조건 추천입니다!
---
구매에 도움이 되었다면 아래  \[도움이 돼요] 버튼 꾹! 눌러주세요",15.0,"https://thumbnail9.coupangcdn.com/thumbnails/local/320/image2/PRODUCTREVIEW/202506/1/8497297301455715124/29c24f5e-63c8-443f-b406-f68bd70b79e5.jpeg,https://thumbnail7.coupangcdn.com/thumbnails/local/320/image2/PRODUCTREVIEW/202506/1/8497297301455715124/13b4ce7b-2828-48aa-aa36-41fa360a3142.jpeg,https://thumbnail6.coupangcdn.com/thumbnails/local/320/image2/PRODUCTREVIEW/202506/1/8497297301455715124/8d269be0-4125-42ed-84a7-b318fd9b8d7e.jpeg,https://thumbnail7.coupangcdn.com/thumbnails/local/320/image2/PRODUCTREVIEW/202506/1/8497297301455715124/f19ff9ce-2ce8-4851-a19e-dfe771f6873a.jpeg,https://thumbnail7.coupangcdn.com/thumbnails/local/320/image2/PRODUCTREVIEW/202506/1/8497297301455715124/1966cdae-cf34-4cb8-9129-402cf99af761.jpeg,https://thumbnail6.coupangcdn.com/thumbnails/local/320/image2/PRODUCTREVIEW/202506/1/8497297301455715124/535ad6a9-2c10-44fc-b366-fd0e1da0163c.jpeg,https://thumbnail10.coupangcdn.com/thumbnails/local/320/image2/PRODUCTREVIEW/202506/1/8497297301455715124/b210037b-b356-464a-baeb-fd36045c0443.jpeg,https://thumbnail9.coupangcdn.com/thumbnails/local/320/image2/PRODUCTREVIEW/202506/1/8497297301455715124/c4677fe6-22fd-4885-bbf3-f0bf5b854f30.jpeg,https://thumbnail7.coupangcdn.com/thumbnails/local/320/image2/PRODUCTREVIEW/202506/1/8497297301455715124/26d9bfe7-0d61-480a-850c-de2ae6df1119.jpeg,https://thumbnail10.coupangcdn.com/thumbnails/local/320/image2/PRODUCTREVIEW/202506/1/8497297301455715124/d5385735-c0e6-4390-bc79-11bfc2de00f5.jpeg"
6,5,2025.05.10,송*주,높이 조절·보관까지 되는 똑똑한 선풍기,"샤오미 선풍기 2 Pro는 처음 조립할 때부터 ‘깔끔하다’는 느낌이 들었어요. 구성품도 간결하고, 공구까지 동봉돼 있어 누구나 쉽게 조립할 수 있어요. 조용하고 바람이 부드러운 건 기본이고, 쓰면 쓸수록 ‘공간을 어떻게 활용할 수 있느냐’에 대한 디테일이 살아 있는 제품이라는 걸 느낍니다.
특히 마음에 들었던 건 스탠드 기둥이 분리형이라서 길게 세워도, 낮게 놓고도 사용할 수 있다는 점이에요. 침대 옆에 둘 땐 높이를 길게, 아이 옆에 둘 땐 짧게 조절해서 사용하는데 정말 유용해요. 거실, 침실, 아이 방 등 어디든 자유롭게 세팅 가능합니다.
또 하나의 장점은 쓰지 않을 땐 분리해서 접어 보관할 수 있다는 점이에요. 계절이 지나거나 며칠 외출할 때는 공간 차지 않도록 분해해서 넣어두면 깔끔하게 정리돼요. 흔히 선풍기는 '덩치 큰 가전'이라는 이미지가 있는데, 이건 쓰지 않을 때도 배려가 느껴집니다.
자연풍 모드는 특히 부드럽고, DC 인버터 모터라 하루 종일 틀어놔도 전력 소모가 적어요. 앱으로도 조작이 가능해서 리모컨이 없어도 불편하지 않았고, 무엇보다 디자인이 미니멀해서 공간을 더 깔끔하게 만들어주는 느낌이에요.
선풍기 하나로 사계절 내내 실용적으로 쓰고 싶은 분, 조용하고 효율적인 제품을 찾는 분께 강력 추천합니다.",17.0,"https://thumbnail7.coupangcdn.com/thumbnails/local/320/image2/PRODUCTREVIEW/202505/10/2425370520444865412/40c77fa4-eee7-44d6-aeff-fe89febd891f.jpg,https://thumbnail8.coupangcdn.com/thumbnails/local/320/image2/PRODUCTREVIEW/202505/10/2425370520444865412/def860e0-7b4a-466e-a1c4-c7cb64ca2b76.jpg,https://thumbnail10.coupangcdn.com/thumbnails/local/320/image2/PRODUCTREVIEW/202505/10/2425370520444865412/f95aad71-cc3f-4e4f-8ae2-728e30fd4563.jpg,https://thumbnail8.coupangcdn.com/thumbnails/local/320/image2/PRODUCTREVIEW/202505/10/2425370520444865412/1df5c7c8-c7f0-4dcf-a4fb-11b850ce4f81.jpg,https://thumbnail8.coupangcdn.com/thumbnails/local/320/image2/PRODUCTREVIEW/202505/10/2425370520444865412/3a39744e-cb26-4569-8e46-4c595ed9c759.jpg,https://thumbnail8.coupangcdn.com/thumbnails/local/320/image2/PRODUCTREVIEW/202505/10/2425370520444865412/7913ac6b-014f-4fe6-bdff-bec987e465bb.jpg"
7,5,2025.06.10,오아오아오,다 떠나서 디자인은 최고,"디자인 : 다른거 다 떠나서 솔직히 샤오미 제품이 디자인은 너무 깔끔하게 군더더기 없이 잘 뽑았다고 생각합니다. 심미적인 요소가 구매에 크게 작용하는 저로써는 매우 만족스럽습니다.
포장 : 견고하게 포장돼서 오니까 부속에도 스크래치등 문제 없이 받았습니다.
성능 : 솔직히 바람세기는 기대 이하입니다. 약한건 아니지만, 기존에 신일 서큘레이터를 써서 그런지 그거에 비하면 바람세기가 약하다고 해야할까, 바람의 종류가 다른느낌입니다. 은은하게 퍼지는 바람같은 느낌이며, 바람 세기 조절이 가능하니 단점이라고는 볼수 없겠네요. 직관 적인 바람세기를 비교 할 경우 약한 편이라고 볼수 있습니다.
시간, 회전, 바람세기 모두 준수하게 세팅되어 있고, 기본적인 기능에 대해서는 매우 만족스러운 성능을 보여줍니다.
조작 : 리모콘은 별도로 없지만 스마트폰이랑 연동이 되고, 미세 컨트롤까지 가능하기 때문에 아주 만족스럽습니다. 몸체에도 물리 버튼이 있으니 어떻게 써도 편리하게 사용 가능합니다.",7.0,"https://thumbnail7.coupangcdn.com/thumbnails/local/320/image2/PRODUCTREVIEW/202506/10/3376497757605633962/3317e597-eeca-4f50-99df-cb0d99b4346e.jpg,https://thumbnail8.coupangcdn.com/thumbnails/local/320/image2/PRODUCTREVIEW/202506/10/3376497757605633962/6f5cce3c-118f-490f-9a60-26255576313f.jpg,https://thumbnail6.coupangcdn.com/thumbnails/local/320/image2/PRODUCTREVIEW/202506/10/3376497757605633962/14ad3a52-74c3-42e1-a4d8-3d150cf5c7a8.jpg,https://thumbnail7.coupangcdn.com/thumbnails/local/320/image2/PRODUCTREVIEW/202506/10/3376497757605633962/a4a3bfe2-f660-4159-8302-2de6463135c9.jpg,https://thumbnail6.coupangcdn.com/thumbnails/local/320/image2/PRODUCTREVIEW/202506/10/3376497757605633962/6feb0329-ede0-44a0-b16c-c5a479343336.jpg"
8,5,2025.06.13,새콤달콤,샤오미 두번째 구입 후기 남겨요.,"샤오미 스마트 무선 스탠드 선풍기2
가성비 좋은 샤오미제품을 가끔씩 구매해서 사용했는데
대부분 만족스러웠어요.
작년까지 예전에 산 스탠드형 샤오미선풍기를 잘 쓰고있었어요.
어느날 갑자기 샤오미리콜하라는 연락을 받고
잘쓰던 선풍기를 돌려보냈어요.
이후에 선풍기를 이리저리 서치해봐도
샤오미여서 재구매했습니다.
제가 구입시 따져본 부분은
무선선풍기
스탠드형
단계조절이 최소 4단계 이상일것
아주 약한 바람기능이 있는것
디자인이 심플한것
소음이 적은것
이 모든걸 대부분 해결해주었던것이 샤오미였습니다.
지금 너무너무 잘쓰고 있구요.
아이가 잘때에 실내가 덥지 않아도 땀이 나는데
타이머 설정해두고 제일 약한 바람으로 해두면 딱 쾌적하게 잠들기 좋아요.
제가 제일 애정하는 기능입니다.
지금까지 충전도 간편하고
세척도 편리한 편이라 오래오래 잘 쓰도록 하겠습니다.",4.0,"https://video.coupangcdn.com/cloud/PRODUCTREVIEW/202506/13/5221160953831096990/ffcfde66-f6fb-452c-b9b2-3ca3301ee401/transcode/thumbnail-00001.png,https://thumbnail10.coupangcdn.com/thumbnails/local/320/image2/PRODUCTREVIEW/202506/13/5221160953831096990/2ee40143-24d7-46e1-ad7c-bb5890b8d4b3.jpg,https://thumbnail9.coupangcdn.com/thumbnails/local/320/image2/PRODUCTREVIEW/202506/13/5221160953831096990/d6c016d3-cb45-4a56-82cc-e4f000b22dbe.jpg,https://thumbnail10.coupangcdn.com/thumbnails/local/320/image2/PRODUCTREVIEW/202506/13/5221160953831096990/44af328f-db10-465e-a7bd-cbb26811d318.jpg,https://thumbnail9.coupangcdn.com/thumbnails/local/320/image2/PRODUCTREVIEW/202506/13/5221160953831096990/ad4dbae3-346f-41ed-b5dc-768c5b5ee327.jpg,https://thumbnail10.coupangcdn.com/thumbnails/local/320/image2/PRODUCTREVIEW/202506/13/5221160953831096990/8bf03588-f143-4cf9-b3af-bf6987f85e75.jpg"
