rank,rating,date,user,headline,body,helpful_count,images
200,1,2022.08.12,박*환,한국에서 AS안되는데 된다고 표시해놨네요.,"제품은 좋은데...사실상 한국에서 AS는 안됩니다.
아이 때문에 안전망 씌워놓은게 말려들어가서 날개가 파손되었는데 버려야 할 판이네요. 선풍기 날개 부품하나 유상으로도 안해주는데 어떻게 AS가 된다고 써놓은거죠?
샤오미 센터에 문의하니 사용자 과실로 인한 제품 고장이 AS가 안되는데, 그럼 제품이 혼자 고장난 것만 AS 해주면 반쪽짜리 AS아닌가요? 제품이 하자가 있는 걸 고쳐준다는게 무슨 의미가 있는건지...
현재 올려놓은 사진으로는 그냥 AS가 되는 것처럼 올려 구매자를 사실상 속이네요.
전화 문의했더니 계속 같은 답변만 보내오고 엄청 실망입니다.",13.0,
201,3,2025.04.20,김*라,이거보다 전 버전을 쿠팡에서 구매해서 잘 쓰고 있다가리콜로 인해 수거해가서 쿠팡에서 새로운 버젼을 구매했습니다.웬만하면 귀찮아서 리뷰 안쓰는데 ...샤오미 홈 어플을 등록하는데 애 먹었어요.이전 버전 선풍기는 어플 다운받고 연결까지 한번에 무난하게 되었는데 이 제품은 싱가포르로 국가 설정을 해야하네요.어플 업데이트도 안내가 없다보니 안되는거 잡고 계속 반복하고 ㅉㅉ국가 변경 하고서도 안돼서 기존 어플 삭제하고 다시 받아서 하고 .. 암튼 최신버전이 이전보다 더 불편하게 되는지 의아.. ㅋㅋ등록된 후로는 전처럼 어플로 상세설정하고 좋습니다^^ 후후,"이거보다 전 버전을 쿠팡에서 구매해서 잘 쓰고 있다가
리콜로 인해 수거해가서 쿠팡에서 새로운 버젼을 구매했습니다.
웬만하면 귀찮아서 리뷰 안쓰는데 ...샤오미 홈 어플을 등록하는데 애 먹었어요.
이전 버전 선풍기는 어플 다운받고 연결까지 한번에 무난하게 되었는데 이 제품은 싱가포르로 국가 설정을 해야하네요.
어플 업데이트도 안내가 없다보니 안되는거 잡고 계속 반복하고 ㅉㅉ
국가 변경 하고서도 안돼서 기존 어플 삭제하고 다시 받아서 하고 .. 암튼 최신버전이 이전보다 더 불편하게 되는지 의아.. ㅋㅋ
등록된 후로는 전처럼 어플로 상세설정하고 좋습니다^^ 후후",1.0,
202,5,2024.09.19,내돈내산님,무선 선풍기 짱,"선 구애없이 이리 저리 자리 옮기면서 써 보시면
유선 선풍기 다신 못 씁니다ㅋㅋ
세상 편하거든요~~~~
대신 충전을 상시 해 놓아야한다는 단점은 있어요!
# 소음
약풍 시 매우 조용해서 기존 유선 선풍기가 이렇게 시끄러웟엇구나! 깨달을 수 있고, 가끔 넘 조용해서 킨 건 가? 한 참 째려보면 선풍기 날개가 돌고 잇는 걸 확인 후 아 켜 있구나 합니다ㅎ
# 단점
굉장히 높은 선풍기에요 목이 긴?
그래서 하늘 방향으로 틀어서 살에 안 닿게 틀면 참 좋은데
낮게 사용하시는 분은 이게 단점으로 느껴질 수도 잇으려나 싶네요
종종 충전을 해야지 필요할 때 딱 킬 수 잇다는!",16.0,
203,5,2022.07.27,전*순,좋아요!!,"무선이라 편하구요
일단이단 분리되서 침대없는 저희는
잘쓰고있어요
무선시간도
대략3-4시간이라 안쓸땐
충전해놔서!!!편하게 쓰고있어요",16.0,"https://thumbnail10.coupangcdn.com/thumbnails/local/320/image2/PRODUCTREVIEW/202207/27/4349418501367290374/5d6e671f-ca18-4e5c-9460-1d5d6bcce71f.jpg,https://thumbnail6.coupangcdn.com/thumbnails/local/320/image2/PRODUCTREVIEW/202207/27/4349418501367290374/5150a7dc-0867-4c19-a6a5-80f3b34907b3.jpg,https://thumbnail9.coupangcdn.com/thumbnails/local/320/image2/PRODUCTREVIEW/202207/27/4349418501367290374/b1722879-dc67-4eac-8622-409ee5ea5b8a.jpg"
204,5,2024.04.15,쭈랑꾸,이걸 왜 이제 샀을까....,"맨날 2만원짜리 선풍기사면서
에이 이정도는 소리 안큰거지 이러고 살았는데
오늘 이 선풍기를 만나고 신세계를 영접했습니다...
틀어놓은지도 모를 정도로 너무 조용하더라고요
그리고 바람세기도 100단까지 디테일하게 가능하규
리모컨없이 폰으로도 모든게 조정가능하기때문에
자기전에 이동안하고 폰으로 슫삭 ㅎㅎㅎㅎ
그리고 배송도 하루만에오니까 ㅠㅠㅠ넘좋네요",16.0,"https://thumbnail9.coupangcdn.com/thumbnails/local/320/image2/PRODUCTREVIEW/202404/15/2137480266335054427/cc8e025e-0767-492e-a3a9-4e122dfb8ef7.jpg,https://thumbnail8.coupangcdn.com/thumbnails/local/320/image2/PRODUCTREVIEW/202404/15/2137480266335054427/68651e29-9108-447b-aa92-d6d4a7bd9e08.jpg"
205,5,2023.08.14,한*희,아기 았는 집 추천!,"아기방에 두고 쓰려고 샀어요
처음엔 무선일 필요가 있나 싶었지만
무선 좋습니닼ㅋㅋㅋㅋㅋ
충전만 돼있으면 간단히 들어서 거실 주방에서도 쓸 수 있어요~
코드프리 이게 진짜 편하더라구여
유선/무선 둘 중 고른다면 무선으로 고고 하세요!
가격은 더 비싸지만 그만한 값합니다
그리고 핸드폰 어플로 조절하는 것도 넘 유용해요
아이 재워놓고 베이비캠 보면서 바람세기 이런거 바꿔주고 있어요
소음도 별로 없는 편이에요!
조용해서 올 여름 매일 켜놨어요
아이 안 깨요 :)
조립은 남편ㅇㅣ 해서 난이도 잘 모르겠지만
어렵지 않개 십분만에 했습니다",15.0,https://thumbnail6.coupangcdn.com/thumbnails/local/320/image2/PRODUCTREVIEW/202308/14/6355420405447801465/d17a1625-4b29-4849-8c08-8a7a99b97503.jpg
206,1,2022.07.28,황*,이건뭐 누가받았던거 재작업해서 배송했나요? 인간적으로 재포장상품이면 구매의사도 없었어요. 쿠폰 만천원 안받고 말지 라벨이라도 정성껏붙이던가 때묻은손으로 시꺼멓게 색바랜 테이프 땔려니까 토나올거같네요 ㅡㅡ 쿠팡 많이애용해서 월요금인상해도 그냥 쓸려고했는데 이딴물건 싸게파는척 하면서 상술로 속여파는건 어이가없네요.. 반품상품싸게팔꺼면 중고나라하세요그냥,이건뭐 누가받았던거 재작업해서 배송했나요? 인간적으로 재포장상품이면 구매의사도 없었어요. 쿠폰 만천원 안받고 말지 라벨이라도 정성껏붙이던가 때묻은손으로 시꺼멓게 색바랜 테이프 땔려니까 토나올거같네요 ㅡㅡ 쿠팡 많이애용해서 월요금인상해도 그냥 쓸려고했는데 이딴물건 싸게파는척 하면서 상술로 속여파는건 어이가없네요.. 반품상품싸게팔꺼면 중고나라하세요그냥,17.0,"https://thumbnail7.coupangcdn.com/thumbnails/local/320/image2/PRODUCTREVIEW/202207/28/3523719070066661768/03883fd4-c9e3-4c5c-b25a-7cc85c675772.jpg,https://thumbnail7.coupangcdn.com/thumbnails/local/320/image2/PRODUCTREVIEW/202207/28/3523719070066661768/cde6ace1-ee93-4120-a567-d4911d389f02.jpg"
207,5,2022.08.21,쿠팡실구매자,없어도 괜찮지만 있으면 삶의 질이 높아지는 아이템!,"아기가 선풍기를 참 좋아해요! 기존에 있던 선풍기는 소음이 심했는데, 이건 소음도 적고 바람도 훨씬 부드러워서 아기가 쐐기에도 좋은 거 같아요~
디자인도 화이트라서 예쁘고, 선에서 자유로운 게 이렇게 편한 줄 알았으면 진작 무선 살 걸 그랬어요! 또 앱 조작이 가능해서 아기방에서 아기가 잘 때 안방에서 조작하면 돼서 짱 편해요 ㅎㅎ",7.0,
208,5,2022.07.12,크리스마스,☆ 한참 고민하다 구입했어요~☺︎☆ 먼저 무선이라는 점이 제일 좋습니다.☆ 이방 저방 옮겨 다닐 수 있어서 편리합니다.☆ 디자인은 발뮤다 비스므리하게 만들어서 깔끔하고 이쁩니다.☆ 충전 접촉이 한번 안되서 고장난지 알았는데충전기에 잘 맞춰야 하는것 말고는 아직까지는 잘 사용하고 있습니다.☆ 아쉬운점은 리모컨이 없어서 많이 아쉬워요 있었으면 정말 좋았을텐데..ㅠ.ㅠ☆ 그리고 회전이 일반 선풍기에 비해 아주 느려요.회전 버튼을 누르면 한참 뒤에 천천히 움직입니다. -.-성격 급하신 분은 화나실지도 몰라요.. ☹︎이 글이 도움이 되셨으면 좋겠습니다.☺︎,"☆ 한참 고민하다 구입했어요~☺︎
☆ 먼저 무선이라는 점이 제일 좋습니다.
☆ 이방 저방 옮겨 다닐 수 있어서 편리합니다.
☆ 디자인은 발뮤다 비스므리하게 만들어서 깔끔하고 이쁩니다.
☆ 충전 접촉이 한번 안되서 고장난지 알았는데
충전기에 잘 맞춰야 하는것 말고는 아직까지는 잘 사용하고 있습니다.
☆ 아쉬운점은 리모컨이 없어서 많이 아쉬워요 있었으면 정말 좋았을텐데..ㅠ.ㅠ
☆ 그리고 회전이 일반 선풍기에 비해 아주 느려요.
회전 버튼을 누르면 한참 뒤에 천천히 움직입니다. -.-
성격 급하신 분은 화나실지도 몰라요.. ☹︎
이 글이 도움이 되셨으면 좋겠습니다.☺︎",4.0,https://thumbnail7.coupangcdn.com/thumbnails/local/320/image2/PRODUCTREVIEW/202207/12/3505843986640812619/fe30ac32-d771-451c-9477-5eacc4cb231a.jpg
209,5,2023.06.15,김*미,최고최고,대륙의 실수 샤오미 ㅜㅠ주식사고싶을 정도 ㅠㅠ 전선포비아에게 꿈같으 제품입니다 집이 샤오미로 도배될듯 ㅜ 선풍기가 15마넌?! 하겠지만 잔고장없는 가전에 무선에 스마트컨트롤에 반려동물있는집은 아시겠지만 아이들이 선풍기를 끄고 키는게 신경쓰였는데 버튼이 헤드에있어 너무너무 좋아요 디자인 말해뭐해 초심플 충전기도 자성이있어 연결 너무 편리합니다!!,15.0,"https://thumbnail9.coupangcdn.com/thumbnails/local/320/image2/PRODUCTREVIEW/202306/15/4269985440180462262/fd9155d2-90dd-4674-9ffb-4f7fc551cee4.jpg,https://thumbnail9.coupangcdn.com/thumbnails/local/320/image2/PRODUCTREVIEW/202306/15/4269985440180462262/8db346f5-a234-4a25-b1e4-950fa2062969.jpg"
210,5,2023.07.02,옥탑방최지,역시나,"정말 좋은 제품입니다.
디자인도 깔끔 소음도 거의 없다싶이하며 어플 연동까지
이전에 1세대 모델 사용하다가 2세대로 한번 더 구매하여
본가로 선물드렸는데 너무 만족하시네요.
특히 1세대 때 마그네틱 충전이 마음에 들었었는데, 거기에 더해 높이 조절도 어느정도 가능하게끔 개선되어 나와서 완전 만족하네요.
아쉬운건 가격이 생각보다 많이 오른점입니다
1세대 때는 10만원에 구매하였는데 현 모델은 15만원 정도라 거의 30프로 넘게 올랐네요.
너도나도 상품 가격이 상승하니 구매에 있어 선풍기에 15만원은 가벼운 돈은 아니라 생각이 듭니다.",13.0,
211,5,2024.04.20,김*학,처음 써보는 샤오미선풍기,"그전에 일반선풍기 있었는대 고장이 나서 여름도 다가오고 하니 미리 주문해서 써보자는 생각에 주문을 하고 조립까지 딱 해서 작동해보니  너무 조용하고 단수도(스마트폰으로) 미세하게 조절도 되고 진작에 살것을 왜 이제 구입을 했는지 모르겠네요 너무 만족하네요
-추신-
조립하기전 설명서 꼭보고 조립하세요 날개 부실번 했네요
^^;",1.0,"https://thumbnail10.coupangcdn.com/thumbnails/local/320/image2/PRODUCTREVIEW/202404/20/8017101023748197781/3b72da2d-a361-4b7e-95e6-5c1d7acfdbaf.jpg,https://thumbnail6.coupangcdn.com/thumbnails/local/320/image2/PRODUCTREVIEW/202404/20/8017101023748197781/a63e8b43-c45b-4c3c-892b-b7480112281b.jpg"
212,5,2023.06.28,임*선,나도 생긴 무선선풍기,"작년부터 벼르다가 집에 서큘레이터만 2대 선풍기 2대라 고민하다 코드선 찾아 삼만리인게 싫어서 샀는데 만족만족합니다.
잘때 틀고 자는데 정말 조용하고 바람도 오래 맞아도 안아픈? 좋습니다
단점이라면 길이를 길게 했을때 아이가 어려서 치면 넘어갈까봐 약간의 불안함이 있지만 서큘레이터 다 처분하고 한대 더 구매할까 고민중입니다~",16.0,"https://thumbnail8.coupangcdn.com/thumbnails/local/320/image2/PRODUCTREVIEW/202306/28/210428844755763289/f01f8c6f-5abf-4b95-84c8-dfb80f61cef4.jpg,https://thumbnail6.coupangcdn.com/thumbnails/local/320/image2/PRODUCTREVIEW/202306/28/210428844755763289/b27ed7cb-fba1-4bd8-8fdf-4ad4c079367e.jpg"
213,4,2022.07.29,김*라,무선이라 핵 편함 단 내구성은 떨어짐,"무선이라는 점 핸드폰으로 상세조절이 된다는 점 너무 맘에듭니다
단, 이전 세대보다 무선 지속 시간이 짧고(만 하루까지는 안가요)
쓴지 한달 되었는데 어제부터 공진음같은 고주파 소음이 들립니다.
처음엔 아파트 소음인줄 알고 온층을 다 돌아다녔는데
선풍기 소음이였습니다.. 소리에 예민한 편이라 아주 거슬리네요...ㅜㅜ
이상태로라면 5년 쓸수 있을지 걱정..
소음이 모터소리처럼 쭉 이어지면 신경 덜쓰이는데 들렸다 안들렸다 간격이 있어요
한일 선풍기는 10년도 끄떡인데...ㅜㅠ
한일 선풍기에서 무선 선풍기 만들어줬음 좋겠네요",16.0,
214,4,2023.05.25,CBut,가격대비 아쉬운점이 있기는 함,"재질이나 마감도 깔끔하니 좋고 팬 사이즈 소음 등등 다 편하고 좋음
다만 미홈 연동 후에 어플 내에 배터리 잔량 표시가 없다는것과
헤드 좌우 조절은 되면서 상하 조절은 수동으로 해야되는게
상당한 단점
헤드 상하는 약간 귀찮은 정도지만
배터리 잔량 미표시는 불편
본체 led 컬러로 배터리 잔량 구분을 해준다고는 해도
흰색으로 표시되는 구간이 30~99임
배터리가 완충 혹은 30퍼 미만으로 떨어지기 전까지 잔량 확인이 안되는건 확실히 불편함
어플 연동까지 해서 쓸거면 배터리 표시는 당연한 기능이 아닌가 싶은데",16.0,
215,5,2023.05.27,진크파크,여름에 무소음선풍기 찾으시다면 요거요거,"너무너무 만족해요 일단 이쁘구요
그리고 자연풍이 되는거 이제알았는데 넘 유용합니다 ㅋㅋ
여자친구도 구매했어요 높낮이 조절이 조금 어려운데
아 리모컨이 없어서 첨엔 불편했는데!!
앱으로 쓰는것도 좋더라구여 ㅎㅎ
그리고 바람 만족합니다 ☺️
가격대가 살짝 높긴한데 후회없을것같아요!!
앞으로 오래오래 써야겠어요❤️",15.0,"https://thumbnail6.coupangcdn.com/thumbnails/local/320/image2/PRODUCTREVIEW/202305/27/7228301201428730228/0222062c-97c3-4790-acc6-0af571c7288d.jpg,https://thumbnail7.coupangcdn.com/thumbnails/local/320/image2/PRODUCTREVIEW/202306/14/7228301201428730228/f90fedfc-db62-4eb9-8709-ae970f5ad1cc.jpg"
216,5,2024.07.29,최*비,제가 소리에 좀 예민한건지일반 선풍기  1단도   너무 소음이 큰 거예요샤오미 선풍기소리를 우연히 들어봤는데조용하고 딱 제 스타일이라저 후기 잘   안남기는데너무 마음에 들어요길이 높이 조절이 조금 있었으면 더 좋겠구여리모컨도 따로 있었으면  좋겠어요한국이여서앱으로는 선풍기 기기 등록이 안되어서요,"제가 소리에 좀 예민한건지
일반 선풍기  1단도   너무 소음이 큰 거예요
샤오미 선풍기소리를 우연히 들어봤는데
조용하고 딱 제 스타일이라
저 후기 잘   안남기는데
너무 마음에 들어요
길이 높이 조절이 조금 있었으면 더 좋겠구여
리모컨도 따로 있었으면  좋겠어요
한국이여서
앱으로는 선풍기 기기 등록이 안되어서요",17.0,"https://thumbnail8.coupangcdn.com/thumbnails/local/320/image2/PRODUCTREVIEW/202407/30/6012611052663317412/292cbd7a-1588-452d-92b0-7f44f8d511ae.jpg,https://thumbnail9.coupangcdn.com/thumbnails/local/320/image2/PRODUCTREVIEW/202407/30/6012611052663317412/92ad37c7-5534-4c16-af81-f87d7a0b9b23.jpg"
217,4,2023.08.06,김*준,음 무선으로 사용하려고 구매했는데 계속 충전해줘야한다는 단점이있어서 역시 선풍기는 유선이다 싶네요 ㅜㅜ하지만 집에서 사용 목적이아니라 다른데 들고가서 사용할 목적이면 아주 괜찮은 선풍기입니다!! 자연풍 좋고 직접바람도 좋네요 ^^직접바람 세기시 50위로하면 소음이 살짝 들리기시작합니다.캠핑이라던지 잠시잠시 선 없이 사용할 목적이면 괜찮아보입니다.저는 집에서 사용할 목적이고 가끔 외부에 들고갈 필요가 있을때 사용하려고했는데 집에서만 계속 사용하니 조금 아쉽네요!,"음 무선으로 사용하려고 구매했는데 계속 충전해줘야한다는 단점이있어서 역시 선풍기는 유선이다 싶네요 ㅜㅜ
하지만 집에서 사용 목적이아니라 다른데 들고가서 사용할 목적이면 아주 괜찮은 선풍기입니다!! 자연풍 좋고 직접바람도 좋네요 ^^
직접바람 세기시 50위로하면 소음이 살짝 들리기시작합니다.
캠핑이라던지 잠시잠시 선 없이 사용할 목적이면 괜찮아보입니다.
저는 집에서 사용할 목적이고 가끔 외부에 들고갈 필요가 있을때 사용하려고했는데 집에서만 계속 사용하니 조금 아쉽네요!",7.0,https://thumbnail10.coupangcdn.com/thumbnails/local/320/image2/PRODUCTREVIEW/202308/6/6494518480543294163/4cb24116-a14d-495e-b5a9-664494b118cb.jpg
218,5,2024.10.09,김*란,좋아요,"무선선풍기
고루다가샤오미로결정했어요
장점
디자인이깔끔합니다
충전시간도오래갑니다
어디에두어도잘어울립니다
소음이거의없습니다
절전형입니다
바람이부드럽고시원합니다
단점
높이조절불편합니다
리모컨이없습니다
가격이좀비쌉니다",4.0,"https://thumbnail7.coupangcdn.com/thumbnails/local/320/image2/PRODUCTREVIEW/202410/9/2596896887693873972/0b3744ff-9fc1-4d1d-9997-02e1086b3bbc.jpg,https://thumbnail8.coupangcdn.com/thumbnails/local/320/image2/PRODUCTREVIEW/202410/9/2596896887693873972/d1b08f44-6041-4d9b-8279-4a28d9398c27.jpg"
219,5,2025.04.13,강*재,배송도 빠르고 조립도 편하고 어플연결도잘되고 전버전쓰다가 오래잘쓰고 넘어왔는데 좋내요,배송도 빠르고 조립도 편하고 어플연결도잘되고 전버전쓰다가 오래잘쓰고 넘어왔는데 좋내요,15.0,
220,2,2024.06.19,김*영,평이 너무 좋아 구매했는데 크기가 너무 작습니다.,상품평이 너무 좋아 고민하다 구매했어요. 근데 크기가 너무 작아요. 높이도 팬크기도요. 아기선풍기같아요. 샤오미 좋아하고 집에 샤오미거 많이 있지만 이제품은 구매평이 이렇게나 좋을일인지 모르겠네요. 바로 옆에 놓고 쓰실거아니면 거실용으로 부족합니다.,13.0,"https://thumbnail10.coupangcdn.com/thumbnails/local/320/image2/PRODUCTREVIEW/202406/19/1702688296512748746/f49eda4c-ff04-4f95-855d-d180db389c7f.jpg,https://thumbnail10.coupangcdn.com/thumbnails/local/320/image2/PRODUCTREVIEW/202406/19/1702688296512748746/2b47fb13-03e6-450c-9b78-cea3ca8c9f0b.jpg"
221,5,2024.06.19,개미부인,좋은제품 빠른배송 좋아요~^^,"샤오미 무선선풍기만 3대째 조금씩 발전되네요.기둥길이 조절도 되고..
올여름 조용히 션하게 보내겠네요.
아 그리고 옮겨다닐때 허리 굽힐 필요없이
충전단자에서 쉽게 탈착이 되니 이점도 좋네요.
게다가 문제 생기면 비싼선풍기 as도 가능하니
이번에 더 오래 사용할 수 있겠네요.",1.0,"https://thumbnail10.coupangcdn.com/thumbnails/local/320/image2/PRODUCTREVIEW/202406/19/957363245295090120/76a5402e-02b3-48f2-a90d-69b34fc801bd.jpg,https://thumbnail8.coupangcdn.com/thumbnails/local/320/image2/PRODUCTREVIEW/202406/19/957363245295090120/b9dd58f7-92e9-44cd-8ab4-62aba8870959.jpg"
222,1,2023.05.30,한대희,내구성 똥 한철 쓰고 버리는용,"진짜 한달 고민하면서 이것저것 다 알아보고 이걸로 구입햇는데
무선  이거  은근 편하네요
---------------
4달 정도 사용햇나
선풍기 바람 방향좀 위로 올리려고 살짝 올렷더니
머리 통채로 빠짐
내구성 제로   최악임
힘을 쌔게 준것도 아닌데 이게 부셔진다고???
as는 생각안하는게 좋음
왜  삼성 엘지  쓰는지 이제 깨우침 ......",16.0,"https://thumbnail6.coupangcdn.com/thumbnails/local/320/image2/PRODUCTREVIEW/202309/12/8628047879697053783/13a8d444-e0da-46b0-8bea-b8a30c5ec937.jpg,https://thumbnail7.coupangcdn.com/thumbnails/local/320/image2/PRODUCTREVIEW/202309/12/8628047879697053783/00910fbe-93f6-470b-b670-6983e4db5965.jpg"
223,5,2023.06.07,권*은,무선선풍기 사고싶었는데 만족입니다,"구매평보고 아무래도 무선이다 보니 바람이 별로 세지 않을거라고 생각하고 샀는데 엄청약하진 않네요. 바람세기는 만족입니다.
아무래도 세게 틀수록 모터소리가 들리는건 어쩔수없다고 생각되지만 그래도 일반 선풍기보다는 소리가 악간? 적은것같아요
좌식 생활하는지라 스탠드는 못쓰고 봉하나 빼서 써야하나 싶었는데
좀 멀리서 맞으니 생각보다 괜찮아서 그냥 스탠딩으로 쓰고있습니다.
고개가 많이 내려가지 않는게 좀 안탁깝지만 전체적으로 괜찮네요!
저는 만족합니다!",16.0,
224,5,2023.07.22,김*찬,"심플한 디자인, 조용한 선풍기","집에 선풍기가 없어서 고민하던 중
조용하고 바람 미세 조절이 가능하다길래 구매했아요.
엄청 깔끔한 디자인에 어플연동도 아주 간편해서
가격이 있지만 잘구매했다는 생각이 드네요.
한번씩 소리가 너무 조용해서 켜놓고 나간적도
몇번 있으며, 잘때도 소리가 안나서 켜진줄 몰릈네오.
단점이 있다면 선풍기를 다른곳에 놓으랴고할때
뒤에 손잡이가 없어서 마땅히 잡을곳이 없단 점과
높낮이 조절이 그냥 없다고 생각하시면 될 것 같습니다.",16.0,https://thumbnail6.coupangcdn.com/thumbnails/local/320/image2/PRODUCTREVIEW/202307/22/5942085862203177765/e588f58c-8230-4dff-949d-43d02e8d2802.jpg
225,4,2023.06.11,이*경,"디자인은 하얀색으로 딱 깔끔하고 소음도 굉장히 적은 편입니다.허나, 그만큼 바람 세기가 세지는 않습니다. 4단계로 틀어도 보통 생각하는 선풍기 풍량보단 약한 듯 합니다.그래도 그것을 커버하는 무선의 편리함..집안 여기저기를 들고 다니며 틀기 너무나 편리합니다. (손잡이는 없다는 점...)그리고 자연풍이 정말 마음에 듭니다. 바람이 거슬리면 선풍기를 오래 틀기 어려운데, 기분좋은 바람이에요.마지막으로 연동 된다는 점에서는 굉장히 편리하다고 볼 수 있습니다.","디자인은 하얀색으로 딱 깔끔하고 소음도 굉장히 적은 편입니다.
허나, 그만큼 바람 세기가 세지는 않습니다. 4단계로 틀어도 보통 생각하는 선풍기 풍량보단 약한 듯 합니다.
그래도 그것을 커버하는 무선의 편리함..
집안 여기저기를 들고 다니며 틀기 너무나 편리합니다. (손잡이는 없다는 점...)
그리고 자연풍이 정말 마음에 듭니다. 바람이 거슬리면 선풍기를 오래 틀기 어려운데, 기분좋은 바람이에요.
마지막으로 연동 된다는 점에서는 굉장히 편리하다고 볼 수 있습니다.",15.0,https://thumbnail7.coupangcdn.com/thumbnails/local/320/image2/PRODUCTREVIEW/202306/11/2468487437819318610/92e26a26-9ab0-4613-b3e8-6db44fbb26ef.jpg
226,5,2024.11.04,박*현,한 개 사보고 한 개 더 샀어요.,"선픈ㅇ기 성능은 모든 제품이 다 비슷한 것 같아요.
샤오미 최 강점은 무게와 무선입니다.
완충 후 1단으로 밤새도로 켜두고 썼네요.
1단도 시원하니 좋았습니다.
최대 4단까지 있고 회전각도도 좋아요
무선이라 이방 저방 그리고 화장실까지 잘 쓰고 있어요.
여름 지났지만 창고에 넣지 않고
샤워 후 화장실 건조용으로 쓰고 있어요.
돈값 하는 것 같아요..",17.0,https://thumbnail10.coupangcdn.com/thumbnails/local/320/image2/PRODUCTREVIEW/202411/4/1767685131852460357/f840468b-3f8f-4d52-8699-00eb249d216c.jpg
227,4,2023.06.24,고*영,무풍지대~,"말은 많이 들어봤지만 샤오미꺼는 처음 사보네요.
선풍기는 설명서를 안보더라도 간단한 조립이 기본인데 뚜껑안에 바람개비와 같은모양의 골판지를 함께 넣어놔서 골판지를 빼내야하는데 뚜껑을 설몀서대로 아무리 열려고해도 안열리더라고요.
여는데 안열리고  미끄러워 고무장갑을 끼고 위아래로 여는데도 아주 애먹었네요.
그리고 리모컨이 없어서 좀 불편하네요.
그래도 장점으로는 충전방식이라 충전을 full로해서 무선으로 야외에 놀러가서도 사용할 수 있을것 같아서 좋겠네요.",7.0,
228,5,2022.08.09,박*영,작은 고추가 맵다,"받았을때 처음 든 생각은 ""생각보다 너무 작은데?"" 였습니다.
신일 2~3만원짜리 일반 선풍기를 사용하다가 처음으로 구매해본 BLDC 선풍기였는데 조금 기대했거든요.
기존에 쓰던 일반 선풍기보다 약 20~30%정도 팬 크기가 작은것 같네요.
하지만 선풍기 켜보면 바람이 생각보다 진짜 셉니다. 조용한데 세요.
BLDC 선풍기를 처음 써보시는 분이라면 추천드립니다.
핸드폰 연동앱 설치 안하고 그냥 사용중인데 꽤 좋네요.
앞으로 얼마나 오래갈지 계속해서 써보도록 하겠습니다.",4.0,
