rank,rating,date,user,headline,body,helpful_count,images
1,5,2025.05.25,하늘별,"■ 흡입력 좋고, 물겔레질도 잘해요~!","✅ 샤오미 로봇청소기 X20+, 화이트
스마트한 로봇청소기에요~!
그동안 사용하던 흡입만 가능하던 로봇청소기에서
물걸레 청소 기능이 있는 올인원 로봇청소기로
갈아탔는데 신세계가 따로 없네요
스마트하고 편리한 청소의 경험을 느낄 수 있어요
처음 주문할 때 가격때문에 살짝 고민했는데
사용해 보니 만족도가 정말 높아서 주문하기를
잘 했다는 생각이 드는 제품이에요
✔️ 모델 : 샤오미 올인원 로봇청소기 X20+
✔️ 색상 : 화이트
꼼꼼하고 스마트하게 집안 전체 곳곳을
깔끔하게 청소해서 상쾌한 기분이 들어요
장애물이 있을 때 부딪히지 않고 잘 피해서 다니고
사물 인식능력이 탁월한 것 같아요
청소 소음도 작고 부드럽게 움직이면서 청소하네요
✔️ 장점
1. 흡입력이 좋아서 강력하게 먼지를 빨아들여요
2. 고속 회전 물걸레질로 깔끔한 청소가 가능해요
3. 장애물을 인식하고 회피하는 기능이 탁월해요
4. 청소기 사용시 소음이 작아요
5. 물걸레 패드 자동 청소&건조 기능이 있어요
6. 청소후에 자동으로 먼지통을 비워서 편리해요
7. 대용량 먼지 봉투로 오래 사용할 수 있어요
8. 4L 초대형 물통으로 물걸레 청소하기 넉넉해요
9. Mi Home 앱으로 편리하게 제어가 가능해요
10. 디자인이 예뻐요
이전에 사용하던 청소기는 욕실이나 현관에
떨어져서 접근금지구역 설정을 했는데
샤오미 청소기는 추락감지 센서가 좋아서
살짝 진입하다가 바로 후진해서 떨어지지 않고
안정적으로 청소를 계속해서 좋네요
쇼파밑도 잘 다니면서 꼼꼼하게 청소하네요^^
청소 중간중간 물걸레 세척을 위해서 스테이션에
복귀해서 세척하고 다시 청소하기를 반복하는데
깔끔하고 청결하게 청소하는 것 같아요
물걸레 청소가 끝나고 오수통 확인했더니 물이 제법
채워진걸 확인할 수 있어서 말끔하게 청소한 걸
확인할 수 있어요
청소에서 해방된 느낌이 강하게 드는 청소기에요
화이트 색상으로 디자인이 고급스러워서
집안에도 잘 어울리고 화사한 느낌이 들어요
성능, 품질, 디자인 모두 만족스러운 로봇청소기이에요~!",4.0,"https://thumbnail6.coupangcdn.com/thumbnails/local/320/image2/PRODUCTREVIEW/202505/25/5719923359720963502/e468e42d-8b40-44e5-ba90-00513adebc79.jpeg,https://thumbnail7.coupangcdn.com/thumbnails/local/320/image2/PRODUCTREVIEW/202505/25/5719923359720963502/de2cf2b9-df02-4df2-98f7-3a6ba8dfb9b3.jpeg,https://thumbnail6.coupangcdn.com/thumbnails/local/320/image2/PRODUCTREVIEW/202505/25/5719923359720963502/b5d700db-563c-4fdb-b7aa-5a2703688b84.jpeg,https://thumbnail10.coupangcdn.com/thumbnails/local/320/image2/PRODUCTREVIEW/202505/25/5719923359720963502/db0013cc-3239-4853-ae8d-1a4654bd6fe3.jpeg,https://thumbnail6.coupangcdn.com/thumbnails/local/320/image2/PRODUCTREVIEW/202505/25/5719923359720963502/e9ec2d16-90ec-4436-a036-dc0debb64fc4.jpeg,https://thumbnail6.coupangcdn.com/thumbnails/local/320/image2/PRODUCTREVIEW/202505/25/5719923359720963502/103372ab-520b-40a9-8f22-6abe92c640a4.jpeg,https://thumbnail6.coupangcdn.com/thumbnails/local/320/image2/PRODUCTREVIEW/202505/25/5719923359720963502/d6f31514-72e9-49ee-9283-2936d1f06cb7.jpeg,https://thumbnail7.coupangcdn.com/thumbnails/local/320/image2/PRODUCTREVIEW/202505/25/5719923359720963502/b08e9f6a-b148-4ead-878f-ab26e9d349fb.jpeg,https://thumbnail7.coupangcdn.com/thumbnails/local/320/image2/PRODUCTREVIEW/202505/25/5719923359720963502/6ecded0a-0288-4de1-9475-fca9fce15aa0.jpeg,https://thumbnail10.coupangcdn.com/thumbnails/local/320/image2/PRODUCTREVIEW/202505/25/5719923359720963502/1d1ac8dc-b5ba-4a65-857b-0aca7f1cd247.jpeg"
2,5,2025.02.21,김*유,삶의 질을 바꿔준 스마트한 청소 도우미!,"[별점] 5/5
[구매 계기]
평소 청소에 시간을 많이 뺏기는 것이 고민이었던 저는 로봇청소기 구매를 고려하고 있었습니다. 다양한 제품을 비교하던 중, 샤오미 로봇청소기 X20+가 가격 대비 뛰어난 성능과 편리한 기능으로 눈에 띄었습니다. 특히 쿠팡에서 로켓배송으로 빠르게 받아볼 수 있다는 점도 매력적이었습니다.
[첫인상]
X20+를 처음 받았을 때 가장 먼저 눈에 들어온 것은 세련되고 깔끔한 디자인이었습니다. 집안 어디에 두어도 잘 어울리는 모던한 디자인이었습니다. 또한, 로봇청소기 본체와 스테이션의 크기도 적당하여 공간을 많이 차지하지 않아 좋았습니다.
[사용 후기]
X20+를 사용하면서 가장 만족스러웠던 점은 압도적인 청소 성능이었습니다. 강력한 흡입력으로 바닥의 먼지와 머리카락은 물론, 카펫 속에 숨은 먼지까지 깨끗하게 제거해 주었습니다. 또한, 스마트한 장애물 회피 기능 덕분에 가구에 부딪히거나 엉키는 일 없이 꼼꼼하게 청소하는 모습이었습니다.
물걸레 청소 기능 또한 만족스러웠습니다. X20+는 물걸레를 자동으로 세척하고 건조하는 기능까지 갖추고 있어 위생적으로 사용할 수 있었습니다. 물걸레 청소 후 바닥은 뽀송뽀송하고 깨끗해졌습니다.
[편리한 기능]
X20+는 Mi Home 앱을 통해 다양한 기능을 간편하게 제어할 수 있다는 장점이 있습니다. 앱을 통해 청소 예약, 청소 모드 설정, 청소 경로 확인 등 다양한 기능을 사용할 수 있어 편리했습니다. 특히, 음성 제어 기능을 통해 ""샤오미, 청소 시작해""라고 말하면 로봇청소기가 알아서 작동하여 편리했습니다.
[장점]
* 강력한 흡입력으로 꼼꼼한 청소 가능
* 스마트한 장애물 회피 기능
* 자동 물걸레 세척 및 건조 기능
* Mi Home 앱을 통한 편리한 제어
* 세련된 디자인
[단점]
* 가격이 다소 비쌈
* 청소 소음이 다소 있음
[총평]
샤오미 로봇청소기 X20+는 가격은 다소 비싸지만, 뛰어난 성능과 다양한 편의 기능을 갖춘 제품입니다. 특히, 청소에 많은 시간을 뺏기는 분들에게는 삶의 질을 바꿔줄 수 있는 스마트한 청소 도우미가 될 것이라고 생각합니다. 저 역시 X20+를 사용하면서 청소에 대한 스트레스가 줄었고, 여유 시간을 더 많이 가질 수 있게 되었습니다.
[구매 팁]
* 쿠팡에서 로켓배송으로 빠르게 받아볼 수 있습니다.
* Mi Home 앱을 설치하여 다양한 기능을 활용해 보세요.
* 사용 후에는 물걸레를 깨끗하게 세척하고 건조하는 것이 좋습니다.
[마무리]
샤오미 로봇청소기 X20+는 저에게 최고의 선택이었습니다. 청소 때문에 고민이신 분들에게 강력 추천합니다!",28.0,"https://thumbnail6.coupangcdn.com/thumbnails/local/320/image2/PRODUCTREVIEW/202502/21/9029853671251098645/320f021d-b997-4a10-8b32-d081f803a631.jpg,https://thumbnail9.coupangcdn.com/thumbnails/local/320/image2/PRODUCTREVIEW/202502/21/9029853671251098645/97e2fd20-9c7e-4b1b-a5f2-68018ff9cc15.jpg,https://thumbnail10.coupangcdn.com/thumbnails/local/320/image2/PRODUCTREVIEW/202502/21/9029853671251098645/f91a7b5d-7116-4bf8-90db-2e6be222f801.jpg,https://thumbnail6.coupangcdn.com/thumbnails/local/320/image2/PRODUCTREVIEW/202502/21/9029853671251098645/c7d0b993-8b7a-4eac-bd2c-389542873dba.jpg,https://thumbnail6.coupangcdn.com/thumbnails/local/320/image2/PRODUCTREVIEW/202502/21/9029853671251098645/26d27feb-afde-4a93-8435-9cc5774a8367.jpg,https://thumbnail6.coupangcdn.com/thumbnails/local/320/image2/PRODUCTREVIEW/202502/21/9029853671251098645/1c2d4625-c089-4614-9c36-8c842d16b099.jpg,https://thumbnail8.coupangcdn.com/thumbnails/local/320/image2/PRODUCTREVIEW/202502/21/9029853671251098645/4663c835-4d65-4af7-b85d-d5cac7b1556b.jpg,https://thumbnail9.coupangcdn.com/thumbnails/local/320/image2/PRODUCTREVIEW/202502/21/9029853671251098645/f50cbea9-331f-4df4-bc0d-059544162e81.jpg,https://thumbnail6.coupangcdn.com/thumbnails/local/320/image2/PRODUCTREVIEW/202502/21/9029853671251098645/de566f25-93a0-4ea6-a285-c84d07da1e6a.jpg,https://thumbnail8.coupangcdn.com/thumbnails/local/320/image2/PRODUCTREVIEW/202502/21/9029853671251098645/73943f64-275c-467f-8126-e0537b07b28d.jpg"
3,5,2025.02.17,김*유,삶의 질을 바꿔준 스마트한 청소 도우미!,"고민 끝에 선택한 샤오미 로봇청소기 X20+
평소 청소에 시간을 많이 뺏기는 편이라 로봇청소기 구매를 오랫동안 고민했어요. 여러 브랜드 제품을 비교해본 결과, 가격 대비 성능이 뛰어난 샤오미 로봇청소기 X20+를 선택하게 되었습니다. 특히 쿠팡에서 로켓배송으로 빠르게 받아볼 수 있어서 좋았어요.
기대 이상의 성능에 깜짝 놀랐어요!
X20+를 사용한 지 2주 정도 되었는데, 정말 삶의 질이 달라졌다는 것을 실감하고 있습니다. 가장 만족스러운 점은 뛰어난 청소 성능이에요.
* 흡입력: 4000Pa의 강력한 흡입력으로 먼지, 머리카락은 물론이고 카펫에 숨어있는 미세한 먼지까지 깨끗하게 제거해줍니다.
* 물걸레 청소: 물걸레 기능도 기대 이상이었어요. 바닥에 묻은 얼룩을 말끔하게 닦아주어서 매번 물걸레질을 하는 번거로움을 덜 수 있었습니다.
* 장애물 회피: LDS 레이저 내비게이션과 다양한 센서 덕분에 가구와 장애물을 척척 피해서 청소하는 모습이 정말 신기했어요.
똑똑한 기능으로 편리함을 더했어요!
X20+는 단순히 청소만 잘하는 것이 아니라 다양한 스마트 기능으로 사용자를 편리하게 해줍니다.
* 자동 먼지 비움: 스테이션이 먼지통을 자동으로 비워주어서 위생적이고 편리합니다. 한 달에 한 번 정도 먼지봉투만 교체해주면 되니 정말 편해요.
* 앱 연동: Mi Home 앱을 통해 청소 예약, 모드 설정, 청소 경로 확인 등 다양한 기능을 간편하게 사용할 수 있습니다. 외출 중에도 스마트폰으로 청소를 시작할 수 있어서 정말 유용합니다.
* AI 음성 제어: 구글 어시스턴트와 연동하여 음성으로 청소를 제어할 수 있습니다. ""헤이 구글, 청소 시작해줘""라고 말하면 로봇청소기가 알아서 청소를 시작하니 정말 편리해요.
아쉬운 점
* 소음: 강력한 흡입력 때문에 작동 시 소음이 다소 있는 편입니다.
* 물통 용량: 물통 용량이 조금 작아서 넓은 공간을 청소할 때는 중간에 물을 보충해줘야 합니다.
총평
샤오미 로봇청소기 X20+는 가격 대비 뛰어난 성능과 다양한 스마트 기능을 갖춘 제품입니다. 청소에 대한 스트레스를 줄여주고 삶의 질을 향상시켜주는 데 큰 도움을 주고 있어요. 다만, 소음과 물통 용량은 약간 아쉬운 부분입니다.
이런 분들께 추천합니다!
* 청소에 시간을 많이 뺏기는 분
* 반려동물을 키우는 분
* 깨끗한 바닥을 유지하고 싶은 분
* 스마트한 가전을 선호하는 분
쿠팡 구매 팁
쿠팡에서는 다양한 할인 행사와 로켓배송 서비스를 제공하고 있으니, 저렴하고 빠르게 X20+를 구매할 수 있습니다. 구매 전에 리뷰를 꼼꼼히 읽어보고, 자신에게 맞는 제품인지 확인해보세요.
긴 글 읽어주셔서 감사합니다!
제 리뷰가 샤오미 로봇청소기 X20+ 구매를 고려하시는 분들께 도움이 되었으면 좋겠습니다.",24.0,"https://thumbnail8.coupangcdn.com/thumbnails/local/320/image2/PRODUCTREVIEW/202502/17/9029853671251098645/f8507ceb-7b2d-49ab-80fc-b9c359b21a83.jpg,https://thumbnail7.coupangcdn.com/thumbnails/local/320/image2/PRODUCTREVIEW/202502/17/9029853671251098645/4cfcd586-9bc5-4242-b84f-0d16c586d85e.jpg,https://thumbnail9.coupangcdn.com/thumbnails/local/320/image2/PRODUCTREVIEW/202502/17/9029853671251098645/69c61d78-b759-4a3e-a17f-44d353c9a7cb.jpg,https://thumbnail8.coupangcdn.com/thumbnails/local/320/image2/PRODUCTREVIEW/202502/17/9029853671251098645/2174c213-2e0a-4c3c-8b78-4cea1c36af7a.jpg,https://thumbnail7.coupangcdn.com/thumbnails/local/320/image2/PRODUCTREVIEW/202502/17/9029853671251098645/6267e633-dc64-4865-aa94-8c667f1c9ec1.jpg,https://thumbnail10.coupangcdn.com/thumbnails/local/320/image2/PRODUCTREVIEW/202502/17/9029853671251098645/48757bb9-832c-4f9c-987d-d8cf8c536b1f.jpg,https://thumbnail7.coupangcdn.com/thumbnails/local/320/image2/PRODUCTREVIEW/202502/17/9029853671251098645/19437fe5-3b45-4c4e-9ba9-f7ff3dc1d353.jpg,https://thumbnail9.coupangcdn.com/thumbnails/local/320/image2/PRODUCTREVIEW/202502/17/9029853671251098645/899aaf7c-d301-4419-a32b-80b968916e1a.jpg,https://thumbnail10.coupangcdn.com/thumbnails/local/320/image2/PRODUCTREVIEW/202502/17/9029853671251098645/30139325-4546-4de6-a54e-155e458cdb74.jpg,https://thumbnail9.coupangcdn.com/thumbnails/local/320/image2/PRODUCTREVIEW/202502/17/9029853671251098645/b2803cda-eb20-412f-bb10-c12b5680866e.jpg"
4,5,2025.02.13,mydean,요제품 적극추천합니다,"몇달 검색하고 장단점 따져보고 저두사고 지인에게도 선물했는데요 8~9년전에도써봤지만 그때는 의자밑에들어가면 나오지못하고 옮겨주곤했었고 여기저기부딪히고 상처가많아 짜증이 확 ㅠㅠ 대기업꺼썼는데두요
그런데 현재는 AI가 대세이면서 센서가 여기저기 기능향상으로 기능추가로 부딪힘도 최소(거의 없다고보심됨)  소리도 시끄럽다고하는 리뷰도있는데요 모드가 다양하게되어있는데요 아무레도 강력 터보모드로하시면 모터가 강력한만큼 시끄러운건 당연한데요 여기서 꿀팁드리자면요 예약도되니 출근또는 외출한시간에 맞춰하시면 전혀 신경쓰지않아도되니 편리하구요 외부에서도 청소하고있는것도 어풀로도 확인가능합니다 예약을하지않으셨다면 집에귀가하시전 청소를 미리시켜놓으시면 도착했을땐 마치 가사도우미가 청소하고 퇴근하셨나할정도  오수통을보면 왹  할실거에요또하나의 꿀팁을드리자면 기능에따라 몇십만원의차이가나는데요 상세설명을 잘보시고 요정도면 되겠다 이기능은포기해야겠다하시면 돈버는거구요 제가 추천드린 이상품 몇달 검색하고 비교견적내본결과 이정도의 스펙으로 대기업상품이라면 100만원벌고 들어가는겁니다 사진보시면 아시겠지만 받자마자 설치했는데 강아지 친구만들어줬어요 더 사용하다가 더좋은 리뷰로 찾아뵐께요",28.0,"https://thumbnail9.coupangcdn.com/thumbnails/local/320/image2/PRODUCTREVIEW/202502/13/7354791617391711329/f066b308-f725-49ea-9a13-195b687d553c.jpg,https://thumbnail9.coupangcdn.com/thumbnails/local/320/image2/PRODUCTREVIEW/202502/13/7354791617391711329/7645690e-fbfc-4354-b106-7b6930b4e341.jpg,https://thumbnail6.coupangcdn.com/thumbnails/local/320/image2/PRODUCTREVIEW/202502/13/7354791617391711329/55f661f6-fdce-41a6-9fa8-ce8014aa0b0b.jpg,https://thumbnail7.coupangcdn.com/thumbnails/local/320/image2/PRODUCTREVIEW/202502/13/7354791617391711329/234817a7-e023-45c6-8981-f6bf3e1a4de6.jpg,https://thumbnail9.coupangcdn.com/thumbnails/local/320/image2/PRODUCTREVIEW/202502/13/7354791617391711329/7e056273-cb91-43eb-8544-a7b5ed0c3172.jpg,https://thumbnail9.coupangcdn.com/thumbnails/local/320/image2/PRODUCTREVIEW/202502/13/7354791617391711329/abcb22f5-1792-4bcb-b92c-6a994751c765.jpg,https://thumbnail9.coupangcdn.com/thumbnails/local/320/image2/PRODUCTREVIEW/202502/13/7354791617391711329/a0904ce0-f030-48ac-a39c-e948a2b26e51.jpg,https://thumbnail9.coupangcdn.com/thumbnails/local/320/image2/PRODUCTREVIEW/202502/13/7354791617391711329/3e832383-553b-4629-b3f0-78f2c24a6e6a.jpg"
5,5,2024.12.10,김*필,나의 삶을 풍요롭게 해준 샤오미♥,"안녕하세요?
저는 73년 쥐띠 아줌마입니다.
아침에 5시 30분에 일어나서 수영장 가서 한 시간 수영을 하고, 다시 집으로 돌아와 출근 준비를 하고 회사에서 일을 합니다.
점심시간, 저녁시간, 주말을 이용해서 회사 기숙사 앞 텃밭에서 농사도 짓습니다.  그리고 저녁에는 포기하지 못할 취미 생활인 기타도 배웁니다.
이러한 이유로 매일마다, 매주마다, 매월마다, 매년마다 계획을 세우고 스케쥴대로 해야 차질이 생기지 않아요. 이 중에 무엇 하나 포기하고 싶은 게 없어서 늘 바쁘게 살아가고 있는 대한민국 소시민입니다.
청소는 늘 해야 하는 일과입니다.
두 딸은 학업으로 인하여 독립을 해서 저와 신랑 둘이 살고 있어요. 저만큼이나 신랑도 바쁘네요!  그래도 누군가 청소는 해야 하는데 저보다 우리 신랑이 청소를 더 많이 합니다.
그래서 결심했습니다.
이번 생에 로봇청소기 한번 사 보자고!
저는 회사에서 틈틈히 검색을 해 보았습니다.
주변 지인에게 물어도 보았습니다.
샤오미 이야기를 많이들 하시네요?
게다가 쿠팡에서 가격도 저렴했구요.
일단 사 보기로 했고, 남편도 은근 청소가 귀찮았는지 오케이 해서 열심히 검색하고 나서 샤오미로 결정했어요.
드디어 우리집에 로봇청소기가 들어왔습니다.
정말 신나는 일입니다.
설명서 보면서 앱을 깔고 로봇 청소기를 요리조리 살펴보며 우리집의 청소구역을 정해 주었습니다.
저희집은 32평 아파트입니다.
많이 사용하는 구역인 거실과 주방은 두번씩, 나머지 방 세개는 한번씩만 청소하라고 했습니다. 저는 다른 분들은 요 로봇 청소기를 어떻게 사용하고 계시는지 리뷰를 잘 읽어보았습니다. 그래서 청소기를 작동시키기 전에 바닥에 있는 자질구레한 것들을 미리 치워 놓았습니다. 드디어 샤오미가 청소를 시작합니다.
우와! 정말 야무지게 잘 하네요?
제가 정해진 구역을 청소하는 시간이 65분 걸리는 날도 있고,  75분 걸리는 날도 있어요.
방 하나를 안 하게 되는 날은 65분, 모두 하면 75분 걸리더라구요.
사진에서처럼 진하게 열십자 모양으로 움직인 곳이 주방과 거실입니다. 두번씩 야무지게 청소했다고 보여줍니다. 외부에 있을 때에도 앱으로 주문하면 알아서 청소해 주니 저와 남편의 일상에 한결 여유로움이 생겼습니다.
아, 그리고 물걸레 패드는 일주일에 한번 햇빛에 꼭 말려줍니다. 그럼 냄새도 나지 않고 아주 쾌적하게 청소 마무리 해 줍니다. 제 인생에 있어서의 큰 사치품으로 구입했는데 사용해 보니 이건 사치품이 아니라 필수품이네요! 혹시 로봇 청소기 구입을 망설이신다면 그냥 지르세요~ 라고 조언드리고 싶을 정도로 완전 정말 굉장히 좋습니다!
저의 리뷰가 로봇 청소기 구입하시려는 분들에게 조금이나마 도움드리고자 적어 보았습니다.
감사합니다~♡",68.0,"https://video.coupangcdn.com/cloud/PRODUCTREVIEW/202412/10/2032259541982332924/2fc66063-0e88-4af9-8329-13963b50b0a2/transcode/thumbnail-00001.png,https://thumbnail9.coupangcdn.com/thumbnails/local/320/image2/PRODUCTREVIEW/202412/10/2032259541982332924/e7fba538-2d97-4454-81b5-c849d994be80.jpeg,https://thumbnail8.coupangcdn.com/thumbnails/local/320/image2/PRODUCTREVIEW/202412/10/2032259541982332924/f4b5840c-5f9d-4019-8c9d-a904039481a0.jpeg,https://thumbnail6.coupangcdn.com/thumbnails/local/320/image2/PRODUCTREVIEW/202412/10/2032259541982332924/d6e32b9a-9934-43ca-91ee-89c88cfba0e0.jpeg,https://thumbnail7.coupangcdn.com/thumbnails/local/320/image2/PRODUCTREVIEW/202412/10/2032259541982332924/9d786fe6-7e9d-40fa-80a5-607c4a3610b9.jpeg,https://thumbnail9.coupangcdn.com/thumbnails/local/320/image2/PRODUCTREVIEW/202412/10/2032259541982332924/df1311fb-ccf8-4be2-b3d5-ed5222be4565.jpeg,https://thumbnail8.coupangcdn.com/thumbnails/local/320/image2/PRODUCTREVIEW/202412/10/2032259541982332924/b8007b9f-e50b-4a99-b996-ad5a7262c0c6.jpeg,https://thumbnail10.coupangcdn.com/thumbnails/local/320/image2/PRODUCTREVIEW/202412/10/2032259541982332924/ee93d563-41c3-425a-8b20-e1ba158cf596.jpeg,https://thumbnail7.coupangcdn.com/thumbnails/local/320/image2/PRODUCTREVIEW/202412/10/2032259541982332924/902f5337-0e89-4648-9255-9670aef60204.jpeg,https://thumbnail6.coupangcdn.com/thumbnails/local/320/image2/PRODUCTREVIEW/202412/10/2032259541982332924/5e746ae3-c3b5-4b4c-a5e2-f9a3796c8ce6.jpeg"
6,5,2024.10.27,김*선,너무 좋은 제품이에요,"샤오미 제품을 구매하기로 결정하했어요
그렇게 해서 주문하게 된 녀석은 샤오미 로봇청소기 X20+.
네이버, 다나와, 에누리닷컴 등 가격 비교 사이트를 통해 검색해 보면 현재 쿠팡에서 가장 저렴한 가격으로 판매하고 있더라구요.(광고 아님)샤오미 로봇청소기 X20+
.샤오미 로봇청소기 X20+ 박스를 열면 맨 위에 간단한 처음 설치 가이드가 나오고, 그 아래로 청소기 충전 스테이션과 보호제가 보였고 보호제를 꺼내면 보호제 아래에 샤오미 로봇청소기 X20+ 본체를 볼 수 있고, 본체 아래에 솔과 충전 스테이션용 컨센트, 물걸레, 사용설명서가 들어있는 박스가 나와요.샤오미 로봇청소기 X20+ 각각의 제품을 꺼내고 충전스테이션에 콘센트를 꽂고 자리에 놓은 후, 충전스테이션의 뚜껑을 열어 물걸레용 물통에 4리터의 물을 꽉 채워 넣은후
청소기를 뒤집어 박스에 들어있던 머리카락 솔과 물걸레를 꽂고 보호 비닐을 뜯은 후 충전 스테이션에 살짝 밀어넣으면 로봇청소기가 알아서 충전구에 딱맞게 엉덩이를 살살 흔들어 맞추어요.(일단 엉덩이 살살 흔드는 거에 오오~ 하고 감탄을...^^;;;)
로봇청소기를 충전 하는 동안 핸드폰에 샤오미 앱을 설치하고 샤오미 회원가입 후 로그인을 하고
로그인 후 우측 상단의 + 버튼을 통하여 앱에 샤오미 로봇청소기 X20+ 를 추가해요
샤오미 앱에 Xiaomi 로봇청소기 X20+ 를 추가 후 펌웨어 업데이트를 진행
펌웨어가 무엇이냐 물으신다면 몰라요 라고 자신있게 답하겠다.(진짜로 모르는걸...)
신랑 말로는 기기의 소프트웨어의 버그나 기능을 향상 시키기 위한 프로그램 업데이트라고 하더라구요
​어찌됐든 펌웨어를 업데이트하고 난 후 충전이 어느정도 되었다 싶으면 ""빠른 지도 생성"" 버튼을 눌러 일단 집의 지도를 생성해요
이 버튼을 누르면  로봇청소기는 충전스테이션에서 출동하여 벽을 따라 돌며 지도를 생성
그렇게 만든 지도가 바로 이것.
정말 신기하게도 정확하게 만들어졌어요.
그리고 알아서 거실과 각 방으로 구역도 나누어요
샤오미 계정이 있는 신랑에게 기기를 공유하면 신랑의 샤오미 앱에서도 청소기 관리가 가능.지도 생성 후 조금 더 충전을 하고 거실만 진공청소를 시작하였어요
미리 밀대로 먼지를 제거한 후라 거실만 청소를 하였고, 물걸레는 일단 사용하지 않았어요
다른 블로거들의 글에 우선 진공청소 후 물걸레청소를 하는 것을 권장하여 그렇게 진행했어요
약 50분 정도를 돌아다니며 청소를 하는 것을 보고(거실만) 세상 참 편해졌다는 생각이 들었습니다",36.0,"https://thumbnail10.coupangcdn.com/thumbnails/local/320/image2/PRODUCTREVIEW/202412/9/7520870169133114740/356bb5e2-db73-44c4-8835-9afa67898984.jpg,https://thumbnail6.coupangcdn.com/thumbnails/local/320/image2/PRODUCTREVIEW/202412/9/7520870169133114740/11a351ea-1094-4a40-a799-c88bd8ca1222.jpg,https://thumbnail6.coupangcdn.com/thumbnails/local/320/image2/PRODUCTREVIEW/202412/9/7520870169133114740/a25832c0-8a33-4b44-9bfa-5f568f39088f.jpg,https://thumbnail6.coupangcdn.com/thumbnails/local/320/image2/PRODUCTREVIEW/202412/9/7520870169133114740/0a9bbf49-6f48-453f-92a2-cf3f43d97cbd.jpg,https://thumbnail10.coupangcdn.com/thumbnails/local/320/image2/PRODUCTREVIEW/202412/9/7520870169133114740/5c97eb9b-6e35-4a1c-a6ed-976ad667adcd.jpg,https://thumbnail9.coupangcdn.com/thumbnails/local/320/image2/PRODUCTREVIEW/202412/9/7520870169133114740/2b374689-8175-446a-a8a2-369dc3a9e1c7.jpg,https://thumbnail8.coupangcdn.com/thumbnails/local/320/image2/PRODUCTREVIEW/202412/9/7520870169133114740/cfe38bd5-bfe3-4a29-b4f3-e3ccfddea0ac.jpg,https://thumbnail6.coupangcdn.com/thumbnails/local/320/image2/PRODUCTREVIEW/202412/9/7520870169133114740/fe326864-58dd-492b-a2b9-85ca6821d5ab.jpg,https://thumbnail10.coupangcdn.com/thumbnails/local/320/image2/PRODUCTREVIEW/202412/9/7520870169133114740/c21f8971-9a32-47bd-9212-c6fc797276ff.jpg,https://thumbnail9.coupangcdn.com/thumbnails/local/320/image2/PRODUCTREVIEW/202412/9/7520870169133114740/8c43c6cf-992a-446b-87b2-6768d3f2a022.jpg"
