rank,rating,date,user,headline,body,helpful_count,images
1,5,2025.07.20,김헌영,가성비와 세정력이 좋은 주방세제를 찾으신다면 퐁퐁으로~,"매일 사용하는 주방세제는 주방에 없어서는 안될 존재인에됴.
이번에 주방세제가 똑 떨어져서 가성비 있는 주방세제를 찾다보니
퐁퐁 친환경 주방세제 오렌지향 리필, 1.2L, 4개를 알게 되어
구매를 하게 되었습니다.
뛰어난 세정력으로 기름때 걱정 끝!
가장 중요한 세정력부터 말씀드리자면,
기름때 제거에 정말 탁월한 것 같습니다.
그릇에 남아있는 끈적한 기름기도 말끔하게 씻어낼 수 있어요.
여기서 팁으로 미지근하거나 따뜻한 물로 헹구면 더 잘 닦입니다.
맨손 설거지도 부담 없는 순한 사용감 ""친환경""이라는
이름에 걸맞게 식물유래성분이 함유되어 있어서,
설거지 후에 손이 건조해지거나 거칠어지는 걱정을 덜 수 있어요.
저처럼 맨손 설거지를 즐겨 하시는 분들도
큰 부담 없이 사용할 수 있을 것 같습니다.
은은한 오렌지 향과 적당한 점성 싱그러운 오렌지 향이
설거지하는 내내 주방에 은은하게 퍼져서 기분까지 상쾌해져요.
너무 강하지 않고 자연스러운 향이라 더욱 좋답니다.
또, 너무 묽지 않고 적당히 점성 있는 제형이라
소량만 사용해도 풍성한 거품이 나고 오래 사용할 수 있어요.
실용적인 대용량 리필 구성 1.2L 리필 4개 구성이라
한 번 구매하면 넉넉하게 오래 사용할 수 있어서 편리해요.
자주 구매해야 하는 번거로움도 덜어주고,
플라스틱 사용량도 줄일 수 있어 마음에 드는 제품입니다.
설거지를 마치고 나면 뽀득뽀득 기분 좋은 느낌을 받을 수 있고
가성비도 좋기 때문에 주방세제가 필요할 때 재구매할 예정입니다.
그럼 여기까지 내돈내산으로 솔직한 후기를 남기도록 노력하였으며 도움이 되셨기를 바랍니다:)",,"https://thumbnail8.coupangcdn.com/thumbnails/local/320/image2/PRODUCTREVIEW/202507/20/4662539803147304481/91a47b6b-4587-4193-91dd-5382672df936.jpeg,https://thumbnail9.coupangcdn.com/thumbnails/local/320/image2/PRODUCTREVIEW/202507/20/4662539803147304481/171ed22a-fc1c-40ba-91b2-2cf5e4acfa63.jpeg,https://thumbnail7.coupangcdn.com/thumbnails/local/320/image2/PRODUCTREVIEW/202507/20/4662539803147304481/4ffe0386-a7bf-4559-a345-be262fb2c31d.jpeg,https://thumbnail7.coupangcdn.com/thumbnails/local/320/image2/PRODUCTREVIEW/202507/20/4662539803147304481/15cee4e2-22db-43d4-93b6-8e59965f5e10.jpeg,https://thumbnail8.coupangcdn.com/thumbnails/local/320/image2/PRODUCTREVIEW/202507/20/4662539803147304481/7d14fade-90ae-406b-b953-d49b8487f3e1.jpeg,https://thumbnail9.coupangcdn.com/thumbnails/local/320/image2/PRODUCTREVIEW/202507/20/4662539803147304481/b098ada5-f01a-4f3e-9ceb-1b6ce5ac9c73.jpeg,https://thumbnail7.coupangcdn.com/thumbnails/local/320/image2/PRODUCTREVIEW/202507/20/4662539803147304481/4f169b46-f239-4721-803c-830246f44408.jpeg,https://thumbnail8.coupangcdn.com/thumbnails/local/320/image2/PRODUCTREVIEW/202507/20/4662539803147304481/d43041e6-7df7-4835-b32e-82d0afaba209.jpeg,https://thumbnail10.coupangcdn.com/thumbnails/local/320/image2/PRODUCTREVIEW/202507/20/4662539803147304481/e24382ae-e5f6-47d7-9626-b2c8995b7567.jpeg,https://thumbnail7.coupangcdn.com/thumbnails/local/320/image2/PRODUCTREVIEW/202507/20/4662539803147304481/d288285a-c6dd-4aa1-8a74-9b6fe97e65df.jpeg"
2,5,2025.07.14,김재희,강력한 세정력! 환경까지 생각한 똑똑한 세정제,"설거지는 매일 하는 일이지만, 손과 환경에 자극 없는 제품을 고르는 건 생각보다 쉽지 않죠.
퐁퐁 친환경 주방세제 오렌지향 리필 1.2L x 4개는 첫인상부터 실용성과 깔끔함이 돋보이는 제품이었습니다.
✔ 리필파우치 형태로 공간 절약 + 플라스틱 사용 줄이기
✔ 밝은 오렌지 컬러와 과일 일러스트로 친환경 느낌 UP
✔ 1.2L 대용량 4개 세트로 오랫동안 넉넉하게 사용 가능
✔ 손잡이와 캡이 달려 있어 따르기 편하고 보관도 안정적
처음 받아봤을 때 가정용 주방세제로써 깔끔한 첫 인상이었고,
환경까지 고려한 리필형 포장이 인상적이었어요.
사용감과 향
✔ 미지근한 물에도 거품이 풍부하게 잘 남
✔ 오렌지 껍질 느낌의 산뜻한 과일향으로 기분 좋음
✔ 기름기 있는 프라이팬, 접시도 거품 두 번이면 OK
✔ 손에 닿는 느낌이 자극적이지 않고 부드러움
주방세제 특유의 강한 향이나 건조함 없이,
은은하게 남는 오렌지 향 덕분에 설거지가 조금 더 즐거워졌어요.
세정력과 안전성
✔ 야채, 과일 세척도 가능한 친환경 성분
✔ 세척력 우수 – 기름기, 찌든 때도 한 번에 클리어
✔ 계면활성제 저자극 포뮬러로 손 피부에 부담 적음
✔ **7無 첨가(색소, 인공향료 등)**로 더 안심
기름진 프라이팬도 두 번 헹구면 뽀득뽀득하게 마무리되고,
세정 후에도 미끄럽거나 잔여감 없이 깨끗했어요.
추천 대상
✔ 자주 설거지를 해야 하는 가정
✔ 손이 민감한 분이나 무향·저자극 제품을 선호하는 분
✔ 친환경 제품을 실천하고 싶은 소비자
✔ 대용량 리필로 가성비까지 챙기고 싶은 분
총평
퐁퐁 친환경 주방세제 오렌지향은 자극 없는 성분, 탁월한 세정력, 환경까지 고려한 포장까지 두루 갖춘 제품이에요.
✔ 산뜻한 오렌지 향과 부드러운 사용감
✔ 야채·과일 세척까지 가능한 안전한 성분
✔ 뛰어난 세정력으로 기름기 제거도 만족
✔ 1.2L x 4개 구성으로 가성비까지 굿!
매일 쓰는 주방세제, 더 순하고 똑똑한 제품으로 바꾸고 싶다면 이 제품은 후회 없는 선택이 될 거예요.
이 리뷰가 도움이 되셨다면?
[도움이 돼요] 버튼 꾹 눌러주세요!
✨ 여러분의 클릭이 더 똑똑한 주방습관을 만듭니다 ✨",,"https://thumbnail10.coupangcdn.com/thumbnails/local/320/image2/PRODUCTREVIEW/202507/14/5059165729911786372/9fb6076e-d7ef-4c43-ac19-6076bda5adcb.jpeg,https://thumbnail8.coupangcdn.com/thumbnails/local/320/image2/PRODUCTREVIEW/202507/14/5059165729911786372/77eb1c59-1d8e-4333-a805-185fb0804e74.jpeg,https://thumbnail9.coupangcdn.com/thumbnails/local/320/image2/PRODUCTREVIEW/202507/14/5059165729911786372/a554b636-9cb4-4e64-aecd-ef3a14488045.jpeg,https://thumbnail7.coupangcdn.com/thumbnails/local/320/image2/PRODUCTREVIEW/202507/14/5059165729911786372/615379c7-17c7-4ac2-902a-c117b209e154.jpeg,https://thumbnail9.coupangcdn.com/thumbnails/local/320/image2/PRODUCTREVIEW/202507/14/5059165729911786372/2743fecb-f456-4eec-a272-1b8816f7dc7a.jpeg,https://thumbnail6.coupangcdn.com/thumbnails/local/320/image2/PRODUCTREVIEW/202507/14/5059165729911786372/aacb15cc-e15a-4cae-9efe-862470bbbb35.jpeg,https://thumbnail7.coupangcdn.com/thumbnails/local/320/image2/PRODUCTREVIEW/202507/14/5059165729911786372/8fccdf48-9fca-4c50-86dd-2f8f6ed92eb9.jpeg,https://thumbnail6.coupangcdn.com/thumbnails/local/320/image2/PRODUCTREVIEW/202507/14/5059165729911786372/9e95b79d-4343-4f81-9a00-230a00853f81.jpeg"
3,5,2025.07.14,마미효,주방세제 사용하기 넉넉해요.,"퐁퐁 친환경 주방세제 오렌지향 리필형  주방세제 좋아요.
여러번 주문해서 사용한 세제입니다.
오렌지향 퐁퐁 주방세제 가성비가
짱짱 최고에요.
향기도 달달하고 세척시 거품발생이 풍부해서
뽀드득 깨끗하게 식기나 도구의 세척력을 기대할 수 있어요.
주방세제가 세척력 좋으면 다한건데
장갑을 사용하지 않아도 손에 자극적이지도 않아요.
오렌지향 리필형 주방세제가
대용량이라 리필용기에
여러번 담아서 사용할수 있습니다.
가성비와 가심비가 좋은 제품으로 가격도 너무 착해요.
뽀드득 거리는 설거지를 끝내면
기분까지 상쾌해요.
주방세제 정착템이에요.
뽀드득 설거지 하세요.
아래는 제품설명글을 인용해서 적어보았습니다.
오렌지향의 산뜻함을 담은
친환경 주방세제 입니다.
쉽고 빠른 헹꿈!
깔끔 헹굼 포뮬러로
세제 잔여물을
쉽고 빠르게 씻어냅니다.
풍부한 거품
풍부한 거품으로
잘 지워지지 않는
기름기도 빠르게 제거!
저는 전날 저녁이나 밤에 주문해도
새벽에 배송받아 볼 수 있는
로켓프레쉬나 로켓배송을 애용하며
거의 모든 장을 보고 있어요.
가끔 아침에 주문하면 저녁에도 배송받을 수 있어서
급하게 장을 봐야할 때에도 아주 편리하게 이용하고 있습니다.
저는 여러번 먹어보거나 사용하고 나서
리뷰 적는 제품들이  대부분인데요,
이 상품은 마음에 드는 제품이라 여러번 재구매하여
솔직한 리뷰 남겨봅니다^^~",1.0,"https://video.coupangcdn.com/cloud/PRODUCTREVIEW/202507/14/2408647955223202065/23ce4725-307e-430d-a308-eff8b7efc9a2/transcode/thumbnail-00001.png,https://thumbnail6.coupangcdn.com/thumbnails/local/320/image2/PRODUCTREVIEW/202507/14/2408647955223202065/06995d2a-7c67-4f18-bcd3-32dc51ae2d0f.jpg,https://thumbnail8.coupangcdn.com/thumbnails/local/320/image2/PRODUCTREVIEW/202507/14/2408647955223202065/31b8c51b-970b-40f9-b51e-e6254e64bfa4.jpg,https://thumbnail9.coupangcdn.com/thumbnails/local/320/image2/PRODUCTREVIEW/202507/14/2408647955223202065/47c41f6a-a610-441f-8ad9-159c1794721e.jpg,https://thumbnail10.coupangcdn.com/thumbnails/local/320/image2/PRODUCTREVIEW/202507/14/2408647955223202065/8949ec11-2954-4456-a44b-a3e62498dd73.jpg,https://thumbnail7.coupangcdn.com/thumbnails/local/320/image2/PRODUCTREVIEW/202507/14/2408647955223202065/ff9dc210-0132-4874-b225-43e0e9ac39ff.jpg,https://thumbnail7.coupangcdn.com/thumbnails/local/320/image2/PRODUCTREVIEW/202507/14/2408647955223202065/54b89975-584d-4c5d-841c-2dbc1e86ec04.jpg,https://thumbnail7.coupangcdn.com/thumbnails/local/320/image2/PRODUCTREVIEW/202507/14/2408647955223202065/64b2838f-619c-4d99-a906-8de5682709a1.jpg,https://thumbnail6.coupangcdn.com/thumbnails/local/320/image2/PRODUCTREVIEW/202507/14/2408647955223202065/4bb410b6-785e-4d78-9ff5-2c4b4bf8143d.jpg,https://thumbnail9.coupangcdn.com/thumbnails/local/320/image2/PRODUCTREVIEW/202507/14/2408647955223202065/05fed2e2-c167-4f77-b857-6012fa5db1eb.jpg,https://thumbnail7.coupangcdn.com/thumbnails/local/320/image2/PRODUCTREVIEW/202507/14/2408647955223202065/3846b2a1-67be-49b9-86a9-ee55bf706c84.jpg"
4,5,2025.07.10,도마뱀리뷰,기름 때 싸악 잡아주는 엄청난 세척력 주방세제 퐁퐁!,"오랜 시간 저의 설거지 메이트 퐁퐁 친환경 주방세제 입니다.
적은 양에도 거품이 풍부해서 한번에 많은 접시를 닦을 수 있고
친환경 오렌지 오일로 기름기를 싹 잡아주어 세정력 최고예요.
리필 파우치 4개 세트를 가성비 좋은 가격으로 잘 구매 했습니다.
매일 쓰는 여러가지 식기들을 깨끗하게 세척해 주는 주방 세제!
온 가족 입에 닿는 거라 깐깐하고 꼼꼼하게 비교해 보고 골랐어요.
다양한 브랜드에서 굉장히 많은 주방 세제들이 출시되고 있지만
역시 저에게는 퐁퐁 만큼이나 맘에 드는 주방 세제가 없더라구요.
혹해서 다른 제품을 쓰다 가도 다시 되돌아오게 만들어 버립니다.
퐁퐁의 가장 좋은 점은 가성비 좋은 가격에 높은 퀄리티 랍니다.
저는 거품이 많이 나는 걸 좋아해서 세제를 좀 많이 쓰는 편인데
그럼 구매해 놓은 리필들을 금방 써서 다시 구매해야 하거든요.
이번에 구매한 세트도 1.2리터 리필 팩 4개로 구성 되어 있는데
가격은 단돈 8천원으로 굉장히 가성비가 좋다는 걸 알 수 있어요.
넉넉한 양으로 구성이 되어 있어 여유 있게 사용을 할 수 있지요.
퐁퐁 주방 세제의 가장 좋은 점은 주방 식기의 세척 뿐만 아니라
과일 채소의 세척에도 공용으로 사용할 수 있다는 점이랍니다.
여러 주방 도구들에 기기들까지 있어 가뜩이나 주방이 비좁은데
세제 또한 여러 개 두고서 쓰기에는 공간이 남아 있질 않아요.
이것 저것 불편하게 꺼낼 필요 없이 하나로 세척이 가능하니까
너무 편하고 공간도 많이 차지 하지 않으니까 미관상 좋습니다.
식약처에 신고도 완료된 사항이니 안심하고 사용하셔도 돼요.
하룻동안 사용한 식기들을 닦을 때 제일 골치는 역시 기름 때죠.
제대로 닦지 않으면 미끌미끌한 기름이 남아 두어번 더 해야 해서
번거롭기도 하고 설거지가 끝나지 않으니 손목도 아프고 그렇죠.
이게 싫어서 이젠 기름 많이 나오는 음식 하기도 꺼려지게 돼요.
그런데 퐁퐁으로 바꾸고는 그런 걱정이 조금도 들지 않습니다!!
수세미에 거품을 충분히 내서 열심히 비벼 주면 한번만으로도
미끌 거리는 기름 때가 싹 없어지면서 뽀득뽀득 세척이 됩니다!!
갓 설거지 끝낸 깔끔하게 닦인 식기들을 보면 어찌나 개운한지!!
하루에 쌓였던 스트레스가 쫘악 하고 풀리는 느낌까지 들어요!!!
이 엄청난 세척력을 경험해 보고 싶으시다면 퐁퐁 한번 써보세요!",,"https://thumbnail6.coupangcdn.com/thumbnails/local/320/image2/PRODUCTREVIEW/202507/10/3211987587761986024/453b5b96-55e6-4892-82c4-0d756e35a8d8.jpg,https://thumbnail6.coupangcdn.com/thumbnails/local/320/image2/PRODUCTREVIEW/202507/10/3211987587761986024/3ed9d2b3-acce-438b-9977-3d0223fc3247.jpg,https://thumbnail7.coupangcdn.com/thumbnails/local/320/image2/PRODUCTREVIEW/202507/10/3211987587761986024/a94451bf-e935-412d-b8ad-25daa12ddc56.jpg,https://thumbnail10.coupangcdn.com/thumbnails/local/320/image2/PRODUCTREVIEW/202507/10/3211987587761986024/6db487d4-ea9c-4f7c-9db1-541851a8018e.jpg,https://thumbnail10.coupangcdn.com/thumbnails/local/320/image2/PRODUCTREVIEW/202507/10/3211987587761986024/6001f261-4d09-4479-85a4-4990bebd9b5b.jpg,https://thumbnail7.coupangcdn.com/thumbnails/local/320/image2/PRODUCTREVIEW/202507/10/3211987587761986024/dad30071-f5a0-4582-85fc-474322e60e9d.jpg,https://thumbnail7.coupangcdn.com/thumbnails/local/320/image2/PRODUCTREVIEW/202507/10/3211987587761986024/e7dc44f4-8395-4720-905e-4184fe2b74ce.jpg,https://thumbnail8.coupangcdn.com/thumbnails/local/320/image2/PRODUCTREVIEW/202507/10/3211987587761986024/30cd099a-f5c9-49a9-a181-ccab56fd4a4e.jpg,https://thumbnail7.coupangcdn.com/thumbnails/local/320/image2/PRODUCTREVIEW/202507/10/3211987587761986024/cd25798a-3ed0-4643-85fb-e9488037aeda.jpg,https://thumbnail10.coupangcdn.com/thumbnails/local/320/image2/PRODUCTREVIEW/202507/10/3211987587761986024/65f1070c-f303-4a20-9a87-ab234d930062.jpg"
5,5,2025.07.10,강*화,환경을 위해 리필로 구매했는데 양 많고 가성비 짱 좋음,"제품명 : 퐁퐁 친환경 주방세제 오렌지향 리필, 1.2L, 4개
주방세제가 똑 떨어져서 쿠팡 검색후 구매평이 좋은 퐁퐁 친환경 주방세제 오렌지향 리필을 주문 했어요~**
환경을 생각해서 요즘 모든 제품을 리필 제품으로 구매 중 인데
퐁퐁 가격이 너무 착해서 놀랐네요~ㅎㅎ
퐁퐁이 우리 엄마가 주방세제라고 안부르고 퐁퐁이라고 하는 그 제품이죠?? 너무 친근한데 전 퐁퐁 진짜 오랜만에 구입하네요~
기존에 사용하던 다른 제품 투명 용기에 넣었더니 노란빛이 살짝 감도네요~
거품도 적당히 잘 나고 그릇이 뽀드득 깨끗하게 씻겨 나가면 된거죠.
대기업에서 나오는 제품인데 믿고 가성비있는 제품으로 구매하는게
맞는것 같아요~
향은 오렌지향인데 약해서 좋아요~
퐁퐁 친환경 주방세제 오렌지향 리필 제품은 LG생활건강에서 제조한 친환경 1종 주방세제로, 오렌지향이 특징이라고 합니다
◇ 주요 특징 ◇
♧ 1종 주방세제로 야채, 과일, 식기 세척 모두에 사용 가능
♧ 오렌지향으로 상쾌한 사용감
♧ 친환경 인증 제품으로 환경과 건강을 고려한 성분
◇ 주요 성분 ◇
염화나트륨,라우릴에테르황산나트륨,안식향산나트륨,α-올레핀설폰산나트륨,코코넛아미도프로필베타인,알킬벤젠설폰산,수산화나트륨
구연산나트륨,아황산나트륨,아세트산아연이수화물,오렌지향,
오렌지오일,황색4호
이 성분들은 세정력과 안전성, 친환경성을 모두 고려해 배합된 것으로, 식기뿐 아니라 야채와 과일 세척에도 사용할 수 있는 1종 주방세제이고 또한, 친환경 인증을 받은 제품으로, 성분 유해성 평가에서 비교적 안전한 것으로 평가된다고 하니 정말 안심하고
사용가능 하네요~
계면활성제는 음이온 계면활성제(세정력과 거품이 강함)와 양쪽성 계면활성제(저자극, 거품 안정화)를 조합하여 사용해서 이 조합은
세정력, 거품, 저자극성, 환경 친화성을 모두 고려한 배합이라고 함.
대기업에서 모든 면에서 까다롭게 만든 제품이라 믿고 사용 하려고요
잘 쓸게요~
제 구매평도 구매시 도움이 되었으면 좋겠네요~**
행복한 하루 보내세요!!",2.0,"https://thumbnail9.coupangcdn.com/thumbnails/local/320/image2/PRODUCTREVIEW/202507/10/63388665649137350/f72acdb3-7476-43fa-9018-9d9819e0a75a.jpg,https://thumbnail8.coupangcdn.com/thumbnails/local/320/image2/PRODUCTREVIEW/202507/10/63388665649137350/6600d763-6a4a-46ac-a9a4-4c1dbb43b584.jpg,https://thumbnail8.coupangcdn.com/thumbnails/local/320/image2/PRODUCTREVIEW/202507/10/63388665649137350/2c9dcfad-8de9-4022-b2d4-f1e5cbb4c6cf.jpg,https://thumbnail6.coupangcdn.com/thumbnails/local/320/image2/PRODUCTREVIEW/202507/10/63388665649137350/93929d5e-1724-4af1-8cb5-c0f7b18434e8.jpg,https://thumbnail10.coupangcdn.com/thumbnails/local/320/image2/PRODUCTREVIEW/202507/10/63388665649137350/bd2126d7-53f4-4565-81c8-8e27c02cba26.jpg,https://thumbnail7.coupangcdn.com/thumbnails/local/320/image2/PRODUCTREVIEW/202507/10/63388665649137350/222d919d-fb70-4fd0-8c03-464eb7496773.jpg,https://thumbnail7.coupangcdn.com/thumbnails/local/320/image2/PRODUCTREVIEW/202507/13/63388665649137350/d7fdb1b1-1af5-4737-96ac-2a089e29ba24.jpg,https://thumbnail7.coupangcdn.com/thumbnails/local/320/image2/PRODUCTREVIEW/202507/13/63388665649137350/53c6d7a8-5100-402f-91dd-6a462344ea25.jpg,https://thumbnail8.coupangcdn.com/thumbnails/local/320/image2/PRODUCTREVIEW/202507/13/63388665649137350/30240922-402d-43a9-8392-6c6368df8f81.jpg,https://thumbnail6.coupangcdn.com/thumbnails/local/320/image2/PRODUCTREVIEW/202507/13/63388665649137350/9ab4ab48-e8d5-4f3c-9d1d-8aa2bb8ed7ad.jpg"
6,5,2025.07.09,썰레는하루,기존에 구매하던 주방세제 왜이렇게 거품이 안나는지주방세제도 브랜드가 워낙 다양하고 상품군 자체가 워낙 많아서이래저래 고민많이 하고 주문함그와중에 아버지가 몸이 안좋으시다보니 친환경!필수향은 오렌지 향이라고 하지만 오렌지 향이 나는건 잘 모르겠음딱히 향이 느껴지지 않으니 오히려 편안거품 한두번만 펌핑하면 잘 나지 않아서 이번에도 잘못구매했나? 싶었지만너무 소량펌핑했나 싶음거품 풍성하게 잘나고 설거지 해보니 설거지도 깨끗하게 가능1.2L 용량에 이정도 가격 이정도 성능이라면 구매를 망설일 필요가 없음기존에 구매하던 세제가 조금 더 저렴하긴 하지만이제부터 이제품으로 정착하기로 결심저처럼 거품 풍성하게 나는걸 좋아한다 ?! 하시는 분들이라면 무조건 추천설거지하면서 잔여세제 걱정을 안할수는 없는데 친환경이라니더욱 안심하고 사용할수 있음과일이나 채소까지 함께 사용할수 있는 세제는 따로 나와있으니이점은 유의해서 필요한 제품으로 구매하시면 될듯어차피 우리집은 과일이나 채소는 세제를 사용해서 세척하지 않음으로일반 친환경 주방세제로 만족어린아이 젖병까지 소독이 가능하다 하니 이정도로 만족!LG생활건강 제품이라 더욱 믿고 안심하고 사용할수 있을듯세제 필요하신분들이라면 무조건 적극추천!어차피 매일!하루에도 여러번 사용하게되는 주방세제1개입 보다는 다용량 제품으로 구매하는게 조금더 저렴하니주방세제 많이 필요하신 분들이 아니라면 친구들과 공구해도 좋을듯다 사용하고나면 무조건 재구매 의사 200%,"기존에 구매하던 주방세제 왜이렇게 거품이 안나는지
주방세제도 브랜드가 워낙 다양하고 상품군 자체가 워낙 많아서
이래저래 고민많이 하고 주문함
그와중에 아버지가 몸이 안좋으시다보니 친환경!필수
향은 오렌지 향이라고 하지만 오렌지 향이 나는건 잘 모르겠음
딱히 향이 느껴지지 않으니 오히려 편안
거품 한두번만 펌핑하면 잘 나지 않아서 이번에도 잘못구매했나? 싶었지만
너무 소량펌핑했나 싶음
거품 풍성하게 잘나고 설거지 해보니 설거지도 깨끗하게 가능
1.2L 용량에 이정도 가격 이정도 성능이라면 구매를 망설일 필요가 없음
기존에 구매하던 세제가 조금 더 저렴하긴 하지만
이제부터 이제품으로 정착하기로 결심
저처럼 거품 풍성하게 나는걸 좋아한다 ?! 하시는 분들이라면 무조건 추천
설거지하면서 잔여세제 걱정을 안할수는 없는데 친환경이라니
더욱 안심하고 사용할수 있음
과일이나 채소까지 함께 사용할수 있는 세제는 따로 나와있으니
이점은 유의해서 필요한 제품으로 구매하시면 될듯
어차피 우리집은 과일이나 채소는 세제를 사용해서 세척하지 않음으로
일반 친환경 주방세제로 만족
어린아이 젖병까지 소독이 가능하다 하니 이정도로 만족!
LG생활건강 제품이라 더욱 믿고 안심하고 사용할수 있을듯
세제 필요하신분들이라면 무조건 적극추천!
어차피 매일!하루에도 여러번 사용하게되는 주방세제
1개입 보다는 다용량 제품으로 구매하는게 조금더 저렴하니
주방세제 많이 필요하신 분들이 아니라면 친구들과 공구해도 좋을듯
다 사용하고나면 무조건 재구매 의사 200%",2.0,"https://thumbnail7.coupangcdn.com/thumbnails/local/320/image2/PRODUCTREVIEW/202507/9/4922005329649160610/6ed98d0c-22e6-4908-a25e-2e99b4e36a73.jpg,https://thumbnail10.coupangcdn.com/thumbnails/local/320/image2/PRODUCTREVIEW/202507/9/4922005329649160610/a32634da-8a50-479c-afa4-17df31599704.jpg,https://thumbnail10.coupangcdn.com/thumbnails/local/320/image2/PRODUCTREVIEW/202507/9/4922005329649160610/03c42443-46a6-4e69-aeb7-94a69a7ba75c.jpg,https://thumbnail6.coupangcdn.com/thumbnails/local/320/image2/PRODUCTREVIEW/202507/9/4922005329649160610/846c41ca-13e1-4143-a4a7-9f6d72f0ba35.jpg,https://thumbnail6.coupangcdn.com/thumbnails/local/320/image2/PRODUCTREVIEW/202507/9/4922005329649160610/cd000a3e-709e-4d8c-b8d0-e8d6a94bd29b.jpg,https://thumbnail9.coupangcdn.com/thumbnails/local/320/image2/PRODUCTREVIEW/202507/9/4922005329649160610/56b4cc16-7a33-4798-938f-8736f0a3cb5d.jpg,https://thumbnail9.coupangcdn.com/thumbnails/local/320/image2/PRODUCTREVIEW/202507/9/4922005329649160610/9b8cafd2-f15c-4626-9165-656f8650892d.jpg,https://thumbnail7.coupangcdn.com/thumbnails/local/320/image2/PRODUCTREVIEW/202507/9/4922005329649160610/afc1b4d2-d521-4971-906c-05a9f2c120ca.jpg,https://thumbnail6.coupangcdn.com/thumbnails/local/320/image2/PRODUCTREVIEW/202507/9/4922005329649160610/dc47eeda-2fc5-4cde-b177-0b9d04ba025a.jpg,https://thumbnail6.coupangcdn.com/thumbnails/local/320/image2/PRODUCTREVIEW/202507/9/4922005329649160610/c5a66baf-affd-42bb-b6c8-f9e9d9dc573c.jpg"
