rank,rating,date,user,headline,body,helpful_count,images
80,5,2025.07.16,안*진,"아이도 키우고 강아지도 함께 키우다 보니, 주방에서 사용하는 세제는 항상 성분을 꼼꼼하게 따져보게 되더라고요. 예전에는 향이 강하거나 거품이 많은 세제를 선호했는데, 요즘은 자극 적고 자연 유래 성분이 들어간 제품에 더 손이 가게 돼요. 그러다 찾게 된 게 바로 이 퐁퐁 천연 오렌지 오일 담은 주방세제 리필이에요. 1.2L짜리 대용량 리필 6개 세트로 쿠팡에서 구매했는데, 가격도 합리적이고 배송도 빠르게 와서 만족했어요.일단 가장 마음에 들었던 건 세제에서 나는 은은한 오렌지 향이에요. 인공적인 향이 아니라 자연스러운 과일향이라 기분도 좋아지고, 설거지할 때 스트레스가 줄어드는 느낌이랄까요? 향에 예민한 남편도 “이거 무슨 세제야? 냄새 좋네” 하고 물어볼 정도였어요.무엇보다 세정력이 생각보다 훨씬 강력해서 놀랐어요. 기름진 프라이팬이나 삼겹살 구운 접시 같은 것도 살짝만 문질러도 깨끗하게 잘 닦여요. 거품도 풍성하게 나는 편이라 물 절약하면서도 헹굼이 편했고, 잔여감 없이 개운하게 마무리돼서 마음에 들었어요. 또, 세정력이 강한데도 손이 전혀 건조하거나 따갑지 않다는 점이 진짜 장점이에요. 저는 손에 물 닿으면 금방 트는 편인데, 이건 사용 후에도 손이 부드럽게 유지돼요. 성분표를 보니 천연 유래 세정 성분과 오렌지 오일이 함유되어 있어서 안심이 되더라고요.리필팩 포장도 튼튼하게 되어 있어서 보관이나 사용이 편리했고, 입구가 깔끔하게 잘 짜지도록 설계돼 있어서 덜어쓰기도 쉬웠어요. 기존에 쓰던 펌핑 용기에 리필해서 사용 중인데 한 번 리필해두면 꽤 오랫동안 사용 가능해서 경제적이에요. 6개 세트라 넉넉해서 부모님 댁에도 한두 개 챙겨 드렸는데, 어머니도 ""요즘 세제 중에 이게 제일 괜찮다"" 하시더라고요.기름때 제거도 잘되고, 성분도 순하고, 향도 부담 없어서 아이 식기나 젖병 세척에도 안심하고 사용할 수 있는 세제라는 게 가장 큰 장점이에요. 예전엔 식기 전용, 젖병 전용, 기름기 전용 따로따로 샀었는데, 이 제품은 다용도로 무리 없이 쓸 수 있어서 세제 종류를 줄이게 됐어요.종합적으로 보면, 이 제품은 성분·세정력·향·가격 모든 면에서 균형이 잘 잡힌 주방세제예요. 재구매 의사 100%고, 앞으로는 이걸로 정착하려고요. 성분 걱정 없는 착한 주방세제 찾으시는 주부님들께 추천 해요^^","아이도 키우고 강아지도 함께 키우다 보니, 주방에서 사용하는 세제는 항상 성분을 꼼꼼하게 따져보게 되더라고요. 예전에는 향이 강하거나 거품이 많은 세제를 선호했는데, 요즘은 자극 적고 자연 유래 성분이 들어간 제품에 더 손이 가게 돼요. 그러다 찾게 된 게 바로 이 퐁퐁 천연 오렌지 오일 담은 주방세제 리필이에요. 1.2L짜리 대용량 리필 6개 세트로 쿠팡에서 구매했는데, 가격도 합리적이고 배송도 빠르게 와서 만족했어요.
일단 가장 마음에 들었던 건 세제에서 나는 은은한 오렌지 향이에요. 인공적인 향이 아니라 자연스러운 과일향이라 기분도 좋아지고, 설거지할 때 스트레스가 줄어드는 느낌이랄까요? 향에 예민한 남편도 “이거 무슨 세제야? 냄새 좋네” 하고 물어볼 정도였어요.
무엇보다 세정력이 생각보다 훨씬 강력해서 놀랐어요. 기름진 프라이팬이나 삼겹살 구운 접시 같은 것도 살짝만 문질러도 깨끗하게 잘 닦여요. 거품도 풍성하게 나는 편이라 물 절약하면서도 헹굼이 편했고, 잔여감 없이 개운하게 마무리돼서 마음에 들었어요. 또, 세정력이 강한데도 손이 전혀 건조하거나 따갑지 않다는 점이 진짜 장점이에요. 저는 손에 물 닿으면 금방 트는 편인데, 이건 사용 후에도 손이 부드럽게 유지돼요. 성분표를 보니 천연 유래 세정 성분과 오렌지 오일이 함유되어 있어서 안심이 되더라고요.
리필팩 포장도 튼튼하게 되어 있어서 보관이나 사용이 편리했고, 입구가 깔끔하게 잘 짜지도록 설계돼 있어서 덜어쓰기도 쉬웠어요. 기존에 쓰던 펌핑 용기에 리필해서 사용 중인데 한 번 리필해두면 꽤 오랫동안 사용 가능해서 경제적이에요. 6개 세트라 넉넉해서 부모님 댁에도 한두 개 챙겨 드렸는데, 어머니도 ""요즘 세제 중에 이게 제일 괜찮다"" 하시더라고요.
기름때 제거도 잘되고, 성분도 순하고, 향도 부담 없어서 아이 식기나 젖병 세척에도 안심하고 사용할 수 있는 세제라는 게 가장 큰 장점이에요. 예전엔 식기 전용, 젖병 전용, 기름기 전용 따로따로 샀었는데, 이 제품은 다용도로 무리 없이 쓸 수 있어서 세제 종류를 줄이게 됐어요.
종합적으로 보면, 이 제품은 성분·세정력·향·가격 모든 면에서 균형이 잘 잡힌 주방세제예요. 재구매 의사 100%고, 앞으로는 이걸로 정착하려고요. 성분 걱정 없는 착한 주방세제 찾으시는 주부님들께 추천 해요^^",3.0,"https://thumbnail10.coupangcdn.com/thumbnails/local/320/image2/PRODUCTREVIEW/202507/16/5080739866091504398/fd3eadd8-a4c1-403e-88d9-51b6ffe6abff.jpg,https://thumbnail6.coupangcdn.com/thumbnails/local/320/image2/PRODUCTREVIEW/202507/16/5080739866091504398/0cd6dc67-3d66-4e52-9654-cc09d60dc329.jpg,https://thumbnail7.coupangcdn.com/thumbnails/local/320/image2/PRODUCTREVIEW/202507/16/5080739866091504398/d23aa29e-172a-48ac-a74e-97207c22b8f1.jpg"
81,5,2025.02.03,조비오,가성비 최고 친환경 친숙한 이름 퐁퐁,"♠️쿠팡으로 장보는 두아들 아부지 입니다
집에서 모여 밥 먹는걸 좋아하는 4인가구 입니다
직장다니는 두아들 저 와이프
저희집은 될수 있으면 집밥을 먹습니다
일하거나 힘을 쓰거나 머리회전도 바로 밥심인거 같아
아침밥도 꼭 챙겨 먹습니다
그러다 보니 ᆢ
매일 아침 저녁 나오는 설거지도 많습니다
물론 와이프가 설거지 하지만
조만간 식세기 이모님을 들일까 생각중인데
아들들 결혼하고 독립하면 필요 없다는 마나님 말에 마음을
접고 있습니다
주방세제는  모든 식기 냄비 주방찌든때 욕실청소  다용도로
쓰고 있습니다
주방세제 주문 하라는 말에 ~~~~
아무 생각없이 익숙한 이름 퐁퐁 으로 주문 했습니다
와이프가 뭐라고 잔소리 하는데 ᆢ
아니면 반품함 되지
다음날 아침 배송 받았는데
마침 주방세제가  다쓰고 없어  어쩔수 없이 개봉 했는데
향 좋고 기름 냄비 팬 세척 잘되고 거품도 잘 나고 헹굼도
뽀드득 뽀드득 거린다고 만족 하네요
퐁퐁은 아주 어릴쩍부터 사용하던 이름이라 남자인 저는
잘 모르지만 와이프는 LG생활 건강제품이라 하네요
친환경제품이고 아가들 젓병도 세척 가능한 좋은 성분이라 안심하고 쓸수 있다고 하고 빠른 세제 잔여물도 제거 되어
시간도 절약 된다고 합니다
맨손으로 설거지 안하고 장갑을 착용하지만
가끔은 매손으로 주방설거지 하니 좋은 성분이면 좋치 않을까요
오랫만에  남뽄이 주문 잘했네 ~~칭찬 받았습니다 ㅎㅎ
가격도 4팩 완전 착해서
몇개월은 푸근하게 쓸수 있습니다
제글을 읽으시고 가실때 도움돼요
꾸욱 눌러주시고 가십시오
감사합니다",19.0,"https://thumbnail6.coupangcdn.com/thumbnails/local/320/image2/PRODUCTREVIEW/202502/3/7103869958639322441/f2d97762-7439-4b5e-b0fc-ed6c499b6d80.jpg,https://thumbnail9.coupangcdn.com/thumbnails/local/320/image2/PRODUCTREVIEW/202502/3/7103869958639322441/6989e6d2-e4cf-4c26-ad3c-8136bac8a0f5.jpg,https://thumbnail8.coupangcdn.com/thumbnails/local/320/image2/PRODUCTREVIEW/202502/3/7103869958639322441/64466002-b42b-4630-a10a-242be0c9a0c6.jpg,https://thumbnail7.coupangcdn.com/thumbnails/local/320/image2/PRODUCTREVIEW/202502/3/7103869958639322441/8548391b-8aa1-4ddc-b935-c47f9986d0d8.jpg,https://thumbnail10.coupangcdn.com/thumbnails/local/320/image2/PRODUCTREVIEW/202502/3/7103869958639322441/6bc046af-dd5c-4894-a522-2f6220d2aed9.jpg,https://thumbnail9.coupangcdn.com/thumbnails/local/320/image2/PRODUCTREVIEW/202502/3/7103869958639322441/f2d8f54f-d4e8-49f8-84ee-53be36b508e4.jpg,https://thumbnail7.coupangcdn.com/thumbnails/local/320/image2/PRODUCTREVIEW/202502/3/7103869958639322441/de52b935-5b06-4548-af7b-48e34b82cefb.jpg,https://thumbnail7.coupangcdn.com/thumbnails/local/320/image2/PRODUCTREVIEW/202502/3/7103869958639322441/0caefe2f-9261-42e7-aa1d-f90e826f248a.jpg,https://thumbnail7.coupangcdn.com/thumbnails/local/320/image2/PRODUCTREVIEW/202502/3/7103869958639322441/9039f180-ff44-43c4-a33d-7e877bf753eb.jpg,https://thumbnail8.coupangcdn.com/thumbnails/local/320/image2/PRODUCTREVIEW/202502/3/7103869958639322441/8deabebf-354c-413d-8e64-672f3292f6c2.jpg"
82,5,2025.05.01,musunil,향과 세척력 모두 좋아요!,"집밥을 많이 해먹다보니 당연히 설거지도 많이 나오고 이로인해 주방세제도 많이 소진되더라구요
종종 마트에서 아무거나 사서 쓰다보면 거품이 잘 나지않아 제품을 많이 써야 하는 때가 있는데
역시 퐁퐁이라서 그런지 이 제품 거품과 세정력 모두 너무 만족합니다!
리필형태로 4팩이 들어있구요
유통기한도 길고 많은 양이라서 한동안 세제 걱정없이 사용할 수 있어요
집에 세제 용기는 거의 다 있으니 덜어쓰시면 되구요
향은 오렌지향으로 강하지 않게 은은하구요
제품은 투명한 겔타입입니다.
이 세제가 참 좋은게 적은양으로도 거품이 아주 잘 나구요
세정력이 좋아서 기름기도 잘 닦여 만족스러워요
또한 1종 세제여서 안전하게 안심하고 사용할 수 있고
과일, 야채까지 세척할 수 있습니다.
주방세제 잘못사면 은근 화나는데 이번에는 제대로 잘 산것 같고
이렇게 리필 타입으로 사두면 경제적이라서 앞으로도 재구매하고 싶습니다.
거품 잘 나고 세정력이 좋으며 과일, 야채 세정이 가능한 안심세제
찾으시는 분들께 퐁퐁 친환경 주방세제 적극 추천드립니다!!!",,"https://thumbnail6.coupangcdn.com/thumbnails/local/320/image2/PRODUCTREVIEW/202505/1/1911902179696939041/ad806f49-7b10-47ee-b79d-32beb98682a9.jpg,https://thumbnail9.coupangcdn.com/thumbnails/local/320/image2/PRODUCTREVIEW/202505/1/1911902179696939041/8a745bf9-4e50-4165-ba96-fb914aff9078.jpg,https://thumbnail8.coupangcdn.com/thumbnails/local/320/image2/PRODUCTREVIEW/202505/1/1911902179696939041/c5eb8c0e-3760-4dd0-b7d1-5c44305a7093.jpg,https://thumbnail6.coupangcdn.com/thumbnails/local/320/image2/PRODUCTREVIEW/202505/1/1911902179696939041/5fbebad2-1ac2-494e-b38a-144a5e8e33fb.jpg,https://thumbnail6.coupangcdn.com/thumbnails/local/320/image2/PRODUCTREVIEW/202505/1/1911902179696939041/d059dbb5-5dfa-4f6e-81f0-c795c3673802.jpg"
83,5,2025.02.01,JIN *******,"LG생건 퐁퐁, 스테디 셀러!! 가성비 굿 리필 포장!","가성비 굿! - LG생활건강 퐁퐁 주방세제, 리필 대용량 구매 후기
1) 구매 동기: 요즘같이 고물가 시대에 생활용품 하나를 사더라도 가성비를 따지게 됩니다. 특히, 주방세제는 매일 사용하는 필수품이라 더욱 꼼꼼하게 고르는 편입니다. 리필 제품을 선호하고 있습니다. 그러던 중 이미 써봐서 만족도가 높았던 LG생활건강 퐁퐁 주방세제가 1.2L 대용량 리필로 4개나 구성된 세트를 발견했습니다. 써본 세제 중에 가장 만족도가 높았던 세제를 대용량으로, 그리고 리필로 구매할 수 있다니 고민 없이 선택했습니다.
2) 제품 구성 & 제조년월 굿: 무엇보다 1.2L 대용량 리필 4개 구성이라는 점이 가장 마음에 들었습니다. 넉넉한 용량 덕분에 한동안 세제 걱정 없이 사용할 수 있겠습니다. 기존 용기에 덜어서 사용하면 되니까 플라스틱 사용량도 줄일 수 있고, 경제적으로도 훨씬 이득입니다. 알뜰 소비와 환경 보호를 동시에 실천할 수 있는 똑똑한 제품이라는 생각이 듭니다. 특히, 제조연월이 2025년 1월 16일로, 생산된 지 얼마 안 된 최신 제품이라 더 믿음이 갔습니다!
3) 사용 후기: 이미 여러 번 사용해봤지만, 다시 사용해봐도 역시 세척력이 훌륭합니다. 기름기 묻은 그릇도 뽀득뽀득 잘 닦이고, 헹굼도 빨라서 잔여 세제 걱정이 없습니다. 천연 오렌지 오일이 들어있어서 그런지 설거지할 때 은은하게 퍼지는 상큼한 향도 기분 좋게 만들어줍니다. 맨손 설거지에도 자극이 적었습니다.
4) 신뢰도: 역시 LG생활건강 제품이라 믿고 사용할 수 있습니다. 성분 하나하나 신경 쓴 게 느껴집니다.
5) 총평: LG생활건강 퐁퐁 주방세제는 리필 대용량 구성으로 경제성은 물론, 환경까지 생각한 똑똑한 제품입니다. 세척력, 향까지 어느 하나 빠지는 게 없습니다. 특히, 알뜰 소비를 추구하는 분들, 환경 보호에 관심 있는 분들, 그리고 안심하고 사용할 수 있는 주방세제를 찾는 모든 분들께 강력 추천합니다!
저도 앞으로 퐁퐁으로 정착해서 꾸준히 사용할 예정입니다.",10.0,"https://thumbnail10.coupangcdn.com/thumbnails/local/320/image2/PRODUCTREVIEW/202502/1/7542643420274425106/9c9f951a-1520-4667-b135-affd4da979b0.jpeg,https://thumbnail9.coupangcdn.com/thumbnails/local/320/image2/PRODUCTREVIEW/202502/1/7542643420274425106/e15812fd-dc9d-472a-a6cd-cf9247373f0c.jpeg,https://thumbnail7.coupangcdn.com/thumbnails/local/320/image2/PRODUCTREVIEW/202502/1/7542643420274425106/09a1df01-72bf-4796-a8c1-89af1702ff2d.jpeg,https://thumbnail6.coupangcdn.com/thumbnails/local/320/image2/PRODUCTREVIEW/202502/1/7542643420274425106/d4532858-53c9-449c-9eb0-9d25172a1bee.jpeg,https://thumbnail9.coupangcdn.com/thumbnails/local/320/image2/PRODUCTREVIEW/202502/1/7542643420274425106/51776c00-a16e-4e6a-887f-149899d1a52d.jpeg,https://thumbnail8.coupangcdn.com/thumbnails/local/320/image2/PRODUCTREVIEW/202502/1/7542643420274425106/d99e2f86-4352-4bba-aff7-81915672f48a.jpeg,https://thumbnail8.coupangcdn.com/thumbnails/local/320/image2/PRODUCTREVIEW/202502/1/7542643420274425106/9ed70433-fcd0-4adb-bfac-b03a8d99377f.jpeg"
84,5,2025.01.31,행복한돼지,퐁퐁 주방세제 뽀득뽀득 아주 잘 닦여요! :),"** 구매이유 : ❤️일하는 곳이 식당이라 그릇과 식기들을 늘 청결하고 깨끗하게 설거지해야하는데요!! ‼️주방세제를 아주 큰 통에 들어있는거로 구매해서 자주 사용해왔었는데 ❗️너무 큰 통에 들어있으면 리필 통에 옮겨 담기에도 무거워서 힘들고 팔이가 아주 뚝 떨어질거처럼 아프더라구요!! ‼️
✔️그래서 다른 주방세제를 사보자! ❗️기존에 샀던 크고 무거운 주방세제가 아닌 다른 브랜드에 주방세제인데 가볍지만 양은 많은 걸 위주로 찾았어요! ❗️
❤️그중에서도 퐁퐁 주방세제가 가장 제가 찾는거랑 비슷하고 ❗️그릇도 깔끔하게 잘 닦일거 같아 이걸로 구매하게 되었어요!❗️
** 장점 : ❤️일단 주방세제가 향이 너무 강하거나 너무 자극적인 향이나면 설거지할 때도 코가 괴롭고 눈살도 찌푸려 지는데❗️ 퐁퐁 주방세제는 향이 일단 너무 좋아요! ❗️
✔️향이 너무 쌔지 않고 은은하게 오렌지향이 퍼져서 기분 좋게 설거지하기 좋더라구요!! ‼️설거지하기도 힘든데 향이 좋으니 일단 기분이 좋습니다!❗️ :)❤️
❤️또 저희는 싱크대 윗 쪽에 주방세제 여분 통이 있어서 리필로만 구매하고 그 여분 통에 옮겨 담아 사용하고 있는데요!!‼️
✔️퐁퐁 리필 보니깐 입구쪽이 플라스틱으로 동그랗게 되어있어서 ❗️여분 통에 옮겨 담기가 아주 편리하고 무겁지 않고 좋더라구요!! ‼️리필 하나가 딱 여분통 하나로 나와서 옮겨 담기 아주 좋습니다!❗️
❤️또 주방세제 구매해서 사용하다보면 거품이 잘 안나는 제품들이 있는데 ❗️이건 아주 거품이 잘나고 그릇들을 닦았을 때 뽀득뽀득 느낌이 나서 좋아요!❗️
** 단점 : ✔️주방세제 사용해보았는데 그릇들이 뽀득뽀득 깨끗하게 잘 닦이구요!! ‼️불편하거나 단점은 느끼지 못했어요!❗️
** 사용 후 느낀점 : ❤️너무 큰 리필 통으로 구매해서 사용하다보면 가지고 있던 여분 통에 옮겨담기 힘들더라구요ㅜㅜ ❗️그래서 기존에는 큰 통으로 되어있는거만 구매해서 사용하다가 이번에는 리필 양이 적당하게 들어있지만 ❗️여러개 묶음으로 되어있는걸 구매해서 사용해보니 여분통에 옮기기에도 아주 편하고 좋았어요!!‼️
❤️또 주방세제 향이 너무 자극적이거나 강하지 않아서 사용할 때 코도 편한하고 머리도 안아프게 사용할 수 있어요!❗️
✔️특히 오렌지향이 은은하게 퍼져서 기분좋게 설거지를 할 수가 있습니다 :)❤️
❤️주방세제 사용해보니 거품도 풍성하게 잘 나구요!! ‼️기름기 묻은 그릇이나 후라이팬도 아주 잘 닦이더라구요! ❗️특히 마무리로 행굴 때 뽀득뽀극 느낌 너무 좋습니다!❗️
✔️지금 구매한 주방세제들 다 사용하면 다시 재구매 의사 있습니다 :)❤️",5.0,"https://video.coupangcdn.com/cloud/PRODUCTREVIEW/202501/31/3698164499558278883/766e63b8-1cd6-409a-ade3-e63d69060990/transcode/thumbnail-00001.png,https://thumbnail6.coupangcdn.com/thumbnails/local/320/image2/PRODUCTREVIEW/202501/31/3698164499558278883/f50a31f8-fa8f-491b-8a89-f52b33e473b2.jpg,https://thumbnail6.coupangcdn.com/thumbnails/local/320/image2/PRODUCTREVIEW/202501/31/3698164499558278883/8b497096-5583-4e4d-9c71-3718612b8709.jpg,https://thumbnail9.coupangcdn.com/thumbnails/local/320/image2/PRODUCTREVIEW/202501/31/3698164499558278883/0eea2368-5ec6-441f-ba1b-9559218d1124.jpg,https://thumbnail8.coupangcdn.com/thumbnails/local/320/image2/PRODUCTREVIEW/202501/31/3698164499558278883/cbe33be9-bd9a-4f1a-a103-9514dfde1b99.jpg,https://thumbnail9.coupangcdn.com/thumbnails/local/320/image2/PRODUCTREVIEW/202501/31/3698164499558278883/82e8aaff-d98c-4e3a-8cdd-30b6588b6ed4.jpg,https://thumbnail8.coupangcdn.com/thumbnails/local/320/image2/PRODUCTREVIEW/202501/31/3698164499558278883/c0f586be-7419-4b8a-9f84-1cf4d14cb1ed.jpg,https://thumbnail7.coupangcdn.com/thumbnails/local/320/image2/PRODUCTREVIEW/202501/31/3698164499558278883/099d3169-b6bd-4b9e-b7c1-bed8aeabddf3.jpg,https://thumbnail6.coupangcdn.com/thumbnails/local/320/image2/PRODUCTREVIEW/202501/31/3698164499558278883/8c9dc09a-4efb-45f1-9214-3d2365175d34.jpg,https://thumbnail8.coupangcdn.com/thumbnails/local/320/image2/PRODUCTREVIEW/202501/31/3698164499558278883/cc61d92d-04e9-49f5-aacd-31eeafa86447.jpg,https://thumbnail9.coupangcdn.com/thumbnails/local/320/image2/PRODUCTREVIEW/202501/31/3698164499558278883/d4741e84-b8e6-4818-9022-5ae51a0c5f57.jpg"
85,5,2025.01.29,5bong,오렌지향은 상큼함이 뽀득뽀득,"먼저 향이 다르네요
상쾌함을 더해 주어 무엇이든 뽀드득
뽀드득 소리를 낼것 같은 상쾌함이 있네요~^
개수대 한가득 찬 설거지 그릇들이
짜증나기도 하는데
따뜻한 물에 거품 잔뜩내고 뽀송뽀송하게
설거지 기분을 더 좋고 기분나게 하는
주방세정제를 산것 같네요
(*＞∇＜)ﾉ(*＞∇＜)ﾉ(*＞∇＜)ﾉ
써 보았더니 좋은점 몇가지 올려볼께요.
첫째. 상쾌한 오렌지향으로 상큼한게
오렌지를 연상시켜 더 상쾌함과 친근함을느끼네요.
둘째. 1.2리터의 리필형으로 다른 통에 덜어서 쓰기 편하구요 .
셋째. 뛰어난 세정력이. 거품이 잘나며 세균에 찌꺼기까지 깔끔하게 씻겨 내려가는거 같아요. 설거지 후  뽀득뽀득 함이 느껴져요.
넷째. 친환경 제품 이랍니다. 주방에서 일하다보면 급한대로 맨손으로 설거지 하는. 주부들이 많을거에요.
그럴때 마다 손이 거칠겻 같은 마음이 앞사는데
친환경이라 그래도 조금은 안심이네요.
다섯째. 착한 가격에 3통이나 되니 든든합니다. 부담없이 살수 있었네요.
♡♡♡..*      ♡♡♡..*     ♡♡♡..*
설거지 좋아하는 사람은 없을 것인데요.
나름 설거지에서 느끼는 즐거움
자기만족을 느낄수 있어  좋은 기회가 되었네요
저는 저 나름대로 가장 기분 좋을 때는
설거지  후 배수구의 거름망 까지. 깨끗이
다 털어내고 비워내고  깨끗하니 말랐을때
기분이 좋더라구요. 기름끼 없이 깔끔하게
씻기는 기분이 상쾌하고
시원함을 느낍니다.
리필 3통이라. 한동안은 안 살것 같기는 한데요
다음에 다시 주문 한다면 또
주문 하겠습니다.
저에 후기가 많은분들의 도움이 되었으면 좋겠습니다.~~^",1.0,"https://thumbnail10.coupangcdn.com/thumbnails/local/320/image2/PRODUCTREVIEW/202502/25/2926165320549683065/f3986466-e784-476c-98d8-127910480f3d.jpg,https://thumbnail10.coupangcdn.com/thumbnails/local/320/image2/PRODUCTREVIEW/202502/25/2926165320549683065/6db58733-7d15-47c1-8c55-cb8b2af94f93.jpg,https://thumbnail6.coupangcdn.com/thumbnails/local/320/image2/PRODUCTREVIEW/202502/25/2926165320549683065/36e4f93b-e66f-43b0-bfb2-d5770247dac2.jpg,https://thumbnail6.coupangcdn.com/thumbnails/local/320/image2/PRODUCTREVIEW/202502/25/2926165320549683065/b8949722-04b7-4478-a0aa-992ca25a70c3.jpg,https://thumbnail6.coupangcdn.com/thumbnails/local/320/image2/PRODUCTREVIEW/202502/25/2926165320549683065/0efb7e2f-b344-4134-be20-5b38af4936bf.jpg,https://thumbnail6.coupangcdn.com/thumbnails/local/320/image2/PRODUCTREVIEW/202502/25/2926165320549683065/11ebbb84-ad2e-473b-8dcd-94ec7c45994b.jpg,https://thumbnail6.coupangcdn.com/thumbnails/local/320/image2/PRODUCTREVIEW/202502/25/2926165320549683065/cf4008b2-d507-4943-889b-83d8ae045c17.jpg"
