rank,rating,date,user,headline,body,helpful_count,images
1,5,2025.07.21,,급하게 모기 한마리 잡는데 좋네요,"☘️에프킬라 수성 에어로돌 모기살충제
✔️용량 : 500ml
낮에는 창문 다 열어놓고 있어서 인지 가끔가다 모기 한마리가 꼭 현관문 열때 들어오는지 밤에 불 끄면 앵앵 거리며 신경쓰게 해서 항상 숨바꼭질 하며 잠을 설치는데 모기 위치 확인하는 즉시 뿌리면 바로 게임아웃 이라 여름이면
항상 상비로 구비해 놓는게 에프킬라 수성 에어로졸 이예요
누구나 다 아는 오랜전통의 에프킬라는 여러형태와 종류에 제품이 있지만 그중에 눈으로 보고 바로 뿌릴수 있는
에어로졸이 제일 빠른효과가 있어 좋아요
분사전에 살짝 흔들어 주어 내용물이 잘 섞이도록 하고 뿌려주는데 요즘 과일먹은 주위에 잘 생기는 초파리들에 살짝만 분사해도 금방 몆초 안돼어 사체가 되는걸 보니 효과 좋긴해요
집에 반려견이 있어
많이 뿌리기가 꺼려지는데 뿌리고 충분한 환기를 하면 벌레에만 작용할 만한 살충성분 이라 하니 잘 환기시키며 사용해야 할것 같네요
무향이라고는 하나 완전한 무향은 아닌거 같고 살충제 성분에 독특한 알코올 같은 냄새는 나는것 같은데 크게 거슬리지는 않았어요
수성이라 그런지 뿌리고 바닥이 미끌거리지는 않아서 맘에 들구요
다 쓰고 난뒤 캔에 구멍을 낸뒤 내용물 확실히 제거한뒤 캔류에 분리수거 하면 되구요
요즘 모기며 초파리며 습하면 생기는 이름모를 벌레며 필요할때 옆에두고 바로바로 사용하고 있어서 여름 가정에 필수품이 아닌가 싶네요
오랜전통에 뿌리는 모기약 찾으시면 추천드려요
그럼 쿠팡에서 만족한 구매하세요♡♡",,"https://thumbnail9.coupangcdn.com/thumbnails/local/320/image2/PRODUCTREVIEW/202507/21/8969241584068283408/ef7065a3-09c3-4948-96cf-fb49a8864b3b.jpg,https://thumbnail6.coupangcdn.com/thumbnails/local/320/image2/PRODUCTREVIEW/202507/21/8969241584068283408/55820670-6b02-4a6b-ad48-f14df0ac438b.jpg,https://thumbnail6.coupangcdn.com/thumbnails/local/320/image2/PRODUCTREVIEW/202507/21/8969241584068283408/7f70a1db-fe33-4bf5-85e4-4d43deeabc22.jpg,https://thumbnail9.coupangcdn.com/thumbnails/local/320/image2/PRODUCTREVIEW/202507/21/8969241584068283408/57058685-fad4-4cc1-a3b9-fcbb6bcdf598.jpg,https://thumbnail7.coupangcdn.com/thumbnails/local/320/image2/PRODUCTREVIEW/202507/21/8969241584068283408/0ec23db5-057f-4a0c-8477-dc6d3ec64b2c.jpg,https://thumbnail10.coupangcdn.com/thumbnails/local/320/image2/PRODUCTREVIEW/202507/21/8969241584068283408/d5f488dc-9927-4253-aa37-b70f98ed5781.jpg,https://thumbnail6.coupangcdn.com/thumbnails/local/320/image2/PRODUCTREVIEW/202507/21/8969241584068283408/6689424b-7505-44e7-b5fb-8f68be4f3321.jpg,https://thumbnail10.coupangcdn.com/thumbnails/local/320/image2/PRODUCTREVIEW/202507/21/8969241584068283408/52f5e742-62dc-40b2-b246-0116dc058748.jpg,https://thumbnail8.coupangcdn.com/thumbnails/local/320/image2/PRODUCTREVIEW/202507/21/8969241584068283408/c8c7d4fe-81dc-4456-8b98-cafef9965521.jpg,https://thumbnail9.coupangcdn.com/thumbnails/local/320/image2/PRODUCTREVIEW/202507/21/8969241584068283408/743be9ee-8bed-492f-97bf-ae254c4b8a67.jpg"
2,5,2025.07.20,,"매년 여름이면 찾아오는 불청객, 모기와 파리 때문에 잠 못 이루고 일상생활에도 방해를 받는 분들이 많으실 겁니다. 저 역시 여름만 되면 모기와의 전쟁을 치르곤 했는데요. 이번 여름에는 '에프킬라 무향 에어로솔' 덕분에 한층 더 쾌적하고 편안한 시간을 보내고 있습니다. 에프킬라는 SC 존슨의 60년 이상 축적된 노하우와 세계 판매 1위 살충제 기술력이 집약된 제품이라고 해서 더욱 믿음이 갔습니다. 직접 사용해보니 왜 그렇게 많은 사람들이 선택하는지 알 수 있었습니다.빠르고 강력한 살충 효과이 제품의 가장 큰 장점은 바로 '강력하고 빠른 살충 효과'입니다. 여름철 모기는 정말 잠깐의 방심도 허락하지 않죠. 특히 밤에 잠들기 전 귓가를 맴도는 모기 소리는 스트레스 그 자체입니다. 에프킬라 무향 에어로솔은 모기를 발견하는 즉시 분사하면 눈 깜짝할 사이에 제압됩니다. 단순히 잠시 기절시키는 것이 아니라 확실하게 살충하는 것을 눈으로 확인할 수 있었어요. 밤늦게까지 작업하거나 독서를 할 때 모기가 극성인데, 이 제품 덕분에 집중력을 잃지 않고 편안하게 시간을 보낼 수 있었습니다. 살충 성분이 벌레에만 작용하도록 설계되어 있고, 충분한 환기를 시키면 인체나 반려동물에 해롭지 않다는 점도 안심하고 사용할 수 있는 부분입니다.무향으로 더 상쾌하게기존의 살충제들은 특유의 독한 냄새 때문에 사용 후에도 환기를 오래 해야 하고, 냄새가 남아 불편함을 느끼는 경우가 많았습니다. 특히 밀폐된 공간에서 사용하기에는 더욱 부담스러웠죠. 하지만 에프킬라 무향 에어로솔은 이름 그대로 '무향'입니다. 처음 분사할 때도 거의 냄새를 느낄 수 없었고, 사용 후에도 잔향이 남지 않아 매우 쾌적했습니다. 덕분에 냄새 걱정 없이 필요한 순간에 바로바로 사용할 수 있었고, 아이가 있는 집에서도 안심하고 사용할 수 있겠다는 생각이 들었습니다. '미끌거림, 석유냄새, 밤샘모기걱정' 이 세 가지가 없다는 3無 문구가 정말 와닿는 부분이었습니다. 수성 베이스라 그런지 분사 후 바닥에 남는 끈적임도 전혀 없어서 더욱 만족스러웠습니다.간편한 사용과 편리한 보관사용법도 매우 간편합니다. 사용 전 에어로솔을 충분히 흔들어 주어야 살충 성분이 잘 섞여 빠른 살충 효과를 볼 수 있다고 하니, 이 부분만 지켜주면 됩니다. 그리고 사용 후에는 고압가스 제품인 만큼 송곳 등으로 캔에 구멍을 내어 '캔류'로 분리수거하고, 캡 부분은 '플라스틱'으로 분리수거하면 되니 처리 방법도 어렵지 않습니다. 집안 곳곳에 비치해두고 필요할 때마다 꺼내 쓰기 좋으며, 디자인도 깔끔해서 보관에도 부담이 없습니다. 저는 거실, 침실, 주방 등 모기가 자주 출몰하는 곳마다 하나씩 두어서 언제든 사용할 수 있도록 했습니다.총평 및 추천에프킬라 무향 에어로솔은 단순히 모기를 잡는 살충제를 넘어, 쾌적하고 건강한 주거 환경을 만들어주는 데 크게 기여하는 제품이라고 생각합니다. 강력한 살충 효과와 더불어 무향이라는 점이 가장 큰 장점이며, 남녀노소 누구나 안심하고 사용할 수 있는 점도 매력적입니다. 특히 모기에 민감하거나 냄새에 취약한 분들에게 강력히 추천하고 싶습니다. 올여름, 에프킬라 무향 에어로솔로 지긋지긋한 모기와의 전쟁을 끝내고 편안한 일상을 되찾으시길 바랍니다.","매년 여름이면 찾아오는 불청객, 모기와 파리 때문에 잠 못 이루고 일상생활에도 방해를 받는 분들이 많으실 겁니다. 저 역시 여름만 되면 모기와의 전쟁을 치르곤 했는데요. 이번 여름에는 '에프킬라 무향 에어로솔' 덕분에 한층 더 쾌적하고 편안한 시간을 보내고 있습니다. 에프킬라는 SC 존슨의 60년 이상 축적된 노하우와 세계 판매 1위 살충제 기술력이 집약된 제품이라고 해서 더욱 믿음이 갔습니다. 직접 사용해보니 왜 그렇게 많은 사람들이 선택하는지 알 수 있었습니다.
빠르고 강력한 살충 효과
이 제품의 가장 큰 장점은 바로 '강력하고 빠른 살충 효과'입니다. 여름철 모기는 정말 잠깐의 방심도 허락하지 않죠. 특히 밤에 잠들기 전 귓가를 맴도는 모기 소리는 스트레스 그 자체입니다. 에프킬라 무향 에어로솔은 모기를 발견하는 즉시 분사하면 눈 깜짝할 사이에 제압됩니다. 단순히 잠시 기절시키는 것이 아니라 확실하게 살충하는 것을 눈으로 확인할 수 있었어요. 밤늦게까지 작업하거나 독서를 할 때 모기가 극성인데, 이 제품 덕분에 집중력을 잃지 않고 편안하게 시간을 보낼 수 있었습니다. 살충 성분이 벌레에만 작용하도록 설계되어 있고, 충분한 환기를 시키면 인체나 반려동물에 해롭지 않다는 점도 안심하고 사용할 수 있는 부분입니다.
무향으로 더 상쾌하게
기존의 살충제들은 특유의 독한 냄새 때문에 사용 후에도 환기를 오래 해야 하고, 냄새가 남아 불편함을 느끼는 경우가 많았습니다. 특히 밀폐된 공간에서 사용하기에는 더욱 부담스러웠죠. 하지만 에프킬라 무향 에어로솔은 이름 그대로 '무향'입니다. 처음 분사할 때도 거의 냄새를 느낄 수 없었고, 사용 후에도 잔향이 남지 않아 매우 쾌적했습니다. 덕분에 냄새 걱정 없이 필요한 순간에 바로바로 사용할 수 있었고, 아이가 있는 집에서도 안심하고 사용할 수 있겠다는 생각이 들었습니다. '미끌거림, 석유냄새, 밤샘모기걱정' 이 세 가지가 없다는 3無 문구가 정말 와닿는 부분이었습니다. 수성 베이스라 그런지 분사 후 바닥에 남는 끈적임도 전혀 없어서 더욱 만족스러웠습니다.
간편한 사용과 편리한 보관
사용법도 매우 간편합니다. 사용 전 에어로솔을 충분히 흔들어 주어야 살충 성분이 잘 섞여 빠른 살충 효과를 볼 수 있다고 하니, 이 부분만 지켜주면 됩니다. 그리고 사용 후에는 고압가스 제품인 만큼 송곳 등으로 캔에 구멍을 내어 '캔류'로 분리수거하고, 캡 부분은 '플라스틱'으로 분리수거하면 되니 처리 방법도 어렵지 않습니다. 집안 곳곳에 비치해두고 필요할 때마다 꺼내 쓰기 좋으며, 디자인도 깔끔해서 보관에도 부담이 없습니다. 저는 거실, 침실, 주방 등 모기가 자주 출몰하는 곳마다 하나씩 두어서 언제든 사용할 수 있도록 했습니다.
총평 및 추천
에프킬라 무향 에어로솔은 단순히 모기를 잡는 살충제를 넘어, 쾌적하고 건강한 주거 환경을 만들어주는 데 크게 기여하는 제품이라고 생각합니다. 강력한 살충 효과와 더불어 무향이라는 점이 가장 큰 장점이며, 남녀노소 누구나 안심하고 사용할 수 있는 점도 매력적입니다. 특히 모기에 민감하거나 냄새에 취약한 분들에게 강력히 추천하고 싶습니다. 올여름, 에프킬라 무향 에어로솔로 지긋지긋한 모기와의 전쟁을 끝내고 편안한 일상을 되찾으시길 바랍니다.",,"https://thumbnail9.coupangcdn.com/thumbnails/local/320/image2/PRODUCTREVIEW/202507/20/3710697238428447822/e9b84aef-10dc-4132-8255-008effe20a0b.jpg,https://thumbnail8.coupangcdn.com/thumbnails/local/320/image2/PRODUCTREVIEW/202507/20/3710697238428447822/c8fbb099-6c81-4c5a-94ff-c0db0615dfe9.jpg,https://thumbnail9.coupangcdn.com/thumbnails/local/320/image2/PRODUCTREVIEW/202507/20/3710697238428447822/fc7b97e8-550b-43bb-8c0b-e8b2e093706f.jpg,https://thumbnail7.coupangcdn.com/thumbnails/local/320/image2/PRODUCTREVIEW/202507/20/3710697238428447822/6371a8bc-761c-457d-9aa7-ec6307bdc1cf.jpg,https://thumbnail8.coupangcdn.com/thumbnails/local/320/image2/PRODUCTREVIEW/202507/20/3710697238428447822/995c24aa-9957-4ecd-ab61-0882ecbde836.jpg,https://thumbnail10.coupangcdn.com/thumbnails/local/320/image2/PRODUCTREVIEW/202507/20/3710697238428447822/f549c2fa-72a6-4609-924f-c54e7c8089e6.jpg,https://thumbnail6.coupangcdn.com/thumbnails/local/320/image2/PRODUCTREVIEW/202507/20/3710697238428447822/da7aeee9-2912-4173-84c5-59376640d42e.jpg,https://thumbnail8.coupangcdn.com/thumbnails/local/320/image2/PRODUCTREVIEW/202507/20/3710697238428447822/01c5229a-5cb9-44e1-b151-2381dc3cdfbd.jpg,https://thumbnail6.coupangcdn.com/thumbnails/local/320/image2/PRODUCTREVIEW/202507/20/3710697238428447822/133797ed-a8c6-4818-8203-38297b40b9f3.jpg,https://thumbnail7.coupangcdn.com/thumbnails/local/320/image2/PRODUCTREVIEW/202507/20/3710697238428447822/dec23d15-37ad-4fe0-9967-2175acb1a433.jpg"
3,5,2025.07.14,,냄새가 덜나서 좋아용,"여름만 되면 진짜 모기 때문에 킹받더라구요ㅠㅠ
밤에 윙윙거리는 소리만 들려도 잠이 확 깨버리고, 전기 켜고 모기 잡으려다가 결국 포기하는 내 모습이 너무 한심했어요.
모기향은 냄새가 너무 독하고 아이들한테 안 좋을 것 같아서 패스했는데, 그냥 참고 살기엔 너무 스트레스받고요.
진짜 모기 없는 세상이 왔으면 좋겠다는 생각만 계속 들더라구요. 이거 공감 안 되는 사람 없을걸요?
쿠팡에서 생필품 주문하다가 모기 살충제 코너 보는데 무향이라고 되어있는 게 눈에 확 들어오더라구요.
리뷰도 나쁘지 않고, 평소에 쓰던 건 냄새가 너무 독해서 뿌리고 나면 환기 개오래 시켜야 했거든요.
근데 이건 무향이래서 이거다 싶어서 바로 장바구니 넣었어요.
500ml 2개들이라서 가성비도 괜찮았고요. 실제로 써보니까 냄새가 진짜 거의 안 나서 완전 만족스러웠어요.
기존에 쓰던 다른 브랜드 살충제랑 비교해보면 냄새가 넘사벽으로 적어요.
예전 거는 뿌리고 나면 그 특유의 화학 냄새가 개오래 남아있었는데 에프킬라 수성 에어로졸 모기 살충제 무향은 진짜 거의 냄새가 안 나더라구요.
효과도 비슷하고, 분사할 때도 더 고르게 나오는 느낌? 용량도 500ml라서 꽤 오래 쓸 수 있고 2개들이라 가성비 미쳤어요.
일주일 써보니 느껴지는점
- 무향이라서 냄새 스트레스 제로
- 500ml 용량이 넉넉함
- 분사가 고르게 잘 됨
- 2개들이라 가성비 갑
일반 살충제보다 효과가 좀 약한 것 같아요. 큰 모기는 한 번에 안 죽을 때가 있더라구요.
아님 애들이 쌔진건가 ㅡㅡ; 후..오지마라 제발제발제발제발",2.0,"https://thumbnail9.coupangcdn.com/thumbnails/local/320/image2/PRODUCTREVIEW/202507/14/6247967318807951959/9f427fdb-9ce3-4d0c-bc0f-9d3fc5f8c14c.jpg,https://thumbnail9.coupangcdn.com/thumbnails/local/320/image2/PRODUCTREVIEW/202507/14/6247967318807951959/e5a6c832-e8ce-4c1e-91ce-e7e6157c6c05.jpg,https://thumbnail9.coupangcdn.com/thumbnails/local/320/image2/PRODUCTREVIEW/202507/14/6247967318807951959/e10bf311-5c0e-46fa-be0e-fbcfc75d9978.jpg,https://thumbnail6.coupangcdn.com/thumbnails/local/320/image2/PRODUCTREVIEW/202507/14/6247967318807951959/a4bec21c-f0fb-4842-87e0-fe3a14b9d05e.jpg,https://thumbnail6.coupangcdn.com/thumbnails/local/320/image2/PRODUCTREVIEW/202507/14/6247967318807951959/fd4d551e-5158-4bd8-ad20-25ed4be7dba3.jpg,https://thumbnail9.coupangcdn.com/thumbnails/local/320/image2/PRODUCTREVIEW/202507/14/6247967318807951959/b0ef6b81-8cdd-4257-ad3b-897689762085.jpg,https://thumbnail9.coupangcdn.com/thumbnails/local/320/image2/PRODUCTREVIEW/202507/14/6247967318807951959/12d2d25a-8ce7-4f6e-b615-fa67f30b3d6e.jpg,https://thumbnail10.coupangcdn.com/thumbnails/local/320/image2/PRODUCTREVIEW/202507/14/6247967318807951959/2d0dc7c2-a43b-4d10-b206-8ddc062709d8.jpg,https://thumbnail8.coupangcdn.com/thumbnails/local/320/image2/PRODUCTREVIEW/202507/14/6247967318807951959/42083dff-a8b4-47de-914e-e4c379b35bc0.jpg,https://thumbnail7.coupangcdn.com/thumbnails/local/320/image2/PRODUCTREVIEW/202507/14/6247967318807951959/7f892a22-2120-4cc6-be6e-d1a6f12ee222.jpg"
4,5,2025.07.13,,쾌적한 환경에 큰 도움을 줍니다~♡,"✳️에프킬라 수성 에어로졸 살충제✳️
무향, 500ml, 2개
❤️에프킬라는 집안 상비약이죠!!~ 약이라고
칭해도 되려나요?~ 아닌가?? 상비 제품?!!!~~
암튼 없으면 안되는!! 꼭 있어야할 제품입니다^^~
집에도 필요하고 저는 초등생 위주의 학원을
하고 있어서 학원에 파리 한마리만 들어와도
어찌나 아이들이 동요를 하는지..ㅠ 웬만하면
불끄고 창문열어서 파리가 스스로 탈출하게끔
하고 있는데요. 끝까지 밖으로 못나가는 모지리
파리들이 있어요. 어쩌것어요.. 뿌려야죠., 에프킬라..
성능은 직빵입니다~ 곧 모기가 극성일텐데
모기는 죽여야죠. 이 에프킬라는 무향이라서
넘 좋아요~ 진짜 향이 거의 없어요~
파리 모기 죽이려다 제 머리가 지끈지끈..
살충제 냄새에 제가 먼저 죽을듯해서 힘든데..
제가 냄새에 워낙 예민하다보니 그렇드라구요
오우~ 근데 이 무향 에프킬라는 괜찮아요
왜 진작 무향을 안샀었을까요?~ 아이고.. 저의
무심함에 제가 자신을 힘들게 했었네요~ㅋ
이젠 계속 무향 에프킬라로 구매하겠슴돠~
❤️68년역사의 전문 노하우로 싹-!!
우리집 해충방패, 에프킬라!! 세계판매 1위!!!
3무
1.미끌거림 2.석유냄새 3.밤새모기걱정
⬇️에프킬라 상세정보에서 꼭 숙지할 내용⬇️
✔️모기, 파리. 나방 등을 살충하는 제품으로,
벌레에만 작용할 살충 성분이 들어 있습니다.
사람 또는 동물을 향해서 분사하지 않고
충분히 환기를 시키는 등 주의사항에 따라
사용하면 걱정 없이 사용할수 있습니다.
✔️에어로졸을 잘 흔들지 않고 분사를 하게 되면
살충 성분이 잘 섞이지 않고 분사될 수 있습니다.
빠른살충 효과를위해 분사 전 충분히 흔들어 주세요.
✔️사용 후 어떻게 버려야 하나요?
고압가스를 사용한 제품으로, 전량 사용하였다
하더라도 일부 잔가스가 들어있을 수 있습니다.
송곳 등을 사용하여 캔에 구멍을 내어 '캔류'로
분리수거 해주시고 캡부분은 분리하여 '플라스틱'
으로 분리수거하여 버려주세요
❤️에프킬라 잘 사용할께요~ 쾌적한 환경에
큰 도움 주는 에프킬라 넘 고마운 제품입니다^^
많이 파시고 많이들 사세요~ 제 리뷰가 도움
되셨길 바래보구요 항상 웃음가득,행복하세요~♡",1.0,"https://thumbnail7.coupangcdn.com/thumbnails/local/320/image2/PRODUCTREVIEW/202507/13/1350778044299400388/12119623-5408-464a-8deb-ed29bdbf373a.jpg,https://thumbnail8.coupangcdn.com/thumbnails/local/320/image2/PRODUCTREVIEW/202507/13/1350778044299400388/b9f0d04a-6d10-47d3-babb-dd6b6fb4268e.jpg,https://thumbnail7.coupangcdn.com/thumbnails/local/320/image2/PRODUCTREVIEW/202507/13/1350778044299400388/1aaf8111-0bb8-4bb6-bde9-33aca5878db4.jpg,https://thumbnail6.coupangcdn.com/thumbnails/local/320/image2/PRODUCTREVIEW/202507/13/1350778044299400388/4a962068-fa69-45f3-86e2-9632da6b4b67.jpg,https://thumbnail9.coupangcdn.com/thumbnails/local/320/image2/PRODUCTREVIEW/202507/13/1350778044299400388/8aa75eae-be42-4553-affb-5c87d068c3f9.jpg,https://thumbnail8.coupangcdn.com/thumbnails/local/320/image2/PRODUCTREVIEW/202507/13/1350778044299400388/fffaaf41-9519-42a5-be9e-35312ef1f039.jpg,https://thumbnail8.coupangcdn.com/thumbnails/local/320/image2/PRODUCTREVIEW/202507/13/1350778044299400388/90bdabd9-72db-4b5c-a590-7a703845fd71.jpg,https://thumbnail8.coupangcdn.com/thumbnails/local/320/image2/PRODUCTREVIEW/202507/13/1350778044299400388/83a212d8-3d1c-46ef-9b48-cf832ac7bf90.jpg,https://thumbnail8.coupangcdn.com/thumbnails/local/320/image2/PRODUCTREVIEW/202507/13/1350778044299400388/a570d803-af7b-437a-9ded-b57a3ca8cbdf.jpg,https://thumbnail7.coupangcdn.com/thumbnails/local/320/image2/PRODUCTREVIEW/202507/13/1350778044299400388/af9fa160-8f42-4f79-8e3a-b295943be3da.jpg"
5,5,2025.07.12,,무향은 아니라고 생각합니다. 살충 효과는 좋음!,"■ 구매 이유
용량대비 더 저렴한 살충제를 구매하려다가 아빠께서 에프킬라를 원하시길래 결국 에프킬라를 선택했어요. 여러 사이트 가격을 비교해 보다가 여기가 용량 대비 제일 저렴한 것 같아서 여기서 구매했습니다.
■ 향은 어떤가요?
제품 설명에는 '무향'이라고 적혀 있지만 절대 무향은 아닙니다.
살충제 냄새가 아주 확실하게 납니다. 숨 막혀 죽을 정도의 냄새는 아니지만 제 몸에도 해로울 것 같은 불쾌한 향이 느껴집니다. 시트러스 계열 등의 향을 입히지 않는 이상 어느 살충제에서든 이런 향이 날 거예요.
그건 이해하지만, 무향이 아닌데 무향이라고 적어둔 건 좀 열받는 부분이네요.
■ 살충 효과 확실한가요?
네, 제가 경험해 봤는데 확실합니다. 가구 구석구석에 뿌리면 숨어 있던 모기가 알아서 죽거나, 비실비실한 상태로 빠져나오다가 저희 가족 눈에 걸려서 죽습니다.
■ 용량은 어떤가요?
저희 집에 기존에 있던 건 500ml였는데, 이 제품은 600ml라서 높이가 좀 더 크더군요. 크기 차이는 첨부 사진을 확인해 주세요.
솔직한 감상을 말하자면, 기존의 에프킬라가 더 사용하기 편한 크기라고 생각합니다. 조금 더 가볍고, 움직이는데 거슬림이 없는 느낌이에요. 제가 그 크기에 익숙해서 그렇게 느끼는 것일 수도 있겠지만요.
그래도 크게 거슬리는 차이는 아니고, 가격이 비교적 더 저렴한 듯하여 만족합니다.
■ 사용기한은 넉넉한가요?
네, 아주 넉넉합니다. 제조한지 약 1년이 지난 제품을 받긴 했지만, 사용기한까지 약 2년 정도의 여유가 있어 마구 쟁여두고 사용해도 괜찮은 제품입니다.
구매일자: 2025.05.31
도착일자: 2025.06.01
제조일자: 2024.05.13
사용기한: 제조일로부터 3년까지
(2025.07.12)
-------------------------------------------------------------
제 리뷰가 제품 구매에 조금이나마 도움이 되었기를 바랍니다! 즐거운 쇼핑 하세요:)",,"https://thumbnail9.coupangcdn.com/thumbnails/local/320/image2/PRODUCTREVIEW/202507/12/5745194669524983711/48514595-8ddf-46cb-9c38-cab894356671.jpg,https://thumbnail6.coupangcdn.com/thumbnails/local/320/image2/PRODUCTREVIEW/202507/12/5745194669524983711/8adec6b8-5519-456b-be2c-81599bfb033b.jpg,https://thumbnail9.coupangcdn.com/thumbnails/local/320/image2/PRODUCTREVIEW/202507/12/5745194669524983711/b0b70af4-097c-4911-adf8-0570472aa372.jpg,https://thumbnail8.coupangcdn.com/thumbnails/local/320/image2/PRODUCTREVIEW/202507/12/5745194669524983711/dd6ea8dc-fd71-48a2-83b1-505d4324bf7d.jpg,https://thumbnail10.coupangcdn.com/thumbnails/local/320/image2/PRODUCTREVIEW/202507/12/5745194669524983711/59d7de09-ea7a-49a8-92bc-5ed8c0899219.jpg,https://thumbnail9.coupangcdn.com/thumbnails/local/320/image2/PRODUCTREVIEW/202507/12/5745194669524983711/5643af0a-abbf-4739-a760-ed48c09099ce.jpg,https://thumbnail9.coupangcdn.com/thumbnails/local/320/image2/PRODUCTREVIEW/202507/12/5745194669524983711/796653f0-4c33-4fa4-bb7d-e403ef597039.jpg,https://thumbnail10.coupangcdn.com/thumbnails/local/320/image2/PRODUCTREVIEW/202507/12/5745194669524983711/ecd7947a-ab51-4bfb-bdfc-de82aff6016c.jpg,https://thumbnail9.coupangcdn.com/thumbnails/local/320/image2/PRODUCTREVIEW/202507/12/5745194669524983711/62bbe350-bbe0-4ac9-bd7c-c021d025ea3b.jpg,https://thumbnail7.coupangcdn.com/thumbnails/local/320/image2/PRODUCTREVIEW/202507/12/5745194669524983711/948ea0d9-18c0-42b6-bcdd-555352b90fbb.jpg"
