rank,rating,date,user,headline,body,helpful_count,images
6,5,2025.07.12,,여름 필수템,"✨ 내돈내산 리뷰 ✨
✅ 구매 이유
여름철 모기와 벌레 때문에 집안에서 자주 불편함을 느껴서 모기 살충제를 찾던 중, 무향이라 냄새 걱정 없이 사용할 수 있는 에프킬라 수성 에어로졸 모기 살충제를 구매하게 되었습니다. 500ml 용량에 6개 세트라 넉넉하게 사용할 수 있을 것 같아 집 안팎에서 두루두루 활용하려고 선택했어요.
장점
✔ 무향 제품이라 모기 살충제 특유의 강한 화학 냄새가 전혀 나지 않아 가족들이 특히 좋아했어요.
✔ 수성이라 안심하고 실내에서 사용하기 좋고, 분사 후에도 끈적임이나 자극적인 냄새 없이 쾌적한 환경을 유지할 수 있었어요.
✔ 500ml 용량이 넉넉해 한 번 구매로 여름 내내 충분히 사용할 수 있어 경제적이에요.
✔ 에어로졸 분사 방식이 고르게 분사되어 구석구석 모기를 효과적으로 제거해 줘서 집안에서 벌레 걱정이 크게 줄었어요.
✔ 6개 세트라 집, 베란다, 캠핑 등 다양한 장소에 두고 편리하게 사용할 수 있었고, 할인된 가격에 대량 구매할 수 있어서 가성비도 좋았습니다.
아쉬운 점
✔ 무향이라 냄새 걱정은 덜지만, 분사 후 약간의 습기가 남아 촉촉한 느낌이 들 때가 있어 바로 환기해주면 더 쾌적하게 사용할 수 있을 것 같아요.
✔ 분사 캔이 조금 무거워 장시간 사용 시 손목에 부담이 갈 수 있으니 참고하세요.
⭐ 별점
★★★★★ (5/5)
총평
에프킬라 수성 에어로졸 무향 모기 살충제는 냄새 걱정 없이 안전하게 사용할 수 있는 제품으로, 여름철 모기 퇴치에 탁월한 효과를 보여줍니다. 넉넉한 용량과 6개 세트 구성 덕분에 가정 내 여러 공간에서 편리하게 사용할 수 있고, 수성이라 자극 없이 쾌적한 환경을 유지할 수 있어 만족스러웠어요. 무향 살충제를 찾는 분들이라면 적극 추천하며, 앞으로도 여름철 필수품으로 꾸준히 재구매할 생각입니다!",,"https://thumbnail8.coupangcdn.com/thumbnails/local/320/image2/PRODUCTREVIEW/202507/12/576405298040479451/bb0418f0-999a-417e-966c-109802d8471f.jpg,https://thumbnail6.coupangcdn.com/thumbnails/local/320/image2/PRODUCTREVIEW/202507/12/576405298040479451/5cf374fd-5a94-421b-9ae5-ebca32872cfe.jpg,https://thumbnail7.coupangcdn.com/thumbnails/local/320/image2/PRODUCTREVIEW/202507/12/576405298040479451/675b33fd-ac8a-4747-b6be-9ff742a60c49.jpg,https://thumbnail6.coupangcdn.com/thumbnails/local/320/image2/PRODUCTREVIEW/202507/12/576405298040479451/53d4aff1-0af4-40ed-a219-18ac88f9e342.jpg,https://thumbnail10.coupangcdn.com/thumbnails/local/320/image2/PRODUCTREVIEW/202507/12/576405298040479451/9b96235c-1b4d-4530-93e9-1b6cc663f2d7.jpg,https://thumbnail10.coupangcdn.com/thumbnails/local/320/image2/PRODUCTREVIEW/202507/12/576405298040479451/b0a93b70-6c44-4b46-ae69-476c68526c6e.jpg,https://thumbnail7.coupangcdn.com/thumbnails/local/320/image2/PRODUCTREVIEW/202507/12/576405298040479451/fff5f086-b8c1-412d-a2bf-de1d8481f75f.jpg,https://thumbnail8.coupangcdn.com/thumbnails/local/320/image2/PRODUCTREVIEW/202507/12/576405298040479451/40d7bc88-f227-41a4-9c5f-db599b851892.jpg,https://thumbnail7.coupangcdn.com/thumbnails/local/320/image2/PRODUCTREVIEW/202507/12/576405298040479451/8317d4d8-d1e5-4412-949d-4beae0550a48.jpg"
7,5,2025.07.11,,#모기에게 습격당한 일인!! #모기진짜싫어!!!,"✔️  “모기 녀석들아, 올해는 너희랑 못 놀아!”
진짜… 올해도 모기 시즌이 오고야 말았습니다.
저는 평소에 사람 잘 안 물리게 생겼는데
모기 앞에서는 국보급 혈액형인지
밤마다 꼭 저만 찾아오더라고요.
하루는 자다가 종아리 4방 물리고
긁다가 흉 지고… 그날 결심했습니다.
‘그래, 사야겠다! 에프킬라 수성 에어로졸로 모기와 전면전이다!’
❤️ 실제 사용 후기
✔️ 무향이라 사용하고 나도 머리 안 아픔!
예전엔 독한 스프레이 쓰면
방에 들어가기 무서워서 코 틀어막고 환기했거든요?
근데 이건 진짜 무향이라 맘 편히 뿌려놓고 문 닫아둬도 굿!
✔️ 수성이라 벽지에도 덜 자국 남음!
자국 안 남으면 청소 스트레스도 줄죠~
그래서 침대 옆, 커튼 뒤 다 뿌려도 OK!
✔️ 효과 빠름!
어디서 삐잉~ 하고 날아다니던 모기,
분사 한 번 하면 몇 분 안 돼서 바닥에 그대로 직행합니다.
미안하지만 넌 나랑 못 살아…
✅️  이런 점은 참고!
✔️ 방안에 뿌리고 나면 환기는 꼭 해야 해요!
아무리 무향이라도 수성 살충제니까요~
사람 없는 방에 뿌리고 닫아두면 딱 좋음!
✔️ 스프레이라 좁은 공간에선 살짝 뿌리기 어려움
근데 뭐… 모기 잡으려면 벽, 구석구석 뿌려야죠!
❤️  내돈내산 꿀팁!
저는 2개 세트로 샀어요!
하나는 거실, 하나는 방에 비치해두고
모기 날아다니는 소리 들리면 즉시 꺼냅니다ㅋㅋ
밤에 긁느라 잠 설칠 일 줄어드니 꿀잠 예약!
이제 모기와 나의 관계는 끝났다!ㅋㅋㅋㅋ
올여름 모기에 물려서 긁적이는 일은
에프킬라 수성 에어로졸이 책임집니다!
무향이라 뿌리고 나서 머리 안 아프고,
수성이라 벽지도 안 망가져서 완전 만족!
모기야~ 내 피는 소중하니까 포기해줘!❌
모기 때문에 밤잠 설치는 분들, 제 말 믿고 하나쯤 구비해두세요~!
내돈내산 추천 완료!
ㅡㅡㅡㅡㅡㅡㅡㅡㅡㅡㅡㅡㅡㅡㅡㅡㅡㅡㅡㅡㅡㅡ
ㅡㅡㅡㅡㅡㅡㅡㅡㅡㅡㅡㅡㅡㅡㅡㅡㅡㅡㅡㅡㅡㅡ
✅ 리뷰를 마치며
이 후기는 직접 사용해 본 경험을 기록하고 공유하고자 작성했습니다.
저 또한 제품을 선택할 때 후기를 참고하는 만큼, 이 글이 누군가에게 도움이 되길 바랍니다.
개인적인 의견이 담겨 있어 다소 부족할 수도 있지만,
저처럼 필요한 제품을 찾는 분들에게 작은 도움이 되었으면 합니다.
읽어주셔서 감사합니다!
✅ 추가 후기가 필요하면 다시 돌아오겠습니다.",2.0,"https://thumbnail10.coupangcdn.com/thumbnails/local/320/image2/PRODUCTREVIEW/202507/11/4792394252264648766/a1e0f171-992e-47ab-921f-f2f382ec75e7.jpg,https://thumbnail9.coupangcdn.com/thumbnails/local/320/image2/PRODUCTREVIEW/202507/11/4792394252264648766/023e0b85-2d0d-4c38-a22c-a4f1a14ab709.jpg,https://thumbnail9.coupangcdn.com/thumbnails/local/320/image2/PRODUCTREVIEW/202507/11/4792394252264648766/c8cfdfec-0307-4e64-adb8-d331198e1d29.jpg,https://thumbnail9.coupangcdn.com/thumbnails/local/320/image2/PRODUCTREVIEW/202507/11/4792394252264648766/f77efd67-8529-49af-9168-92b02ec3513d.jpg,https://thumbnail6.coupangcdn.com/thumbnails/local/320/image2/PRODUCTREVIEW/202507/11/4792394252264648766/0baab55f-a103-4d7f-ad5d-8a7b06edd42c.jpg,https://thumbnail8.coupangcdn.com/thumbnails/local/320/image2/PRODUCTREVIEW/202507/11/4792394252264648766/15e91586-bc15-45a0-bde2-c71e43b02ab7.jpg,https://thumbnail8.coupangcdn.com/thumbnails/local/320/image2/PRODUCTREVIEW/202507/11/4792394252264648766/326347e1-59d0-4956-bb15-7047559a2bcc.jpg"
8,5,2025.07.10,,"여름철이 되면 가장 먼저 걱정되는 게 바로 모기죠. 특히 요즘처럼 날씨가 더워지면서 모기와 벌레들이 점점 많아지고 있는데, 정말 속상하더라고요.그래서 이번에 쿠팡에서 에프킬라 수성 에어로졸 모기 살충제 무향을 구매해봤습니다.역시 쿠팡은 배송이 빠르고 믿을 수 있어서 급할 때 정말 유용하게 잘 활용하고 있어요.우선 이 제품은 ‘수성’ 타입이라는 점이 가장 큰 장점이에요.기존의 일반 스프레이형 살충제는 뿌리면 방 안에 냄새가 심하게 남고, 벽이나 바닥에 끈적임이 있어서 사용 후 환기를 꼭 해야 했는데,수성 타입은 냄새나 찝찝함이 거의 없고 훨씬 깔끔하게 사용할 수 있어요.이 제품은 무향제품이라 화학적인 냄새에 민감하신 분들, 아이나 반려동물이 있는 집에서도 부담 없이 사용하기 좋습니다.사용법도 간단하고 직관적이에요.사용 전에 흔들어서 모기가 있을 만한 공간에 뿌려주면, 빠르게 작용해서 효과를 바로 볼 수 있어요.저는 저녁에 거실, 커튼 주변이나 창틀 쪽에 가볍게 뿌려주고 환기만 살짝 시켜두는데, 모기없이 편하게 잘 수 있었습니다.살충력도 믿을 수 있어서 잠잘 때나 식사할 때 모기 걱정을 덜 수 있다는 점이 가장 큰 만족 포인트였어요.특히 이 제품은 벽이나 바닥에 자국이 남지 않아서 청소 부담이 없고,기존의 오일 타입 스프레이보다 훨씬 산뜻하게 사용할 수 있어요.가구나 커튼 등에 묻을 걱정도 적고, 공기 중에 분사해도 끈적임 없이 깔끔하게 날아가면서 효과는 그대로라 정말 만족스럽습니다.용량도 넉넉해서 하루 한두 번씩 사용해도 여름 한철은 거뜬하게 사용할 수 있을 정도로 실속 있는 제품이에요.캠핑이나 여행 갈 때 챙겨가도 좋을 만큼 휴대성도 괜찮고, 뚜껑도 단단하게 닫혀 있어 보관할 때도 안심이에요.모기와 벌레로 인한 여름철 스트레스를 줄이고 싶으신 분들께 이 제품 정말 추천드리고 싶어요.냄새에 민감한 분들, 깔끔한 살충제를 찾는 분들이라면 꼭 한 번 사용해보시길 추천합니다.","여름철이 되면 가장 먼저 걱정되는 게 바로 모기죠. 특히 요즘처럼 날씨가 더워지면서 모기와 벌레들이 점점 많아지고 있는데, 정말 속상하더라고요.
그래서 이번에 쿠팡에서 에프킬라 수성 에어로졸 모기 살충제 무향을 구매해봤습니다.
역시 쿠팡은 배송이 빠르고 믿을 수 있어서 급할 때 정말 유용하게 잘 활용하고 있어요.
우선 이 제품은 ‘수성’ 타입이라는 점이 가장 큰 장점이에요.
기존의 일반 스프레이형 살충제는 뿌리면 방 안에 냄새가 심하게 남고, 벽이나 바닥에 끈적임이 있어서 사용 후 환기를 꼭 해야 했는데,
수성 타입은 냄새나 찝찝함이 거의 없고 훨씬 깔끔하게 사용할 수 있어요.
이 제품은 무향제품이라 화학적인 냄새에 민감하신 분들, 아이나 반려동물이 있는 집에서도 부담 없이 사용하기 좋습니다.
사용법도 간단하고 직관적이에요.
사용 전에 흔들어서 모기가 있을 만한 공간에 뿌려주면, 빠르게 작용해서 효과를 바로 볼 수 있어요.
저는 저녁에 거실, 커튼 주변이나 창틀 쪽에 가볍게 뿌려주고 환기만 살짝 시켜두는데, 모기없이 편하게 잘 수 있었습니다.
살충력도 믿을 수 있어서 잠잘 때나 식사할 때 모기 걱정을 덜 수 있다는 점이 가장 큰 만족 포인트였어요.
특히 이 제품은 벽이나 바닥에 자국이 남지 않아서 청소 부담이 없고,
기존의 오일 타입 스프레이보다 훨씬 산뜻하게 사용할 수 있어요.
가구나 커튼 등에 묻을 걱정도 적고, 공기 중에 분사해도 끈적임 없이 깔끔하게 날아가면서 효과는 그대로라 정말 만족스럽습니다.
용량도 넉넉해서 하루 한두 번씩 사용해도 여름 한철은 거뜬하게 사용할 수 있을 정도로 실속 있는 제품이에요.
캠핑이나 여행 갈 때 챙겨가도 좋을 만큼 휴대성도 괜찮고, 뚜껑도 단단하게 닫혀 있어 보관할 때도 안심이에요.
모기와 벌레로 인한 여름철 스트레스를 줄이고 싶으신 분들께 이 제품 정말 추천드리고 싶어요.
냄새에 민감한 분들, 깔끔한 살충제를 찾는 분들이라면 꼭 한 번 사용해보시길 추천합니다.",1.0,"https://thumbnail8.coupangcdn.com/thumbnails/local/320/image2/PRODUCTREVIEW/202507/10/4290906782012452799/cf031c7b-9e29-4f1e-8604-ab094b2c84b1.jpg,https://thumbnail6.coupangcdn.com/thumbnails/local/320/image2/PRODUCTREVIEW/202507/10/4290906782012452799/d631fc93-83d6-419f-81a6-976cf01c5922.jpg,https://thumbnail7.coupangcdn.com/thumbnails/local/320/image2/PRODUCTREVIEW/202507/10/4290906782012452799/ec38276e-9000-4153-96c8-6e52aadfc2da.jpg,https://thumbnail10.coupangcdn.com/thumbnails/local/320/image2/PRODUCTREVIEW/202507/10/4290906782012452799/6bfe2c5c-c58a-4428-90d7-28738b646411.jpg,https://thumbnail10.coupangcdn.com/thumbnails/local/320/image2/PRODUCTREVIEW/202507/10/4290906782012452799/6dda23d4-075f-4863-b577-e268c5c2021d.jpg,https://thumbnail6.coupangcdn.com/thumbnails/local/320/image2/PRODUCTREVIEW/202507/10/4290906782012452799/eb60f46b-4a11-44b4-bfeb-be47dbca7af5.jpg,https://thumbnail10.coupangcdn.com/thumbnails/local/320/image2/PRODUCTREVIEW/202507/10/4290906782012452799/7342fac0-1d4c-42ad-9a25-79d4466534e3.jpg,https://thumbnail7.coupangcdn.com/thumbnails/local/320/image2/PRODUCTREVIEW/202507/10/4290906782012452799/ea08c2b6-23da-4474-98c3-9b3b197808d3.jpg,https://thumbnail7.coupangcdn.com/thumbnails/local/320/image2/PRODUCTREVIEW/202507/10/4290906782012452799/87d125c5-379c-4ec0-9754-5d3686887276.jpg,https://thumbnail7.coupangcdn.com/thumbnails/local/320/image2/PRODUCTREVIEW/202507/10/4290906782012452799/8f1253e3-9a57-4c68-bcd6-f78eb7656a9b.jpg"
9,5,2025.07.10,,"내돈 내산 솔직 후기 !![구매 이유]저는 자영업자로 식당을 운영하고 있습니다.아무래도 음식점 특성상 위생과 청결에 굉장히 신경을 많이 써야 하는데,벌레가 나타나는 순간부터 스트레스가 시작되더라구요.세×코 등 전문 업체에 정기적으로 방역을 맡기고 있긴 하지만,그분들이 매일 출근하시는 것도 아니고,완벽하게 막을 수 있는 것도 아니죠.특히 여름철에는 문을 여닫는 횟수가 많아지면서초파리나 작은 벌레들이 들어오는 일이 잦아져서,제가 직접 잡고 관리할 수 있는 스프레이 제품을 찾다가이 제품을 알게 되어 구매하게 되었습니다.[가격]3개 세트로 구성되어 있었는데,가격이 굉장히 저렴해서 솔직히 큰 기대는 안 하고 샀어요.그런데 사용해보니 가성비가 정말 좋습니다.처음엔 ‘이걸 세 개나 써야 할까?’ 싶었지만,생각보다 자주 사용하게 되더라구요.특히 소량씩 뿌려주는 방식으로 활용하다 보니 금방 줄어들어요.일반 가정집이라면 한 개만 구매하셔도 충분할 것 같고,저처럼 식당이나 카페 등 영업장에서는 3개 세트도무난하게 사용하실 수 있을 듯합니다.[실제 사용기]배송 상태는 아주 양호했습니다.뾱뾱이에 꼼꼼하게 포장되어 안전하게 도착했어요.제품을 처음 개봉해서 뿌렸을 때는 분사력이 괜찮았고,냄새가 거의 없어서 부담 없이 사용할 수 있었습니다.가게에는 다행히 파리가 잘 안 들어와서파리에게 직접 뿌려볼 기회는 없었지만,싱크대 근처에 자주 보이는 초파리들에게는 몇 번 분사해봤습니다.확실히 죽는 장면을 목격하진 못했지만,개체 수가 조금 줄어든 것 같기도 하고...뭔가 정확히 판단하기는 애매하네요.그래도 지속적으로 뿌려주다 보면어느 정도 효과는 있을 거라 생각하고 사용 중입니다.반면, 화장실에 있던 모기에게는 확실한 효과를 봤습니다.문을 닫고 밀폐된 공간에서 분사했더니몇 분 뒤 바닥에 떨어져 있더라구요.모기에 대한 효과는 만족스럽습니다.[총평]모기나 기타 작은 벌레들에겐 꽤 유용한 제품입니다.특히 가격 대비 용량이 넉넉하고,무향이라 실내에서 부담 없이 사용할 수 있다는 점이 큰 장점입니다.향후 대체할 만한 제품이 없다면 재구매 의사도 충분히 있습니다.가성비 방충제를 찾고 계시다면 한 번쯤 써보시는 것도 나쁘지 않을 것 같아요.#.실제 구입 후 사용한 경험을 바탕으로 작성한 솔직 후기입니다.개인적인 느낌이 들어갈 수 있으며,사용 환경이나 벌레 종류에 따라 효과 차이가 있을 수 있으니 참고용으로만 봐주세요!","내돈 내산 솔직 후기 !!
[구매 이유]
저는 자영업자로 식당을 운영하고 있습니다.
아무래도 음식점 특성상 위생과 청결에 굉장히 신경을 많이 써야 하는데,
벌레가 나타나는 순간부터 스트레스가 시작되더라구요.
세×코 등 전문 업체에 정기적으로 방역을 맡기고 있긴 하지만,
그분들이 매일 출근하시는 것도 아니고,
완벽하게 막을 수 있는 것도 아니죠.
특히 여름철에는 문을 여닫는 횟수가 많아지면서
초파리나 작은 벌레들이 들어오는 일이 잦아져서,
제가 직접 잡고 관리할 수 있는 스프레이 제품을 찾다가
이 제품을 알게 되어 구매하게 되었습니다.
[가격]
3개 세트로 구성되어 있었는데,
가격이 굉장히 저렴해서 솔직히 큰 기대는 안 하고 샀어요.
그런데 사용해보니 가성비가 정말 좋습니다.
처음엔 ‘이걸 세 개나 써야 할까?’ 싶었지만,
생각보다 자주 사용하게 되더라구요.
특히 소량씩 뿌려주는 방식으로 활용하다 보니 금방 줄어들어요.
일반 가정집이라면 한 개만 구매하셔도 충분할 것 같고,
저처럼 식당이나 카페 등 영업장에서는 3개 세트도
무난하게 사용하실 수 있을 듯합니다.
[실제 사용기]
배송 상태는 아주 양호했습니다.
뾱뾱이에 꼼꼼하게 포장되어 안전하게 도착했어요.
제품을 처음 개봉해서 뿌렸을 때는 분사력이 괜찮았고,
냄새가 거의 없어서 부담 없이 사용할 수 있었습니다.
가게에는 다행히 파리가 잘 안 들어와서
파리에게 직접 뿌려볼 기회는 없었지만,
싱크대 근처에 자주 보이는 초파리들에게는 몇 번 분사해봤습니다.
확실히 죽는 장면을 목격하진 못했지만,
개체 수가 조금 줄어든 것 같기도 하고...
뭔가 정확히 판단하기는 애매하네요.
그래도 지속적으로 뿌려주다 보면
어느 정도 효과는 있을 거라 생각하고 사용 중입니다.
반면, 화장실에 있던 모기에게는 확실한 효과를 봤습니다.
문을 닫고 밀폐된 공간에서 분사했더니
몇 분 뒤 바닥에 떨어져 있더라구요.
모기에 대한 효과는 만족스럽습니다.
[총평]
모기나 기타 작은 벌레들에겐 꽤 유용한 제품입니다.
특히 가격 대비 용량이 넉넉하고,
무향이라 실내에서 부담 없이 사용할 수 있다는 점이 큰 장점입니다.
향후 대체할 만한 제품이 없다면 재구매 의사도 충분히 있습니다.
가성비 방충제를 찾고 계시다면 한 번쯤 써보시는 것도 나쁘지 않을 것 같아요.
#.
실제 구입 후 사용한 경험을 바탕으로 작성한 솔직 후기입니다.
개인적인 느낌이 들어갈 수 있으며,
사용 환경이나 벌레 종류에 따라 효과 차이가 있을 수 있으니 참고용으로만 봐주세요!",,"https://thumbnail6.coupangcdn.com/thumbnails/local/320/image2/PRODUCTREVIEW/202507/14/8949742927982512282/4a139143-1b9f-4e4c-9edf-7a783e22ad1d.jpg,https://thumbnail7.coupangcdn.com/thumbnails/local/320/image2/PRODUCTREVIEW/202507/14/8949742927982512282/720e054b-74c1-430b-9459-ac96369a6cc4.jpg,https://thumbnail6.coupangcdn.com/thumbnails/local/320/image2/PRODUCTREVIEW/202507/14/8949742927982512282/341c0d1b-30ca-4e5b-9361-20ef797a3ab1.jpg,https://thumbnail10.coupangcdn.com/thumbnails/local/320/image2/PRODUCTREVIEW/202507/14/8949742927982512282/ac84544a-bfbd-443e-bcfb-4ba3721428ac.jpg,https://thumbnail8.coupangcdn.com/thumbnails/local/320/image2/PRODUCTREVIEW/202507/14/8949742927982512282/8ebdbd45-67a5-4abb-bb69-49bdc1f566f1.jpg,https://thumbnail6.coupangcdn.com/thumbnails/local/320/image2/PRODUCTREVIEW/202507/14/8949742927982512282/9616614e-a459-4cfc-871f-484a5a38ec3d.jpg,https://thumbnail9.coupangcdn.com/thumbnails/local/320/image2/PRODUCTREVIEW/202507/14/8949742927982512282/77cbd2f9-e797-4db3-9f59-d79b2d11a4e0.jpg,https://thumbnail9.coupangcdn.com/thumbnails/local/320/image2/PRODUCTREVIEW/202507/14/8949742927982512282/3abbf6ba-b08e-4e1d-b5d2-8d45f01ec75c.jpg,https://thumbnail9.coupangcdn.com/thumbnails/local/320/image2/PRODUCTREVIEW/202507/14/8949742927982512282/96c2a58e-cb45-4136-bf78-6f9f822dc7cb.jpg,https://thumbnail9.coupangcdn.com/thumbnails/local/320/image2/PRODUCTREVIEW/202507/14/8949742927982512282/fde545a5-2048-46c3-bc28-fd4d30e96da1.jpg"
10,4,2025.07.08,,독하지 않아요,"찐으로 내돈으로 사고 찐후기만 남긴다 o(*°▽°*)o
♡ 상품을 선택한 이유: 날파리 싹 잡기 위해서.
♡ 배송 소요 기간: 1일.
♡ 상품 제품명 및 설명: 에프킬라 수성 에어로졸 모기 살충제 무향.
용량: 500ml
갯수: 2개.
♡ 찐후기 모음 Zip
1) 냄새
에프킬라는 사용하고 나면 냄새가 너무 심하게 나죠 ㅠㅠ 향이 있는거라도 오래맡고 있으면 냄새땜에 머리도 아프고 괜히 건강이 안좋아진 기분일랄까?? 그래서 이번에는 무향으로 선택해봤습니다! 향이 아예 안나지 않지만 기존에 쓴것보다는 확실히 향이 약했구요 그래서 그런지 머리도 덜 아팠습니다 ㅎㅎ 저처럼 향에 민감하신 분들은 에프킬라 수성 에어로졸 모기 살충제 무향을 선택해보세요~!
2) 사용효과
저희는 베란다에 음식쓰레기를 보관했다가 버리는데 그래도 벌레가 주방 거실로 들어오니까 미치겠뜨라구요 ㅠㅠ 뚜껑있는 보관함도 구매해보고 밀페되어있는 보관함도 써봤는데 벌레는 어떻게든 들어옴... 그래서 선택한건 에프킬라 수성 에어로졸 모기 살충제 무향! 뿌리고 난 뒤 음쓰보관 뚜껑을 확 닫아버리니까 벌레가 확실히 덜 꼬이더라구요!!
3) 꿀팁
모기를 잡을때 사용하는 에프킬라 수성 에어로졸 모기 살충제! 저는 날파리 잡을려고 구매를 했는데요! 집에 날파리가 너~~무 많다 하시는 분들은 베란다에 통에 음식쓰레기를 넣어놓고 대신 뚜껑은 덮지 마시구요! 하룻동안 방치합니다 그러면 다음날에 날파리들 엄청 꼬이거든요?! 뚜껑을 준비하시고 에프킬라 수성 에어로졸 모기 살충제를 음쓰에 막 뿌린후에 뚜껑을 후다닥 덮어주세요! 그럼 끝~!
4) 사용후기
여름철이 다가올수록 음식쓰레기에 벌레가 엄청 꼬이기 시작했어요 ㅜㅜ  이놈에 날파리들 ㅜㅜ내 눈에서 빙빙 돌다가 잡을려고 하면 도망가버리고 ,,, 날 놀리는건가...? 참,,, 나도 더 이상 참지 않아.,. 에프킬라 수성 에어로졸 모기 살충제로 싸악 날파리들을 잡아보세요~! 효과는 확실하답니당 그리고 분사한 후에는 꼭 창문열고 환기를 시켜주세요!!
5) 단점(주위점+아쉬운점)
1. 흔든후에 분사해주세여!
----------------------------------------------------------------------------------------------------------------------------------------------------------------------------------------------------------------------------------------------------------------------------------------------------------------------------------------------날씨가 점점 더워지고 있네요 (っ °Д °;)っ 에어컨 빵빵도 좋지만 감기걸릴수 있으니!! 조심하시고 함께 감기 걸리지 않게 노력해보아봐여 ㅜㅜ 리뷰가 '도움이 되었다' 하셨다면! ""도움이 돼요""를 눌러주시고 가신다면 찐으로 사랑합니다 (ﾉ◕ヮ◕)ﾉ*:･ﾟ✧",11.0,"https://thumbnail10.coupangcdn.com/thumbnails/local/320/image2/PRODUCTREVIEW/202507/8/7093234494373632909/c135d2ee-bc71-4568-9739-9b6543d8d231.jpg,https://thumbnail7.coupangcdn.com/thumbnails/local/320/image2/PRODUCTREVIEW/202507/8/7093234494373632909/7fcce5c7-2f68-4777-8098-75598028d38c.jpg,https://thumbnail8.coupangcdn.com/thumbnails/local/320/image2/PRODUCTREVIEW/202507/8/7093234494373632909/b8739346-6b8e-405b-ba73-08210894c57d.jpg,https://thumbnail9.coupangcdn.com/thumbnails/local/320/image2/PRODUCTREVIEW/202507/8/7093234494373632909/2e5e2ffe-3135-465e-9ba4-2004b5bb1cf0.jpg,https://thumbnail8.coupangcdn.com/thumbnails/local/320/image2/PRODUCTREVIEW/202507/8/7093234494373632909/6b98da18-f3ac-4e55-82e2-4ae1b161bf33.jpg,https://thumbnail6.coupangcdn.com/thumbnails/local/320/image2/PRODUCTREVIEW/202507/8/7093234494373632909/2a75d252-b35d-4829-afe0-a316cbd9cf48.jpg,https://thumbnail7.coupangcdn.com/thumbnails/local/320/image2/PRODUCTREVIEW/202507/8/7093234494373632909/f4b08e2d-0715-4ab7-93df-038efad1131d.jpg,https://thumbnail6.coupangcdn.com/thumbnails/local/320/image2/PRODUCTREVIEW/202507/8/7093234494373632909/9b4c2fe5-5e8f-4069-a82d-bd7e97cea1d4.jpg,https://thumbnail6.coupangcdn.com/thumbnails/local/320/image2/PRODUCTREVIEW/202507/8/7093234494373632909/fbbb46c0-0971-4ce6-999f-8d079594fe30.jpg,https://thumbnail8.coupangcdn.com/thumbnails/local/320/image2/PRODUCTREVIEW/202507/8/7093234494373632909/e12cc3d5-b2b5-4244-a413-de34cf6fabb3.jpg"
