rank,rating,date,user,headline,body,helpful_count,images
256,5,2025.04.08,이*경,"쿠팡에서 애플워치 SE 2세대를 구매했는데, 진심으로 인생템을 만난 기분이에요. 평소엔 스마트워치에 큰 관심이 없었는데, 이번에 건강 관리도 할 겸 큰맘 먹고 질렀습니다. 배송은 역시 로켓배송이라 하루 만에 도착했고, 포장도 안전하게 잘 되어 있어 개봉할 때부터 기분이 좋았어요.디자인은 말할 것도 없이 심플하고 고급스러워서 어떤 스타일에도 잘 어울리고, 손목에 착 감기는 느낌이 너무 좋습니다. 특히 알루미늄 케이스와 스포츠 밴드 조합이 가볍고 착용감이 좋아서 하루 종일 차고 있어도 부담이 없어요.가장 만족스러운 점은 헬스 기능인데요, 운동할 때 자동으로 감지해서 기록해주고, 수면 추적, 심박수 측정, 스트레스 체크까지 꼼꼼하게 챙겨줘서 제 건강에 더 신경 쓰게 되었어요. 게다가 아이폰과의 연동이 정말 매끄러워서 문자, 전화, 알림 확인도 바로 되고, 지갑 없이 애플페이로 결제까지 가능하니까 외출할 때 정말 편합니다.배터리도 하루 이상 충분히 가고, 충전 속도도 빨라서 큰 불편함이 없어요. 처음엔 가격 때문에 망설였지만, 막상 사용해보니 충분히 값어치를 한다고 느낍니다. 쿠팡 덕분에 정품을 빠르게, 안전하게 받을 수 있었고 만족도 100%예요. 고민하시는 분들께 적극 추천합니다!","쿠팡에서 애플워치 SE 2세대를 구매했는데, 진심으로 인생템을 만난 기분이에요. 평소엔 스마트워치에 큰 관심이 없었는데, 이번에 건강 관리도 할 겸 큰맘 먹고 질렀습니다. 배송은 역시 로켓배송이라 하루 만에 도착했고, 포장도 안전하게 잘 되어 있어 개봉할 때부터 기분이 좋았어요.
디자인은 말할 것도 없이 심플하고 고급스러워서 어떤 스타일에도 잘 어울리고, 손목에 착 감기는 느낌이 너무 좋습니다. 특히 알루미늄 케이스와 스포츠 밴드 조합이 가볍고 착용감이 좋아서 하루 종일 차고 있어도 부담이 없어요.
가장 만족스러운 점은 헬스 기능인데요, 운동할 때 자동으로 감지해서 기록해주고, 수면 추적, 심박수 측정, 스트레스 체크까지 꼼꼼하게 챙겨줘서 제 건강에 더 신경 쓰게 되었어요. 게다가 아이폰과의 연동이 정말 매끄러워서 문자, 전화, 알림 확인도 바로 되고, 지갑 없이 애플페이로 결제까지 가능하니까 외출할 때 정말 편합니다.
배터리도 하루 이상 충분히 가고, 충전 속도도 빨라서 큰 불편함이 없어요. 처음엔 가격 때문에 망설였지만, 막상 사용해보니 충분히 값어치를 한다고 느낍니다. 쿠팡 덕분에 정품을 빠르게, 안전하게 받을 수 있었고 만족도 100%예요. 고민하시는 분들께 적극 추천합니다!",15.0,
257,5,2025.06.17,박별,간지폭풍,"-구매동기
그냥 너무 예뻐보이기도 하고 알림오는 걸 놓치기 싫어서 구매했다.
-사용기
배터리는 생각보다 오래 간다. 하루 사용하는데 50% 정도 닳는 느낌? 무엇보다 너무너무너무 예쁘고 난 애플워치의 많은 기능을 사용할 필요가 딱히 없어서 구냥 오는 알림들 바로바로 확인할 수 있어서 너무 좋고 전화 바로 받을 수 있어서 좋았다.
-이런 사람들에게 추천
애플처돌이,패션을 위해(?) 애플워치가 필요한 사람,알림오는 거 놓치기 싫은 사람,운동 자주 하는 사람,휴대폰보기 힘든 사람",14.0,"https://thumbnail6.coupangcdn.com/thumbnails/local/320/image2/PRODUCTREVIEW/202506/17/7609522500066224177/fc4990fb-3103-4b91-969f-cdd1e7e77bc6.jpg,https://thumbnail10.coupangcdn.com/thumbnails/local/320/image2/PRODUCTREVIEW/202506/17/7609522500066224177/639c0e30-9a99-44dc-97f4-dbb889b54b1e.jpg"
258,5,2025.06.12,김*원,디자인 고급스럽네요ㆍㆍ,디자인 맘에드는데. 생각보단. 40사이즈가 작았는데. 계속적응해보려고하고. 줄도 생각보다. 짧아서. 맞나싶긴했어요. 근데 너무긴거보다 낫고. 커보이는거보다 낫겠지하고. 생각해보려고요.비교해볼수없어서. 좀. 아쉽긴하지만.고급지긴합니다.,13.0,"https://thumbnail6.coupangcdn.com/thumbnails/local/320/image2/PRODUCTREVIEW/202506/12/8804168644407281853/1f43b916-e00a-463b-90c8-aa21d131592b.jpg,https://thumbnail6.coupangcdn.com/thumbnails/local/320/image2/PRODUCTREVIEW/202506/12/8804168644407281853/42a4c61f-e848-44e1-9921-17c507204411.jpg,https://thumbnail7.coupangcdn.com/thumbnails/local/320/image2/PRODUCTREVIEW/202506/12/8804168644407281853/81e1ef3f-680f-4a3d-9257-79621b4de198.jpg"
259,5,2025.05.17,치히로맘,"운동 전용으로 구매한 워치가 크고 무거운 편이라일상에서 업무 연락 놓치기 쉬워서 구매했어요굳이 필요한가 했지만 또 있으니 편하긴 합니다 ㅎㅎ켜면 폰잡아서 바로 연동되고수면체크, 전화 문자 톡 알람 및 체크,운동 확인 및 평고 움직임 등으로 주로 사용하게 되네요!배터리 하루간다는건 알고 있었지만아주 큰 단점 같아요;;언젠가 안쓰게 된다면 충전 때문일듯;;일이만원짜리도 아닌데 하루용 배터리는 너무한듯이상 내돈내산 짧은 후기였습니다","운동 전용으로 구매한 워치가 크고 무거운 편이라
일상에서 업무 연락 놓치기 쉬워서 구매했어요
굳이 필요한가 했지만 또 있으니 편하긴 합니다 ㅎㅎ
켜면 폰잡아서 바로 연동되고
수면체크, 전화 문자 톡 알람 및 체크,
운동 확인 및 평고 움직임 등으로 주로 사용하게 되네요!
배터리 하루간다는건 알고 있었지만
아주 큰 단점 같아요;;
언젠가 안쓰게 된다면 충전 때문일듯;;
일이만원짜리도 아닌데 하루용 배터리는 너무한듯
이상 내돈내산 짧은 후기였습니다",15.0,"https://thumbnail6.coupangcdn.com/thumbnails/local/320/image2/PRODUCTREVIEW/202505/17/2224152894675637884/297ba75a-732f-4a76-9c57-e1cb43fe4f68.jpg,https://thumbnail7.coupangcdn.com/thumbnails/local/320/image2/PRODUCTREVIEW/202505/17/2224152894675637884/aad47f59-8d0a-4e4e-aee4-b7f4b3c44ae3.jpg,https://thumbnail7.coupangcdn.com/thumbnails/local/320/image2/PRODUCTREVIEW/202505/17/2224152894675637884/8973195e-00a3-41f5-a6e9-04e0ba8b9cf7.jpg"
260,5,2025.05.26,뚝딱보물섬,곧 se3 나온다는 소문이 있지만 저는 어차피 필요한 기능만 사용하기 때문에 2를 구매했어요.보통 여자 손목에 40mm 적당해요. 실버가 다른 여러 스트랩하고 잘 어울린다기에 실버로 구매했는데 잘 선택한 것 같아요!핸드폰이랑 동기화하기도 쉽고 배터리는 생각보다 오래 가지는 않는것 같아요.운동할때 간단하게 타이머 사용하기도 좋고 알림도 간편하게 확인할수 있어서 좋아요.,"곧 se3 나온다는 소문이 있지만 저는 어차피 필요한 기능만 사용하기 때문에 2를 구매했어요.
보통 여자 손목에 40mm 적당해요. 실버가 다른 여러 스트랩하고 잘 어울린다기에 실버로 구매했는데 잘 선택한 것 같아요!
핸드폰이랑 동기화하기도 쉽고 배터리는 생각보다 오래 가지는 않는것 같아요.
운동할때 간단하게 타이머 사용하기도 좋고 알림도 간편하게 확인할
수 있어서 좋아요.",6.0,"https://thumbnail9.coupangcdn.com/thumbnails/local/320/image2/PRODUCTREVIEW/202505/26/1610456176719013385/1e394e29-69de-4a59-815b-1873e8620b76.jpg,https://thumbnail7.coupangcdn.com/thumbnails/local/320/image2/PRODUCTREVIEW/202505/26/1610456176719013385/82add54f-a713-4e91-a836-cc992f6d6e01.jpg,https://thumbnail7.coupangcdn.com/thumbnails/local/320/image2/PRODUCTREVIEW/202505/26/1610456176719013385/8e0aae71-aef0-47cd-818d-2877e2957e66.jpg"
261,5,2025.06.15,귀요미엄마,매일 운동 하는 여성입니다기존 사용하던 워치 배터리가 넘 빨리 닳아서 급히 주문했네요하루종일 사용해도 배터리가 오래 가서 넘 만족해요!!스트랩 선택이 자유롭지 않아서 좀 아쉽긴 하지만급하게 필요해서 쩔수없었..,"매일 운동 하는 여성입니다
기존 사용하던 워치 배터리가 넘 빨리 닳아서 급히 주문했네요
하루종일 사용해도 배터리가 오래 가서 넘 만족해요!!
스트랩 선택이 자유롭지 않아서 좀 아쉽긴 하지만
급하게 필요해서 쩔수없었..",1.0,"https://thumbnail6.coupangcdn.com/thumbnails/local/320/image2/PRODUCTREVIEW/202506/15/6806674696714248964/7854fb73-5d85-4eb7-bbae-35561e69b674.jpg,https://thumbnail7.coupangcdn.com/thumbnails/local/320/image2/PRODUCTREVIEW/202506/15/6806674696714248964/ef640759-edbe-4e1a-a53f-ae374a2221f7.jpg,https://thumbnail6.coupangcdn.com/thumbnails/local/320/image2/PRODUCTREVIEW/202506/15/6806674696714248964/6d279224-48ec-4909-8f5b-c1518c20a7e8.jpg"
262,5,2025.02.20,유*현,가성비를 감안한 일부 부족한 기능은 충분히 납득 가능,"사용하고 있던 애플워치6 셀룰러 LTE/40mm 가 침수로 인해 고장,
3년 2개월 정도 사용했고 시간이 지나면서 방수 기능이 약해졌던 것 같습니다,
잠수를 한 것도 아니고 샤워하는 동안 침수가 된 듯, 워치 내부에선 뭔가 반응을
하는 것 같은데, 디스플레이가 안되니 사용 불가.
보증 기간도 끝난지 오래고, 별도로 유료 보증에도 가입하지 않아 버리고 저렴한
모델로 검토하다가 이 모델을 구입했습니다,
기존에 사용하던 것과 같은 40mm 제품이라 위화감은 전혀 없고 오히려 약간 더
가벼워진 느낌입니다.
밴드는 남자 손목에 차기에는 조금 짧은 느낌입니다.(사진 참조)
제품은 받자마자 충전(완전 방전된 상태로 배송되어왔기 때문에 한참 충전 함)
충전한 후에는 아이폰에 스스로 인식하였고 전에 세팅한 경험이 있어 비슷한
수순으로 설정을 무사히 마쳤습니다.
바테리 동작시간은 전번 것 보다는 확실히 짧은 것 같습니다
아침에 한번 저녁에 한번 정도 씩 충전을 해야 할 듯 합니다.
일단 가성비가 좋으니 일부 기능이 먼저번 제품과 차이나는 것은 감수해야겠죠",6.0,"https://thumbnail6.coupangcdn.com/thumbnails/local/320/image2/PRODUCTREVIEW/202502/20/8170808375057375000/c7bada01-f337-434b-9e59-fd6bef032407.jpeg,https://thumbnail8.coupangcdn.com/thumbnails/local/320/image2/PRODUCTREVIEW/202502/20/8170808375057375000/3e86689a-9c92-4344-90cd-430fa845d95f.jpeg"
263,5,2025.06.24,김*섭,굿굿굿,"Apple 정품 2024 애플워치 SE 2세대 44mm GPS 모델은 가성비와 성능을 모두 만족시키는 스마트워치입니다. 넓은 44mm 디스플레이는 시인성이 뛰어나며, 알림 확인이나 운동 기록 확인 시 매우 편리합니다. 최신 칩셋 탑재로 반응 속도가 빠르고 부드러운 사용감을 제공합니다. 다양한 운동 및 건강 기능이 탑재되어 있어 활동량 측정, 심박수 모니터링, 수면 분석 등 실생활에서 유용하게 활용할 수 있습니다. 방수 기능도 우수해 일상생활이나 운동 중에도 안심하고 사용할 수 있으며, 애플 생태계와의 뛰어난 연동성으로 아이폰 사용자에게 특히 만족도가 높습니다.",8.0,
264,5,2025.04.09,이*훈,"기능은 충분하고, 가격은 부담 덜한 애플워치 입문용","애플워치 입문용으로 SE 모델 중에서 가장 무난하다는 평이 많아서 선택했습니다.
실제로 써보니, 기본에 충실하면서도 꼭 필요한 기능은 다 갖춘 모델이에요.
좋았던 점
•	GPS 모델이라 배터리 효율이 좋고, 아이폰 근처에 두고 쓰는 라이프스타일이면 전혀 불편 없습니다.
•	건강 앱, 운동 기록, 알림 연동, 수면 추적 같은 기본 기능들 잘 작동하고 반응속도도 빠릅니다. 딱히 버벅임 없고, 쾌적해요.
•	스타라이트 색상은 은은하고 튀지 않아서 어떤 옷에도 잘 어울림
•	스포츠 밴드는 가볍고 착용감 좋고, 생활방수도 되니 운동용으로 적합
아쉬운 점
•	디스플레이는 상위 모델보다 베젤이 약간 두껍고, 항상 켜짐 화면은 없음
→ 하지만 사용하다 보면 적응돼서 크게 불편하진 않아요.
•	심전도, 체온 측정 등 일부 고급 기능은 없음
→ 단순 운동, 건강관리 중심 사용자라면 크게 필요하지 않을 수도 있음
애플 생태계 안에서 간단하게 운동 관리하고 알림 확인하기에 충분한 성능.
가격 대비 만족도 높고, 복잡한 기능보다 가볍고 실용적인 스마트워치를 원하는 사람에게 추천합니다.",2.0,https://thumbnail7.coupangcdn.com/thumbnails/local/320/image2/PRODUCTREVIEW/202504/9/5305651167633326928/d34d319c-b7ab-4a03-a581-e2a5c97a20c2.jpg
265,5,2025.02.10,이유락,취뽀한 친구 선물로 사줬어요!,"❤️❣️내돈내산 사용훅2✌️❤️
최근에 취업한 친구를 위해 애플워치를 선물했어요~ 처음 착용해본 친구의 반응이 정말 좋더라고요! 디자인이 세련되고, 다양한 기능이 있어 일상생활에서 유용하게 활용할 수 있다고 합니다.
특히 헬스케어 기능이 뛰어나서 운동할 때마다 유용하다고 하네요~ 심박수 측정이나 운동 기록 기능 덕분에 건강 관리에 큰 도움이 되고 있다는 말이 인상적이었습니다.
알림 기능도 편리해서 중요한 메시지를 놓치지 않게 도와준다고 합니다! ㅠㅠ 정말 필요한 아이템이 되어버렸네요~ 전반적으로 애플워치는 실용적이고 스타일리시한 아이템이라서 선물로 매우 만족스러웠습니다. 친구도 정말 기뻐하더라고요! ㅠㅠ
저의 두서없는 리얼 리뷰가 도움이 되셨다면!❣️
⭐️도움이 돼요⭐️부탁드립니다!
이게 뭐라고 도움이 됐다는 알림이 뜨면
마구 기쁘네요!!!!",1.0,"https://thumbnail10.coupangcdn.com/thumbnails/local/320/image2/PRODUCTREVIEW/202502/10/7315706204243961421/11f2ad5e-4134-4d76-9960-0a9242f97fd4.jpg,https://thumbnail9.coupangcdn.com/thumbnails/local/320/image2/PRODUCTREVIEW/202502/10/7315706204243961421/73f57ae7-6da2-4c01-8360-5dfced38a8d4.jpg,https://thumbnail8.coupangcdn.com/thumbnails/local/320/image2/PRODUCTREVIEW/202502/10/7315706204243961421/b6b739de-012b-41b4-87c7-e0024c6d9fe2.jpg"
266,5,2025.04.28,위*빈,저렴하게 잘 샀습니다.,"포장도 꼼꼼히 잘 왔고 남친 생일선물로 사줬는데 남자친구가 너무 마음에 들어합니다.
필요한 기능을 손쉽게 사용가능한 것 같아요!",15.0,"https://thumbnail6.coupangcdn.com/thumbnails/local/320/image2/PRODUCTREVIEW/202504/28/6923756378027128270/2621405e-50ed-41ab-b776-480723155595.jpg,https://thumbnail7.coupangcdn.com/thumbnails/local/320/image2/PRODUCTREVIEW/202504/28/6923756378027128270/35743617-106c-4f3f-a5c3-4f779d9085ab.jpg,https://thumbnail8.coupangcdn.com/thumbnails/local/320/image2/PRODUCTREVIEW/202504/28/6923756378027128270/798bb8e5-4b53-47ea-8341-81bd45784ff7.jpg,https://thumbnail6.coupangcdn.com/thumbnails/local/320/image2/PRODUCTREVIEW/202504/28/6923756378027128270/59b02412-4ca8-4447-b7bf-276d84241002.jpg"
267,5,2025.02.11,쓰리고sz,아이가 너무 좋아해요,"초등학생 고학년 아이가 용돈 모아서 산
애플워치
가격이 비싸서 걱정했는데
아이가 워낙 갖고싶어해서 허락했어요.
받아보니 왜 아이가 갖고싶어했는지 알겠더라구요.
디자인도 너무 이쁘고 유용한 기능들도 많아요.
저는 갤워치 쓰고있는데 디자인이 애플워치가 더 이쁘네요
스트랩이 클까봐 걱정했는데
초6 마른여아 손목에 충분히 잘맞아요~
오랫동안 잘 쓰도록 해야겠어요.",14.0,"https://thumbnail10.coupangcdn.com/thumbnails/local/320/image2/PRODUCTREVIEW/202502/11/9209105966541089699/2d2850fc-a40b-4993-bf73-571a5f0eb161.jpg,https://thumbnail10.coupangcdn.com/thumbnails/local/320/image2/PRODUCTREVIEW/202502/11/9209105966541089699/fcd9ebaa-fdd6-4d3b-8e42-8f5ed394986a.jpg,https://thumbnail8.coupangcdn.com/thumbnails/local/320/image2/PRODUCTREVIEW/202502/11/9209105966541089699/bb136d29-c8fc-4313-b92e-d0337c090a27.jpg,https://thumbnail10.coupangcdn.com/thumbnails/local/320/image2/PRODUCTREVIEW/202502/11/9209105966541089699/0350d6f8-c324-4725-ac0e-49664a362719.jpg"
268,5,2025.01.18,나*근,육아허는 부모라면 가져야할 must have 애플 워치,"쿠팡에서 애플워치를 구매하고 정말 잘 활용하고 있어서 후기를 남기고 싶어요!  육아와 수유를 하면서 애플워치가 정말 많은 도움이 되었거든요. 로켓배송 덕분에 다음 날 바로 받아서 너무 좋았고요!
장점 1: 빠른 배송!
로켓배송 덕분에 다음 날 바로 애플워치를 받았어요! 육아로 바쁜 중에도 빠르게 받아서 바로 사용해볼 수 있었어요. 진짜 편리했어요!
장점 2: 손목에 착 감기는 디자인
애플워치 디자인이 너무 깔끔하고 가벼워서 하루 종일 착용해도 부담 없어요. 육아 중에 손목에 부담이 없어서 정말 좋았어요!
장점 3: 수유 타이머로 활용
수유할 때마다 애플워치로 시간을 체크할 수 있어서 너무 유용해요. 수유 시간이 길어지거나 놓치지 않게 도와줘요! 알림이 울리면 바로 체크할 수 있어요.
장점 4: 건강 관리의 필수 아이템!
아기 돌보기 바쁘지만, 애플워치를 통해 내 건강도 챙길 수 있어서 너무 좋아요. 운동량도 확인하고, 심박수도 체크할 수 있어요. 육아하면서도 내 건강을 챙기고 있어요!
장점 5: 손쉽게 알림 받기
스마트폰을 꺼내지 않고도 메시지나 전화를 바로 확인할 수 있어서 너무 편리해요. 아이를 안고 있을 때 정말 유용하답니다!
정말 애플워치 덕분에 육아가 조금 더 편해지고, 더 많은 일을 동시에 할 수 있게 되었어요. 로켓배송 덕분에 빠르게 받아서 바로 사용할 수 있었던 점도 정말 좋았어요!",13.0,
269,5,2025.01.17,늄눔,적당한 기능이 있는 합리적인 스마트워치 찾으신다면 추천,"Apple 정품 2024 애플워치 SE 2세대 알루미늄 케이스
이런 분들께 추천드려요
✨다양한 애플 제품을 사용하시고 싶은 분
✨간단한 기능 정도만 있으면 충분하신 분
✨가성비 좋은 세련된 스마트 워치 찾으시는 분
생일 선물로 골라보았는데 받고 너무 예뻐서 좋았습니다
쿠팡으로 구매한 이유는 배송이 빨라서 였어요
주문하고 다음 날 바로 왔고 구성품 똑같고 정품 맞습니다
미드나이트 알루미늄 케이스는 짙은 네이비 컬러이며
저한테는 어울리지 않아서 실버로 교체해주었습니다
뼈대자체가 얇아서 손목이 매우 얇은데 딱히 무겁지 않고 가벼워서 충분히 하루종일 착용가능했구요 크기도 너무 크면 아빠시계 뺏은거처럼 투박하고 안예쁜데 딱이였어요
디스플레이도 기스없이 깨끗하게 도착해서 선명하고 햇빛 강한 날 밖에서 보아도 잘 보였습니다
외관도 고급스럽고 예뻐서 악세사리용으로도 예쁘답니다
처음받았던 스포츠 밴드는 제 스타일이 아니라서 빼긴 했지만 편안한 건 그게 제일 편했어요 실리콘 소재로 부드럽고 가벼우며 운동 중에 착용도 했었는데 특별히 땀이 차거나 하지 않았어요 손목에 맞게만 착용하시면 흔들림도 별로 없어요
아이폰,에어팟과 연동도 잘 되어서 삶의 질이 조금 더 올라간 느낌이고 아이폰에서 쓰던 심박수, 수면, 운동 이런것도 다 잘 되어서 편안해요
시계를 쳐다보지않으면 화면이 꺼져있고 손목을 들어서 확인하면 화면이 켜지는 부분도 저는 편했어요
배터리는 저는 재택근무를 해서 일할 때 조금씩만 보고 핸드폰으로 오는 알림정도만 떠서 이틀정도 사용했던 것 같아요
충전은 빠른 것 같아요 퇴근 후 무선충전기에 올려두고 씻고 밥 먹고 놀다가 보면 완충되어 있더라구요 자기전에 충전해두시고 주무시면 하루종일 사용하기에 충분할 것 같아요
보호 필름 붙히다가 실패해서 안붙히고 있고, 워치 케이스 안끼고 있는데 집에서만 쓰는데도 기스가 잘나요 필름 벗겨지듯이,,보호필름과 보호케이스 필수로 구매하세요
솔직한 리뷰 읽어주셔서 감사합니다
""아래의 도움이 돼요"" 부탁드립니다
⬇️⬇️⬇️⬇️⬇️⬇️⬇️⬇️⬇️⬇️⬇️⬇️⬇️⬇️⬇️",15.0,
270,5,2025.06.25,여쮸,애플워치 저는 후회 안합니다.,"애플워치 사고 안쓴다. 후회한다는 후기가 종종 있어 고민하다 구매했습니다.
전에는 저렴한 갤럭시 핏이나 아날로그 시계를 잘 사용했었는데 아이폰이라 그런지 다른 브랜드 전자제품은 확실히 호환이 잘 안되는지 버벅이더라고요. 그리고 기능도 많지 않아서 사용을 안하게 되었는데 애플워치는 전화 카톡읽기만 해도 진짜 빠르게 연결되고 나갈때 안차면 블편할 정도로 필수품이 되었습니다.
시계 잘 쓰시는 분들은 애플워치 추천합니다.
(내돈내산 후기)",6.0,https://thumbnail9.coupangcdn.com/thumbnails/local/320/image2/PRODUCTREVIEW/202506/26/1865557854011566696/547d845a-e3cb-4a5b-ad5d-956701bc413b.jpg
271,5,2025.06.08,망지,가성비 2024 애플워치 SE2 구매후기,"- 생일 선물로 받았는데 로켓배송으로 다음 날 바로 도착했고, 40 / 44 mm 중에 제 손목엔 40 mm가 딱 맞았어요(여성 기준)
- 심박수 측정, 수면 추적, 넘어짐 감지, 긴급 구조 요청 등 se 시리즈이지만 핵심 기능 탄탄해요
- 배터리 약 18시간 정도라서 하루 사용하면 충전은 필수입니다!
- 저는 운동 기록, 직장에서 메세지, 전화 바로 확인할때 많이 사용합니당
=> 30만 원대 중후반에 S8 칩·GPS·건강 기능 등을 사용할 수 있어 가성비 제품입니당
처음 스마트워치 입문하시거나 아이폰 사용자, 실속파 이신분들은 상위 모델과 차이 있지만, 더 많은 기능 필요없다면 SE2로 충분합니다:)",1.0,https://thumbnail8.coupangcdn.com/thumbnails/local/320/image2/PRODUCTREVIEW/202506/8/6046116201856606382/780256a9-b35c-461d-8201-25f2276a8eee.jpg
272,5,2025.04.26,이*연,만족해요,"애플워치 처음 써보는데
확실히 자극되서 많이 움직이게 되네요
폰이랑 처음 연동할때 폰에 ios 최신버전이여야해서
앱 사진 다 지우느라 애먹었어요ㅠㅠ
미리 최신버전으로 업데이트 해두시면
빨리 연동 될겁니다!!
출산 후 셀프 선물로 구매해서
출산 후 약해진 체력 열심히 올리고 있어요
다만 배터리는 오래가진 않아요 매일 매일
자기전 충전은 필수네요!!
캐쥬얼하니 예쁘고~ 가격도 이것보다
더 많이 주는건 부담인데 적당히 잘 산 것 같아요
빠른 배송도 추천합니다",6.0,"https://thumbnail8.coupangcdn.com/thumbnails/local/320/image2/PRODUCTREVIEW/202504/26/5939104263199310289/95dcba4b-da58-40f3-b19d-e0dd1803732f.jpg,https://thumbnail8.coupangcdn.com/thumbnails/local/320/image2/PRODUCTREVIEW/202504/26/5939104263199310289/8df7480c-a801-48ba-95bc-a06ea3d2e22e.jpg,https://thumbnail8.coupangcdn.com/thumbnails/local/320/image2/PRODUCTREVIEW/202504/26/5939104263199310289/18d5c0e1-9922-4b78-95ce-0a3f81e6619c.jpg"
273,5,2025.02.25,해피데이,선물용으로 최고,"✅ 세련된 디자인 & 가벼운 착용감
애플워치 특유의 미니멀하고 세련된 디자인에 알루미늄 케이스가 더해져 고급스럽고 가볍습니다. 장시간 착용해도 부담이 없고, 어떤 스타일에도 잘 어울려요.
✅ 빠르고 부드러운 성능
S8 칩셋 덕분에 반응 속도가 빨라서 앱 실행이나 스크롤이 매우 부드럽습니다. 기본적인 스마트워치 기능을 사용하기엔 전혀 부족함이 없어요.
✅ 건강 & 피트니스 기능 탑재
운동 기록, 심박수 측정, 수면 추적 등 건강 관리 기능이 충실해서 일상 속에서 유용하게 활용할 수 있어요. 운동할 때 자동으로 감지해 주는 기능도 편리합니다.
✅ 완벽한 애플 생태계 연동
아이폰, 맥북, 에어팟 등 애플 제품과의 연동이 훌륭해서 메시지 확인, 음악 조절, 지도 네비게이션 활용이 아주 편리합니다. 아이폰이 가방 안에 있어도 웬만한 작업은 애플워치로 해결 가능해요.
✅ 가성비 좋은 선택
애플워치 시리즈 9보다 가격이 합리적이면서도 필수 기능은 다 갖추고 있어 가성비가 뛰어난 모델입니다. 항상 최신 기능이 필요한 게 아니라면 SE 2세대로도 충분히 만족할 수 있을 것 같아요.
총평
디자인, 성능, 애플 생태계 연동까지 모두 만족스러운 스마트워치! 가성비 좋은 애플워치를 찾는다면 SE 2세대가 정답입니다. 재구매 의사 100%!",8.0,
