rank,rating,date,user,headline,body,helpful_count,images
1,5,2025.07.06,땅콩이언니,사고나니까 너무 편하네요.,"se3가 나온다는 소문도 있었고,
내가 진짜 이 돈주고 애플워치가 필요한가 엄청 많이 고민했었습니다.
하지만 직업특성상 시계가 너무 필요했고
그리고 막상 사고나니까 너무 편리하네요.
고민한 시간이 아까울 정도예요.
중요한 알림을 놓치지 않고 바로 받을  수 있는 것은 물론
평소에 무음으로 항상 해놓아서 전화를 놓치는 경우가 많았는데
핸드폰을 소지하고 있지 않아도
전화알람을 바로 확인할 수 있어서 좋았어요.
그리고 핸드폰을 어디놔뒀는지 모를때
시리에게 핸드폰 찾아달라하면 찾아주는 기능이 제일 편해요.
그리고 배경화면도 내가 원하는 디자인으로
내가 원하는 기능으로 해 놓을 수 있다는 점이 좋아요.
하지만 저는 역시나 애플워치가 성능등에 비해서 비싸다고
생각합니다.
할인한 가격으로 싸게 샀음에도 불구하고
비싸긴하다라는 생각이 드네요.
20초반대가 제일 적당할 것 같습니다.
물론 제가 생각했을 때 이정도면 애플워치 살만하지라고
생각하는 기준이지만..
단점은 생각보다 기스가 잘 나네요.
필름 이틀 안 붙였는데 화면에 미세하게 실기스가 났습니다.
또한 배터리가 뭐 하는 거에 비해서 너무 빨리 닳아요
딱 하루밖에 안갑니다.
그리고 충전기도 선을 제공해줘서 좋지만
어댑터가 없어서 따로 구매해야합니다.
이런 단점들이 있지만 그래도 역시나 애플워치는 애플워치입니다.
디자인이 예뻐서 하고다니면 기분이 좋습니다.
저는 추천합니다. 구매를",1.0,"https://thumbnail9.coupangcdn.com/thumbnails/local/320/image2/PRODUCTREVIEW/202507/6/7355638906439725498/537cac86-0c17-463e-a6df-d69b96fff9fb.jpg,https://thumbnail9.coupangcdn.com/thumbnails/local/320/image2/PRODUCTREVIEW/202507/6/7355638906439725498/9ab830b9-8bd7-48b2-9695-62179e3a8866.jpg,https://thumbnail7.coupangcdn.com/thumbnails/local/320/image2/PRODUCTREVIEW/202507/6/7355638906439725498/fbdbed40-44b8-4806-b9f7-ab54e2595661.jpg,https://thumbnail6.coupangcdn.com/thumbnails/local/320/image2/PRODUCTREVIEW/202507/6/7355638906439725498/a4fb0f29-52d5-4506-9508-a76a7b6dcc61.jpg,https://thumbnail8.coupangcdn.com/thumbnails/local/320/image2/PRODUCTREVIEW/202507/6/7355638906439725498/f39eaa74-51ef-4413-9950-15967bdf4c96.jpg,https://thumbnail6.coupangcdn.com/thumbnails/local/320/image2/PRODUCTREVIEW/202507/6/7355638906439725498/42b48493-1a08-4727-ab3a-1a981fa8516a.jpg,https://thumbnail10.coupangcdn.com/thumbnails/local/320/image2/PRODUCTREVIEW/202507/6/7355638906439725498/10f2ed2f-d2d7-43ca-b134-2d68ed859fa4.jpg,https://thumbnail9.coupangcdn.com/thumbnails/local/320/image2/PRODUCTREVIEW/202507/6/7355638906439725498/fa2a1f93-5be7-4b7f-b17f-d30b00efcb19.jpg"
2,5,2025.06.30,김건우,앱등이의 필수품 애플워치!!!!,"여자친구 생일선물로 이번에 구매한 애플워치 SE 2세대(40mm, 실버 알루미늄 케이스, 블루 클라우드 스포츠 루프)는, 애플이 실속과 성능을 균형 있게 잡은 웨어러블의 표본이라 해도 과언이 아닐 정도로 완성도 높은 스마트워치입니다. 특히 가격 대비 기능성이 매우 우수하며, 디자인과 착용감까지 고급스러워 처음 애플워치를 구매하는 분들께 강력히 추천하고 싶은 제품입니다.
우선 디자인은 심플하지만 고급스럽습니다. 실버 알루미늄 케이스는 밝고 깨끗한 느낌을 주며, 어느 스타일에도 자연스럽게 어울립니다. 특히 이번에 함께 구성된 블루 클라우드 스포츠 루프 밴드는 가볍고 통기성이 뛰어나 운동할 때나 장시간 착용에도 손목에 무리를 주지 않습니다. 벨크로 타입이라 착용과 탈착이 매우 간편하며, 손목에 맞게 세밀하게 조절할 수 있어 피트감도 완벽합니다.
성능면에서도 애플워치 SE 2세대는 이전 세대보다 확실히 개선된 퍼포먼스를 체감할 수 있습니다. S8 SiP 칩이 탑재되어 빠르고 부드러운 앱 구동이 가능하고, watchOS 10의 다양한 헬스 기능, 운동 트래킹, 심박수 측정, 수면 분석, SOS 긴급호출 기능까지 모두 지원되어 건강 관리에 최적화된 스마트워치라고 할 수 있습니다. 특히 GPS 모델임에도 불구하고 실내외 위치 추적이 정확하고 빠르며, 피트니스 목표를 설정하고 관리하는 데 매우 큰 도움이 됩니다.
배터리도 하루 종일 충분히 사용할 수 있는 수준이며, 사용 패턴에 따라 2일까지도 버틸 수 있어 실용성이 매우 높습니다. 그리고 아이폰과의 연동은 역시 애플답게 완벽합니다. 전화 수신, 문자, 알림 확인, 음악 컨트롤, 애플 페이 등 여러 기능을 손목 위에서 바로 사용할 수 있어 일상 속 디지털 효율성을 극대화할 수 있습니다.
✅ 가볍고 세련된 디자인 + 통기성 좋은 스포츠 루프
✅ 향상된 퍼포먼스와 watchOS 10 완벽 호환
✅ 정확한 피트니스 추적 + 다양한 건강관리 기능
✅ 안정적인 배터리 수명과 빠른 충전
✅ 아이폰 사용자에겐 최고의 웨어러블 파트너
총평하자면, 애플워치 SE 2세대는 가성비와 실용성, 디자인과 퍼포먼스를 모두 갖춘 전천후 스마트워치입니다. 처음 애플워치를 접하는 분이나, 실속형 스마트워치를 찾는 분, 운동 및 건강 관리에 초점을 맞춘 웨어러블 기기를 원하시는 분들께 자신 있게 추천드립니다. 단순한 시계를 넘어서 일상과 건강을 함께 관리하는 동반자, 후회 없는 선택이었습니다. 재구매 의사 100%, 선물용으로도 강추합니다!",6.0,"https://thumbnail6.coupangcdn.com/thumbnails/local/320/image2/PRODUCTREVIEW/202506/30/8532223761101928591/f0d0f95d-79e8-40bb-b5fe-1d59b7b2d92e.jpg,https://thumbnail10.coupangcdn.com/thumbnails/local/320/image2/PRODUCTREVIEW/202506/30/8532223761101928591/2f24747e-4006-4917-9ad6-35e6b3c601e8.jpg,https://thumbnail10.coupangcdn.com/thumbnails/local/320/image2/PRODUCTREVIEW/202506/30/8532223761101928591/1ea7627d-85fb-45e8-8b40-9b8050dcfa51.jpg,https://thumbnail9.coupangcdn.com/thumbnails/local/320/image2/PRODUCTREVIEW/202506/30/8532223761101928591/4b80930e-4dda-4860-ba8b-0bbb8b379cae.jpg,https://thumbnail8.coupangcdn.com/thumbnails/local/320/image2/PRODUCTREVIEW/202506/30/8532223761101928591/154d1f84-e9db-4224-8be1-f1e15303ad4e.jpg,https://thumbnail10.coupangcdn.com/thumbnails/local/320/image2/PRODUCTREVIEW/202506/30/8532223761101928591/c871a6ce-52f8-4546-b694-b4788b1f6ff7.jpg,https://thumbnail6.coupangcdn.com/thumbnails/local/320/image2/PRODUCTREVIEW/202506/30/8532223761101928591/2e5c70ad-89f9-4d0d-b659-6492f73724ea.jpg,https://thumbnail6.coupangcdn.com/thumbnails/local/320/image2/PRODUCTREVIEW/202506/30/8532223761101928591/c48fa8ae-b387-481e-a81d-1523092f4f96.jpg,https://thumbnail8.coupangcdn.com/thumbnails/local/320/image2/PRODUCTREVIEW/202506/30/8532223761101928591/fdabc684-e217-425c-88a0-82482947ae85.jpg,https://thumbnail7.coupangcdn.com/thumbnails/local/320/image2/PRODUCTREVIEW/202506/30/8532223761101928591/d644ec20-1af4-4a0f-a404-73602171c176.jpg"
3,5,2025.06.23,또박또박,가성비 갑!,"실사용 기준으로 애플워치 SE 2세대 40mm 모델은 ‘애플워치 입문자’에게 가장 무난한 선택지다. 일단 외관은 알루미늄 케이스라 가볍고, 밴드는 부드러운 실리콘 재질이라 하루 종일 차고 있어도 손목에 큰 부담이 없다. 내가 구매한 색상은 밝은 톤이라 어느 옷차림에도 자연스럽게 잘 어울리는 편. 평소 스타일을 해치지 않으면서 데일리용으로 무난하게 소화된다.
화면 크기는 40mm지만 시인성은 꽤 괜찮다. 햇빛 아래서도 잘 보이고, 터치 반응도 빠릿하다. 앱 배열이나 기본 인터페이스는 익숙해지면 조작도 간편하고 직관적이다. 운동 기록, 심박수, 알림 확인, 통화 수신까지 스마트워치의 기본 기능은 빠짐없이 탑재되어 있고, 특히 운동할 때 자동 감지 기능이 은근히 유용했다. LTE 모델은 아니지만 아이폰과 함께 사용할 경우 불편함 거의 없었고, 블루투스로 잘 연동된다.
배터리는 하루 반~이틀 정도 유지되며, 자기 전에 충전하는 루틴만 잡으면 크게 불편하지 않다. 충전 속도는 빠르진 않지만 무난하다. 또 하나 좋았던 점은 ‘포인트 충전’이 아니라 진짜 일상 전체를 기록해준다는 점. 걸음 수, 서기 알림, 수면 측정 등 건강 루틴 챙기기에도 적합하다.
단점이라면 워치페이스 종류가 Pro 모델에 비해 제한적이라는 점, 그리고 혈중산소·심전도 기능이 빠져 있다는 정도인데, 일반적인 실사용에서는 크게 불편하지 않았다. 가격을 생각하면 이 정도 스펙이면 꽤 합리적이다. 간단히 말해 기능은 실속 있고, 디자인은 깔끔하며, 무게는 가볍다. 애플워치를 처음 써보거나 너무 비싼 모델은 부담스러운 사람에게 딱 좋은 선택.",8.0,"https://thumbnail9.coupangcdn.com/thumbnails/local/320/image2/PRODUCTREVIEW/202506/23/4276146606989773505/a879d5b8-60a0-4b9c-9f19-947033d01549.jpg,https://thumbnail8.coupangcdn.com/thumbnails/local/320/image2/PRODUCTREVIEW/202506/23/4276146606989773505/a41753a3-d9a2-41a7-be44-8376865b6e24.jpg,https://thumbnail6.coupangcdn.com/thumbnails/local/320/image2/PRODUCTREVIEW/202506/23/4276146606989773505/522c60b7-287e-4197-8b31-69423864bdd8.jpg,https://thumbnail6.coupangcdn.com/thumbnails/local/320/image2/PRODUCTREVIEW/202506/23/4276146606989773505/c9960ddc-bada-481a-bffd-57f362595d20.jpg,https://thumbnail8.coupangcdn.com/thumbnails/local/320/image2/PRODUCTREVIEW/202506/23/4276146606989773505/f5a946bf-05c9-4809-8452-244fc6728ca7.jpg,https://thumbnail6.coupangcdn.com/thumbnails/local/320/image2/PRODUCTREVIEW/202506/23/4276146606989773505/c039f801-f421-4d00-9870-4c89c470b285.jpg,https://thumbnail10.coupangcdn.com/thumbnails/local/320/image2/PRODUCTREVIEW/202506/23/4276146606989773505/2efb9db6-0b46-4951-a675-7d73ae448814.jpg,https://thumbnail6.coupangcdn.com/thumbnails/local/320/image2/PRODUCTREVIEW/202506/23/4276146606989773505/e0b837a0-fe08-46db-bb43-f2b44bf597e6.jpg"
4,5,2025.06.30,김*기,애플워치 없이 살다가 드디어 입문!,"워치는 없어도 되겠지 하고 살다가,
간편한 알림 확인 때문에
결국 애플워치 SE2 40mm를 구매하게 됐어요~
결론부터 말하자면…
왜 이제 샀나 싶을 정도로 만족 중이에요!
원래는 삼성폰에서 갤워치랑같이 사용중이였는데
갤워치랑 애플폰이랑 호완이 안되서 없이살었었거든요 ㅜㅜ
먼저 크기는 40mm로 선택했는데,
여자라 손목이 가는 편이라 부담 없고 딱 예쁘게 잘 맞아요
디자인도 깔끔하고 가볍게 착용되니까
데일리로 손이 자주 가더라구요~
가장 좋았던 건 운동할 때!
아이케어할때 핸드폰을 안꺼내도 되니
저절로 바닥에 떨어트리지 않아
액정필름 자주 안갈아도 되겠더라고요 ㅋㅋ
폰 꺼내기 번거로운 순간들에도 손목으로 바로 알림 확인하고,
전화 받는 것도 꽤 편하더라고요~
배터리도 생각보다 오래가서 하루는 무난하게 사용 가능했고
고속충전안된다해서 뭔가 찜찜했는데
굳이.. 제생각엔 일반충전도 금방 되서 굳이
필요가 없더라고요 ㅋㅋ
갤워치있다 폰갈아타면서 불편하게 없이 살던 제게는
진짜 신세계였어요~
특히 간단한기능과 알림들확인만하고 잡다한 기능을 두르두르 필요없는분들은 본시리즈보다
가성비 좋고 심플한 SE2도 충분히 만족스러울 것 같아요~
처음 애플워치 입문하시는 분들께
자신 있게 추천할 수 있는 제품이에요~!",2.0,"https://thumbnail9.coupangcdn.com/thumbnails/local/320/image2/PRODUCTREVIEW/202506/30/3150305968332900832/c794518d-28e2-4550-89ba-5301cfef01d4.jpg,https://thumbnail9.coupangcdn.com/thumbnails/local/320/image2/PRODUCTREVIEW/202506/30/3150305968332900832/00098db9-c59f-4baa-92fd-6a1a938ce926.jpg,https://thumbnail6.coupangcdn.com/thumbnails/local/320/image2/PRODUCTREVIEW/202506/30/3150305968332900832/7ba4ad6b-30e0-4c28-b17b-1c8199df47d0.jpg,https://thumbnail10.coupangcdn.com/thumbnails/local/320/image2/PRODUCTREVIEW/202506/30/3150305968332900832/6f5e74b9-a7a5-4fce-bb40-dc767976ff68.jpg,https://thumbnail9.coupangcdn.com/thumbnails/local/320/image2/PRODUCTREVIEW/202506/30/3150305968332900832/ca62714f-ae12-4b90-9939-e35b963b4a9b.jpg"
5,5,2025.07.05,최*영,"후회없어요, 잘한선택입니다!","초등학교 6학년 딸아이 생일 선물로 애플워치 SE 2세대 40mm 스타라이트를 구매했습니다.
딸이 꼭 **아이보리 계열 밴드(스타라이트 밴드)**를 원해서 매장도 방문해봤지만,
같은 구성으로 쿠팡에서 더 저렴하게 구매할 수 있어 선택하게 됐어요.
실물로 받아보니 전체적인 마감과 품질이 매우 우수했고,
밴드 색상도 톤다운된 따뜻한 아이보리 컬러라 고급스럽고 깔끔합니다.
스타라이트 본체와의 색 조화도 훌륭해서 아이도 정말 만족해하더라고요.
40mm 사이즈는 아이 손목에 너무 크지 않으면서도 디스플레이 시인성도 좋아
학생이 사용하기에 딱 알맞은 사이즈였습니다.
기능도 충실하게 작동되고, 알림 확인·시간관리·운동 기록 등 기본 기능이 안정적이에요.
특히 아이가 좋아하는 시계 페이스 꾸미기 기능도 다양해서,
실용성과 재미를 모두 갖춘 선물로 손색이 없습니다.
배터리는 하루 반 정도 사용 가능합니다.
알림 기능과 심박 측정 등이 기본 활성화된 상태에서도
하루는 넉넉하게, 이틀은 충전 없이 어렵지만 이정도 배터리기능으로 충분히 만족스러웠어요.
한줄 요약
딸아이가 원하던 컬러, 원하는 기능 모두 갖춘 완벽한 선물! 디자인, 성능, 배터리까지 만족합니다.",1.0,"https://thumbnail10.coupangcdn.com/thumbnails/local/320/image2/PRODUCTREVIEW/202507/5/8447366466404012903/c53fa515-4362-4618-a17a-07424b45f014.jpg,https://thumbnail7.coupangcdn.com/thumbnails/local/320/image2/PRODUCTREVIEW/202507/5/8447366466404012903/f3ba070b-3d7f-4cd5-8656-8219a70e516b.jpg,https://thumbnail10.coupangcdn.com/thumbnails/local/320/image2/PRODUCTREVIEW/202507/5/8447366466404012903/2751df2e-df6e-4bf4-b1d5-54487cc24a7f.jpg,https://thumbnail6.coupangcdn.com/thumbnails/local/320/image2/PRODUCTREVIEW/202507/5/8447366466404012903/5a0b45e9-187d-401a-9b52-aff570b2622f.jpg,https://thumbnail8.coupangcdn.com/thumbnails/local/320/image2/PRODUCTREVIEW/202507/5/8447366466404012903/3315f9d8-5ad8-423c-8cbb-bb6193b7c445.jpg,https://thumbnail8.coupangcdn.com/thumbnails/local/320/image2/PRODUCTREVIEW/202507/5/8447366466404012903/3a22e3af-b9ca-4218-adb3-f1db83ce20f4.jpg,https://thumbnail8.coupangcdn.com/thumbnails/local/320/image2/PRODUCTREVIEW/202507/5/8447366466404012903/d941932f-c14f-441b-bf78-8c5d5c8c7cfe.jpg,https://thumbnail10.coupangcdn.com/thumbnails/local/320/image2/PRODUCTREVIEW/202507/5/8447366466404012903/a06bf134-fc9f-4a2e-8c6a-7223ae5eaca1.jpg"
6,5,2025.06.14,부리부리뷰,나의 첫 스마트워치,"이런저런 이유로 스마트워치를 써야할 일이 생겨서 아이폰 유저인 저는 애플워치를 선택하게 되었어요 ㅋㅋ 고심한 끝에 SE2로 정했는데 꽤 만족스러워요
우선 제품을 받았을 때 정말 기대가 컸어요! 패키지가 깔끔하게 포장되어 있어서 첫인상부터 좋았고, 디자인도 세련돼서 한눈에 반했어요. 특히 이 제품의 색상이 너무 예뻐서 어떤 옷에든 잘 어울릴 것 같아요.
착용해보니 정말 가벼워서 하루 종일 착용해도 전혀 부담이 없었어요. 처음에는 조금 뻑뻑한 느낌이 있었지만, 금방 적응됐고 편안함이 느껴졌어요. 특히 운동할 때도 전혀 방해가 되지 않아서 좋았어요.
주요 기능으로는 운동 기록과 알림 확인을 주로 사용하고 있어요. 운동할 때는 걸음 수와 칼로리 소모량을 체크할 수 있어서 운동 동기부여가 많이 되더라고요. 알림 기능도 정말 유용해요. 중요한 메시지를 놓칠 일이 없어졌어요. 수면 추적 기능도 있어 잘 자고 있는지 체크할 수 있어서 좋았어요.
배터리 수명은 예상보다 훨씬 좋았어요. 하루 종일 사용해도 2~3일은 거뜬히 버텨주니까 충전 걱정을 덜 수 있어서 편리해요.
가장 마음에 드는 점은 디자인과 기능이 조화를 이루는 점이에요. 세련된 디자인 덕분에 패션 아이템으로도 손색이 없고, 다양한 기능 덕분에 실생활에서 유용하게 사용할 수 있어요.
아쉬운 점이 있다면, 가끔 알림이 늦게 오는 경우가 있어서 그 부분은 개선되었으면 좋겠어요. 하지만 전체적으로는 정말 만족스러운 제품이에요.
전반적으로 이 제품은 정말 추천할 만해요! 운동을 즐기시는 분들, 혹은 일상에서 스마트한 기기를 찾고 계신 분들께 강력히 추천드려요. 이 제품으로 삶의 질이 한층 높아질 거예요!",15.0,"https://thumbnail10.coupangcdn.com/thumbnails/local/320/image2/PRODUCTREVIEW/202506/14/2660292082238826091/b7e1d0a1-a362-4ad2-bc54-df09ded10264.jpg,https://thumbnail9.coupangcdn.com/thumbnails/local/320/image2/PRODUCTREVIEW/202506/14/2660292082238826091/48b02083-9346-4721-bf4e-5ecd022154eb.jpg,https://thumbnail7.coupangcdn.com/thumbnails/local/320/image2/PRODUCTREVIEW/202506/14/2660292082238826091/e2597d4a-8d7f-4807-baf2-4dca5f8bbd09.jpg,https://thumbnail7.coupangcdn.com/thumbnails/local/320/image2/PRODUCTREVIEW/202506/14/2660292082238826091/1c90ddcc-4056-43b7-9f36-98e930d26406.jpg,https://thumbnail9.coupangcdn.com/thumbnails/local/320/image2/PRODUCTREVIEW/202506/14/2660292082238826091/668a6003-330f-4136-9594-fcd31748c0cc.jpg,https://thumbnail8.coupangcdn.com/thumbnails/local/320/image2/PRODUCTREVIEW/202506/14/2660292082238826091/1480e79d-b643-4a9b-b7ab-0a5f5a48b7ce.jpg,https://thumbnail8.coupangcdn.com/thumbnails/local/320/image2/PRODUCTREVIEW/202506/14/2660292082238826091/669dc3ee-2de0-4694-91c2-be08bb96b2bf.jpg,https://thumbnail8.coupangcdn.com/thumbnails/local/320/image2/PRODUCTREVIEW/202506/14/2660292082238826091/d9875a20-f6e8-42ca-adc4-709c75450988.jpg"
7,5,2025.06.14,멍이,실속파 애플워치 입문자에게 추천!,"내돈내산 Apple 정품 2024 애플워치 SE 2세대 44mm 후기
1. 구매 이유
평소에 스마트워치에 관심이 많았는데, iPhone과의 연동이 가장 자연스러운 애플워치를 결국 선택하게 됐어요. 처음에는 시리즈 9나 울트라 모델도 고민했지만, 무게나 가격, 배터리 효율 등을 고려했을 때 SE 2세대가 제일 합리적인 선택 같았어요. 특히 데님 스포츠 밴드 색감이 너무 예뻐서 실버 알루미늄 케이스랑 조합했을 때 심플하면서도 깔끔한 분위기가 마음에 들었어요.
2. 받아본 상품 상태
애플 특유의 간결한 패키지답게 정갈하게 포장되어 있었고, 구성품도 알차게 잘 정리되어 있었어요. 워치 본체와 밴드가 각각 개별 포장되어 있어서 조립하는 재미도 있었고, 외관은 기스 하나 없이 아주 깔끔한 상태로 도착했어요. 포장 열자마자 전원을 켜보니 빠르게 부팅되었고, iPhone과의 연동도 생각보다 훨씬 빠르고 간단했어요.
3. 사용감과 기능
기존에 피트니스 트래커만 쓰다가 스마트워치는 처음이라 기능이 많아서 놀랐어요. 운동 기록, 심박수 체크, 수면 추적, 알람, 메시지 확인까지 생각 이상으로 유용하게 쓰고 있어요. 특히 심플하지만 반응 빠른 UI 덕분에 스트레스 없이 사용 중이에요. 44mm 사이즈는 남녀공용으로 부담 없는 크기고, 실버 케이스라 어떤 스타일에도 잘 어울려요. 데님 밴드는 생각보다 더 고급스러운 질감이라 캐주얼한 데일리룩에 특히 잘 어울려서 만족도 높아요.
4. 배터리와 실사용 편의성
하루 종일 알림, 운동 기록, 수면 측정까지 다 켜두고 사용해도 배터리가 1.5~2일은 충분히 가서 충전 스트레스도 적어요. 특히 아이폰과의 연동이 자연스러워서 알림만 받아보는 용도라도 활용도가 꽤 높아요. 수면 모드나 워크아웃 모드 전환도 빠르고 직관적이에요. 일상생활에서 시계+헬스케어+간단한 알림 허브 역할을 아주 잘 해주고 있어서 만족스럽습니다.
5. 만족한 부분과 아쉬운 부분
# 만족한 부분
- iPhone과의 연동이 매우 빠르고 간단함
- 데님 밴드와 실버 조합이 심플하면서 세련됨
- 운동, 알림, 수면 등 실사용 기능이 유용함
- 배터리 효율이 좋아서 충전 부담이 적음
# 아쉬운 부분
- 시리즈 9에 비해 디스플레이 밝기나 상시 표시 기능이 없음
- 데님 밴드는 약간 뻣뻣하게 느껴질 수 있어 적응 필요
- 고급스러운 느낌보다는 실용적인 디자인 중심이라 취향을 탈 수 있음
6. 총평
화려한 기능보다는 실속과 효율을 중시한다면 SE 2세대는 정말 가성비 좋은 선택이에요. 기본적인 헬스케어 기능부터 알림 확인까지 일상에서 필요한 기능은 전부 잘 갖춰져 있고, iPhone 사용자라면 연결성도 만족스러워요. 데님 스포츠 밴드도 의외로 캐주얼한 옷차림에 아주 잘 어울려서 스타일링 면에서도 기대 이상이었어요. 워치 입문용이나 부담 없는 스마트워치를 찾는 분께 추천합니다.",14.0,"https://video.coupangcdn.com/cloud/PRODUCTREVIEW/202506/14/7274829957441478213/fcfa301f-d1e8-415a-bec7-67a300738699/transcode/thumbnail-00001.png,https://thumbnail10.coupangcdn.com/thumbnails/local/320/image2/PRODUCTREVIEW/202506/14/7274829957441478213/4cae7829-f14a-44bb-b9c5-74fce3d965ae.jpg,https://thumbnail7.coupangcdn.com/thumbnails/local/320/image2/PRODUCTREVIEW/202506/14/7274829957441478213/66a146c5-e76c-4eec-bfa8-1b164c4c39e9.jpg,https://thumbnail6.coupangcdn.com/thumbnails/local/320/image2/PRODUCTREVIEW/202506/14/7274829957441478213/c5bfa6a2-574d-4535-a3b7-c3301d24dd68.jpg,https://thumbnail10.coupangcdn.com/thumbnails/local/320/image2/PRODUCTREVIEW/202506/14/7274829957441478213/53780135-aa2f-419a-b02c-d5d0e18a6f11.jpg,https://thumbnail8.coupangcdn.com/thumbnails/local/320/image2/PRODUCTREVIEW/202506/14/7274829957441478213/72840065-33c3-4f72-a091-8f5a1d0e99f0.jpg,https://thumbnail8.coupangcdn.com/thumbnails/local/320/image2/PRODUCTREVIEW/202506/14/7274829957441478213/1d921579-7271-45dc-b547-621a8c27ba64.jpg,https://thumbnail9.coupangcdn.com/thumbnails/local/320/image2/PRODUCTREVIEW/202506/14/7274829957441478213/c00a84f3-cbea-4973-8005-df9552ea527e.jpg,https://thumbnail7.coupangcdn.com/thumbnails/local/320/image2/PRODUCTREVIEW/202506/14/7274829957441478213/d673d107-364f-460f-a141-f2c409597cfd.jpg,https://thumbnail6.coupangcdn.com/thumbnails/local/320/image2/PRODUCTREVIEW/202506/14/7274829957441478213/345dd9a0-5ae8-4602-900b-8248afdb4af2.jpg,https://thumbnail10.coupangcdn.com/thumbnails/local/320/image2/PRODUCTREVIEW/202506/14/7274829957441478213/85bdce85-2573-426d-a2ba-42e6784a18f9.jpg"
